{
  "naive": {
    "retrieval_metrics": {
      "hit_rate": 0.4,
      "mrr": 0.3,
      "avg_latency_ms": 4601.668262481689
    },
    "detailed_results": [
      {
        "question": "Que stipule l'article L. 217-4 concernant l'usage spécial recherché par le consommateur ?",
        "answer": "L'article L421-2 ne concerne pas directement la question posée. \n\nL'article L221-22 ne traite pas non plus de l'usage spécial recherché par le consommateur.\n\nEn revanche, l'article L611-2 ne permet pas de répondre à la question posée.\n\nPar conséquent, je ne dispose pas d'informations suffisantes pour répondre à la question concernant l'article L. 217-4.",
        "contexts": [
          "Article L421-2\n\nLes produits destinés aux consommateurs ou susceptibles, dans des conditions raisonnablement prévisibles,\nd'être utilisés par les consommateurs même s'ils ne leur sont pas destinés satisfont aux dispositions du\nrèglement (UE) 2023/988 du Parlement européen et du Conseil du 10 mai 2023 relatif à la sécurité générale\ndes produits, modifiant le règlement (UE) n° 1025/2012 du Parlement européen et du Conseil et la directive\n\n\n(UE) 2020/1828 du Parlement européen et du Conseil, et abrogeant la directive 2001/95/ CE du Parlement\neuropéen et du Conseil et la directive 87/357/ CEE du Conseil.",
          "Article L221-22\nLa charge de la preuve de l'exercice du droit de rétractation dans les conditions prévues à l'article L. 221-21\npèse sur le consommateur.",
          "Article L611-2\n\nLa médiation de la consommation s'applique à un litige national ou transfrontalier entre un consommateur et\nun professionnel. Elle est régie par les dispositions du présent titre ainsi que, dans la mesure où elles ne leur\nsont pas contraires, par celles du chapitre Ier du titre II de la loi du 8 février 1995 mentionnée à l'article L.\n611-1."
        ],
        "ground_truth": "Le bien est conforme s'il est propre à tout usage spécial recherché par le consommateur, porté à la connaissance du vendeur au moment de la conclusion du contrat et accepté par ce dernier.",
        "expected_article": "Article L. 217-4",
        "retrieved_articles": [
          "L421-2",
          "L221-22",
          "L611-2"
        ],
        "question_type": "Explicite",
        "latency_ms": 13072.676181793213
      },
      {
        "question": "Si un acheteur précise une exigence spécifique au vendeur lors de l'achat et que celui-ci l'accepte, le produit doit-il respecter cette exigence pour être considéré comme conforme ?",
        "answer": "Selon l'article L217-5 du Code de la consommation, le bien est conforme s'il correspond notamment aux caractéristiques que le consommateur peut légitimement attendre, en tenant compte des déclarations publiques faites par le vendeur. Si un acheteur précise une exigence spécifique au vendeur lors de l'achat et que celui-ci l'accepte, le produit doit effectivement respecter cette exigence pour être considéré comme conforme. En effet, le vendeur est tenu de respecter les caractéristiques convenues lors de la conclusion du contrat, et le consommateur peut légitimement s'attendre à ce que le bien corresponde à ses exigences spécifiques.",
        "contexts": [
          "Article L217-12\nLe vendeur peut ne pas procéder selon le choix opéré par le consommateur si la mise en conformité sollicitée\nest impossible ou entraîne des coûts disproportionnés au regard notamment :\n1° De la valeur qu'aurait le bien en l'absence de défaut de conformité ;\n2° De l'importance du défaut de conformité ; et\n3° De la possibilité éventuelle d'opter pour l'autre choix sans inconvénient majeur pour le consommateur.\nLe vendeur peut refuser la mise en conformité du bien si celle-ci est impossible ou entraîne des coûts\ndisproportionnés notamment au regard des 1° et 2°.\nLorsque ces conditions ne sont pas respectées, le consommateur peut, après mise en demeure, poursuivre\nl'exécution forcée en nature de la solution initialement sollicitée, conformément aux articles 1221 et suivants\ndu code civil.\nTout refus par le vendeur de procéder selon le choix du consommateur ou de mettre le bien en conformité,\nest motivé par écrit ou sur support durable.",
          "Article L217-9\nLe consommateur est en droit d'exiger la mise en conformité du bien aux critères énoncés dans la sous-\nsection 1 de la présente section.\nLe consommateur sollicite auprès du vendeur la mise en conformité du bien, en choisissant entre la\nréparation et le remplacement. A cette fin, le consommateur met le bien à la disposition du vendeur.",
          "Article L217-5\nI.-En plus des critères de conformité au contrat, le bien est conforme s'il répond aux critères suivants :\n1° Il est propre à l'usage habituellement attendu d'un bien de même type, compte tenu, s'il y a lieu, de toute\ndisposition du droit de l'Union européenne et du droit national ainsi que de toutes les normes techniques ou,\nen l'absence de telles normes techniques, des codes de conduite spécifiques applicables au secteur concerné ;\n2° Le cas échéant, il possède les qualités que le vendeur a présentées au consommateur sous forme\nd'échantillon ou de modèle, avant la conclusion du contrat ;\n3° Le cas échéant, les éléments numériques qu'il comporte sont fournis selon la version la plus récente qui\nest disponible au moment de la conclusion du contrat, sauf si les parties en conviennent autrement ;\n4° Le cas échéant, il est délivré avec tous les accessoires, y compris l'emballage, et les instructions\nd'installation que le consommateur peut légitimement attendre ;\n5° Le cas échéant, il est fourni avec les mises à jour que le consommateur peut légitimement attendre,\nconformément aux dispositions de l'article L. 217-19 ;\n6° Il correspond à la quantité, à la qualité et aux autres caractéristiques, y compris en termes de durabilité,\nde fonctionnalité, de compatibilité et de sécurité, que le consommateur peut légitimement attendre pour des\nbiens de même type, eu égard à la nature du bien ainsi qu'aux déclarations publiques faites par le vendeur,\npar toute personne en amont dans la chaîne de transactions, ou par une personne agissant pour leur compte, y\ncompris dans la publicité ou sur l'étiquetage.\nII.-Toutefois, le vendeur n'est pas tenu par toutes déclarations publiques mentionnées à l'alinéa qui précède\ns'il démontre :\n1° Qu'il ne les connaissait pas et n'était légitimement pas en mesure de les connaître ;\n2° Qu'au moment de la conclusion du contrat, les déclarations publiques avaient été rectifiées dans des\nconditions comparables aux déclarations initiales ; ou\n3° Que les déclarations publiques n'ont pas pu avoir d'influence sur la décision d'achat.\nIII.-Le consommateur ne peut contester la conformité en invoquant un défaut concernant une ou plusieurs\ncaractéristiques particulières du bien, dont il a été spécifiquement informé qu'elles s'écartaient des critères\nde conformité énoncés au présent article, écart auquel il a expressément et séparément consenti lors de la\nconclusion du contrat."
        ],
        "ground_truth": "Oui, le respect de l'usage spécial validé par le vendeur devient un critère de conformité contractuel.",
        "expected_article": "Article L. 217-4",
        "retrieved_articles": [
          "L217-12",
          "L217-9",
          "L217-5"
        ],
        "question_type": "Conceptuelle",
        "latency_ms": 2144.1831588745117
      },
      {
        "question": "J'ai acheté un ordinateur en précisant au vendeur que je voulais faire du montage vidéo 4K, ce qu'il a validé. Or, l'ordinateur plante dès que je lance un rendu. Puis-je invoquer un défaut de conformité même si l'ordinateur fonctionne bien pour de la bureautique ?",
        "answer": "Oui, vous pouvez invoquer un défaut de conformité en vertu de l'article L224-25-19 du Code de la consommation. En effet, selon cet article, le professionnel peut refuser la mise en conformité si elle s'avère impossible ou entraîne des coûts disproportionnés, mais il doit motiver ce refus par écrit ou sur support durable. Si l'ordinateur que vous avez acheté plante dès que vous lancez un rendu vidéo 4K alors que vous avez expressément informé le vendeur de votre besoin en la matière, cela peut être considéré comme un défaut de conformité, car l'ordinateur ne correspond pas à l'usage auquel vous destinez. Vous pouvez donc demander au professionnel de mettre l'ordinateur en conformité avec vos attentes, conformément aux dispositions de l'article L224-25-19.",
        "contexts": [
          "Article L224-25-19\n\nLe professionnel peut refuser la mise en conformité si elle s'avère impossible ou entraîne des coûts\ndisproportionnés, au regard notamment de l'importance du défaut de conformité et de la valeur du contenu\nnumérique ou du service numérique en l'absence de défaut.\nDès lors que ces conditions ne sont pas respectées, le consommateur peut, après mise en demeure, poursuivre\nl'exécution forcée en nature de la mise en conformité sollicitée conformément aux articles 1221 et suivants\ndu code civil.\nTout refus du professionnel de mettre le contenu numérique ou le service numérique en conformité est\nmotivé par écrit ou sur support durable.",
          "Article L217-7\nLes défauts de conformité qui apparaissent dans un délai de vingt-quatre mois à compter de la délivrance du\nbien, y compris du bien comportant des éléments numériques, sont, sauf preuve contraire, présumés exister\n\nau moment de la délivrance, à moins que cette présomption ne soit incompatible avec la nature du bien ou du\ndéfaut invoqué.\nPour les biens d'occasion, ce délai est fixé à douze mois.\nLorsque le contrat de vente d'un bien comportant des éléments numériques prévoit la fourniture continue\nd'un contenu numérique ou d'un service numérique, sont présumés exister au moment de la délivrance du\nbien les défauts de conformité qui apparaissent :\n1° Durant un délai de deux ans à compter de la délivrance du bien, lorsque le contrat prévoit cette fourniture\npendant une durée inférieure ou égale à deux ans ou lorsque le contrat ne détermine pas la durée de\nfourniture ;\n2° Durant la période durant laquelle le contenu numérique ou le service numérique est fourni en vertu du\ncontrat, lorsque celui-ci prévoit cette fourniture pendant une durée supérieure à deux ans.\nSous-section 2 : Mise en œuvre de la garantie légale de conformité",
          "Article L224-25-16\n\nI.-Les défauts de conformité qui apparaissent dans un délai de douze mois à compter de la fourniture du\ncontenu numérique ou du service numérique sont présumés exister au moment de cette fourniture, sauf\npreuve contraire.\nLorsque le contrat prévoit la fourniture continue du contenu numérique ou du service numérique pendant une\npériode donnée, la charge de la preuve quant à la question de savoir si le contenu numérique ou le service\nnumérique était conforme au cours de la période contractuelle de fourniture, incombe au professionnel dans\nle cas d'un défaut de conformité apparaissant au cours de cette période.\nII.-Le professionnel n'est pas responsable du défaut de conformité s'il démontre que celui-ci est directement\nimputable à l'incompatibilité entre le contenu numérique ou le service numérique et l'environnement\nnumérique du consommateur, et que le consommateur avait été informé par le professionnel des exigences\ntechniques de compatibilité de ce contenu ou service avant la conclusion du contrat.\nLe consommateur est tenu de coopérer avec le professionnel, dans la mesure de ce qui est raisonnablement\npossible, nécessaire et le moins intrusif pour lui, afin de déterminer si le défaut de conformité est causé par\ncette incompatibilité. Dans le cas contraire, la charge de la preuve mentionnée au premier ou au deuxième\nalinéa du I du présent article, incombe au consommateur à la condition que le consommateur ait été informé\nde façon claire et compréhensible de son obligation de coopérer avant la conclusion du contrat.\n\nParagraphe 2 : Mise en œuvre de la garantie légale de conformité"
        ],
        "ground_truth": "Oui, vous pouvez invoquer un défaut de conformité car le bien n'est pas propre à l'usage spécial que vous avez spécifié et qui a été accepté par le vendeur.",
        "expected_article": "Article L. 217-4",
        "retrieved_articles": [
          "L224-25-19",
          "L217-7",
          "L224-25-16"
        ],
        "question_type": "Complexe",
        "latency_ms": 2265.7980918884277
      },
      {
        "question": "Quels sont les critères de conformité énumérés à l'article L. 217-5 en plus des critères du contrat ?",
        "answer": "Selon l'article L217-5 du Code de la consommation, les critères de conformité d'un bien en plus des critères du contrat sont les suivants :\n1. Le bien doit être propre à l'usage habituellement attendu d'un bien de même type.\n2. Le bien doit posséder les qualités présentées par le vendeur avant la conclusion du contrat.\n3. Les éléments numériques du bien doivent être fournis selon la version la plus récente disponible au moment de la conclusion du contrat, sauf accord contraire des parties.\n4. Le bien doit être délivré avec tous les accessoires, y compris l'emballage, et les instructions d'installation que le consommateur peut légitimement attendre.\n5. Le bien doit être fourni avec les mises à jour que le consommateur peut légitimement attendre.\n6. Le bien doit correspondre à la quantité, à la qualité et aux autres caractéristiques que le consommateur peut légitimement attendre pour des biens de même type, en tenant compte des déclarations publiques faites par le vendeur ou toute personne en amont dans la chaîne de transactions.\n\nCes critères complètent les critères de conformité prévus par le contrat entre le vendeur et le consommateur.",
        "contexts": [
          "Article L217-5\nI.-En plus des critères de conformité au contrat, le bien est conforme s'il répond aux critères suivants :\n1° Il est propre à l'usage habituellement attendu d'un bien de même type, compte tenu, s'il y a lieu, de toute\ndisposition du droit de l'Union européenne et du droit national ainsi que de toutes les normes techniques ou,\nen l'absence de telles normes techniques, des codes de conduite spécifiques applicables au secteur concerné ;\n2° Le cas échéant, il possède les qualités que le vendeur a présentées au consommateur sous forme\nd'échantillon ou de modèle, avant la conclusion du contrat ;\n3° Le cas échéant, les éléments numériques qu'il comporte sont fournis selon la version la plus récente qui\nest disponible au moment de la conclusion du contrat, sauf si les parties en conviennent autrement ;\n4° Le cas échéant, il est délivré avec tous les accessoires, y compris l'emballage, et les instructions\nd'installation que le consommateur peut légitimement attendre ;\n5° Le cas échéant, il est fourni avec les mises à jour que le consommateur peut légitimement attendre,\nconformément aux dispositions de l'article L. 217-19 ;\n6° Il correspond à la quantité, à la qualité et aux autres caractéristiques, y compris en termes de durabilité,\nde fonctionnalité, de compatibilité et de sécurité, que le consommateur peut légitimement attendre pour des\nbiens de même type, eu égard à la nature du bien ainsi qu'aux déclarations publiques faites par le vendeur,\npar toute personne en amont dans la chaîne de transactions, ou par une personne agissant pour leur compte, y\ncompris dans la publicité ou sur l'étiquetage.\nII.-Toutefois, le vendeur n'est pas tenu par toutes déclarations publiques mentionnées à l'alinéa qui précède\ns'il démontre :\n1° Qu'il ne les connaissait pas et n'était légitimement pas en mesure de les connaître ;\n2° Qu'au moment de la conclusion du contrat, les déclarations publiques avaient été rectifiées dans des\nconditions comparables aux déclarations initiales ; ou\n3° Que les déclarations publiques n'ont pas pu avoir d'influence sur la décision d'achat.\nIII.-Le consommateur ne peut contester la conformité en invoquant un défaut concernant une ou plusieurs\ncaractéristiques particulières du bien, dont il a été spécifiquement informé qu'elles s'écartaient des critères\nde conformité énoncés au présent article, écart auquel il a expressément et séparément consenti lors de la\nconclusion du contrat.",
          "Article L217-4\nLe bien est conforme au contrat s'il répond notamment, le cas échéant, aux critères suivants :\n1° Il correspond à la description, au type, à la quantité et à la qualité, notamment en ce qui concerne la\nfonctionnalité, la compatibilité, l'interopérabilité, ou toute autre caractéristique prévues au contrat ;\n2° Il est propre à tout usage spécial recherché par le consommateur, porté à la connaissance du vendeur au\nplus tard au moment de la conclusion du contrat et que ce dernier a accepté ;\n3° Il est délivré avec tous les accessoires et les instructions d'installation, devant être fournis conformément\nau contrat ;\n4° Il est mis à jour conformément au contrat.",
          "Article L215-4\nLes dispositions des articles L. 215-1 à L. 215-3 et L. 241-3 sont intégralement reproduites dans les contrats\nde prestation de services auxquels elles s'appliquent."
        ],
        "ground_truth": "Le bien doit être propre à l'usage habituellement attendu d'un bien de même type et posséder les qualités que le consommateur peut légitimement attendre eu égard aux déclarations publiques (publicité, étiquetage).",
        "expected_article": "Article L. 217-5",
        "retrieved_articles": [
          "L217-5",
          "L217-4",
          "L215-4"
        ],
        "question_type": "Explicite",
        "latency_ms": 4050.3971576690674
      },
      {
        "question": "Un produit doit-il nécessairement correspondre à l'usage habituellement attendu d'un bien de même type pour être conforme ?",
        "answer": "Oui, selon l'article L217-5 I.1° du Code de la consommation, pour qu'un bien soit conforme au contrat, il doit être propre à l'usage habituellement attendu d'un bien de même type. Cela signifie que le produit doit correspondre aux attentes normales que peut avoir un consommateur pour un bien similaire. Ainsi, cette conformité à l'usage habituellement attendu est l'un des critères essentiels pour déterminer si un bien respecte le contrat de vente.",
        "contexts": [
          "Article L217-4\nLe bien est conforme au contrat s'il répond notamment, le cas échéant, aux critères suivants :\n1° Il correspond à la description, au type, à la quantité et à la qualité, notamment en ce qui concerne la\nfonctionnalité, la compatibilité, l'interopérabilité, ou toute autre caractéristique prévues au contrat ;\n2° Il est propre à tout usage spécial recherché par le consommateur, porté à la connaissance du vendeur au\nplus tard au moment de la conclusion du contrat et que ce dernier a accepté ;\n3° Il est délivré avec tous les accessoires et les instructions d'installation, devant être fournis conformément\nau contrat ;\n4° Il est mis à jour conformément au contrat.",
          "Article L217-5\nI.-En plus des critères de conformité au contrat, le bien est conforme s'il répond aux critères suivants :\n1° Il est propre à l'usage habituellement attendu d'un bien de même type, compte tenu, s'il y a lieu, de toute\ndisposition du droit de l'Union européenne et du droit national ainsi que de toutes les normes techniques ou,\nen l'absence de telles normes techniques, des codes de conduite spécifiques applicables au secteur concerné ;\n2° Le cas échéant, il possède les qualités que le vendeur a présentées au consommateur sous forme\nd'échantillon ou de modèle, avant la conclusion du contrat ;\n3° Le cas échéant, les éléments numériques qu'il comporte sont fournis selon la version la plus récente qui\nest disponible au moment de la conclusion du contrat, sauf si les parties en conviennent autrement ;\n4° Le cas échéant, il est délivré avec tous les accessoires, y compris l'emballage, et les instructions\nd'installation que le consommateur peut légitimement attendre ;\n5° Le cas échéant, il est fourni avec les mises à jour que le consommateur peut légitimement attendre,\nconformément aux dispositions de l'article L. 217-19 ;\n6° Il correspond à la quantité, à la qualité et aux autres caractéristiques, y compris en termes de durabilité,\nde fonctionnalité, de compatibilité et de sécurité, que le consommateur peut légitimement attendre pour des\nbiens de même type, eu égard à la nature du bien ainsi qu'aux déclarations publiques faites par le vendeur,\npar toute personne en amont dans la chaîne de transactions, ou par une personne agissant pour leur compte, y\ncompris dans la publicité ou sur l'étiquetage.\nII.-Toutefois, le vendeur n'est pas tenu par toutes déclarations publiques mentionnées à l'alinéa qui précède\ns'il démontre :\n1° Qu'il ne les connaissait pas et n'était légitimement pas en mesure de les connaître ;\n2° Qu'au moment de la conclusion du contrat, les déclarations publiques avaient été rectifiées dans des\nconditions comparables aux déclarations initiales ; ou\n3° Que les déclarations publiques n'ont pas pu avoir d'influence sur la décision d'achat.\nIII.-Le consommateur ne peut contester la conformité en invoquant un défaut concernant une ou plusieurs\ncaractéristiques particulières du bien, dont il a été spécifiquement informé qu'elles s'écartaient des critères\nde conformité énoncés au présent article, écart auquel il a expressément et séparément consenti lors de la\nconclusion du contrat.",
          "Article L217-9\nLe consommateur est en droit d'exiger la mise en conformité du bien aux critères énoncés dans la sous-\nsection 1 de la présente section.\nLe consommateur sollicite auprès du vendeur la mise en conformité du bien, en choisissant entre la\nréparation et le remplacement. A cette fin, le consommateur met le bien à la disposition du vendeur."
        ],
        "ground_truth": "Oui, sauf si le consommateur a consenti expressément à une caractéristique particulière s'écartant de ces critères.",
        "expected_article": "Article L. 217-5",
        "retrieved_articles": [
          "L217-4",
          "L217-5",
          "L217-9"
        ],
        "question_type": "Conceptuelle",
        "latency_ms": 1475.2867221832275
      }
    ]
  },
  "advanced": {
    "retrieval_metrics": {
      "hit_rate": 0.6,
      "mrr": 0.6,
      "avg_latency_ms": 6389.705419540405
    },
    "detailed_results": [
      {
        "question": "Que stipule l'article L. 217-4 concernant l'usage spécial recherché par le consommateur ?",
        "answer": "L'article L217-4 du Code de la consommation stipule que le bien est conforme au contrat s'il est propre à tout usage spécial recherché par le consommateur, porté à la connaissance du vendeur au plus tard au moment de la conclusion du contrat et que ce dernier a accepté. Ainsi, si le consommateur informe le vendeur d'un usage spécial qu'il souhaite faire du bien et que le vendeur accepte cette demande, le bien doit être conforme à cet usage spécifique pour être considéré comme conforme au contrat.",
        "contexts": [
          "Article L217-4\nLe bien est conforme au contrat s'il répond notamment, le cas échéant, aux critères suivants :\n1° Il correspond à la description, au type, à la quantité et à la qualité, notamment en ce qui concerne la\nfonctionnalité, la compatibilité, l'interopérabilité, ou toute autre caractéristique prévues au contrat ;\n2° Il est propre à tout usage spécial recherché par le consommateur, porté à la connaissance du vendeur au\nplus tard au moment de la conclusion du contrat et que ce dernier a accepté ;\n3° Il est délivré avec tous les accessoires et les instructions d'installation, devant être fournis conformément\nau contrat ;\n4° Il est mis à jour conformément au contrat.",
          "Article L217-30\nLes dispositions du présent chapitre ne privent pas le consommateur du droit d'exercer l'action résultant de la\ngarantie des vices cachés telle qu'elle résulte des articles 1641 à 1649 du code civil ou toute autre action de\nnature contractuelle ou extracontractuelle qui lui est reconnue par la loi.\nLorsqu'une restriction découlant de la violation des droits de tout tiers, en particulier des droits de propriété\nintellectuelle, empêche ou limite l'utilisation du bien conformément aux dispositions des articles L. 217-4 et\nL. 217-5, la nullité du contrat ou toute autre action de nature contractuelle ou extracontractuelle peuvent être\nencourues par application des dispositions du code civil.",
          "Article L217-9\nLe consommateur est en droit d'exiger la mise en conformité du bien aux critères énoncés dans la sous-\nsection 1 de la présente section.\nLe consommateur sollicite auprès du vendeur la mise en conformité du bien, en choisissant entre la\nréparation et le remplacement. A cette fin, le consommateur met le bien à la disposition du vendeur.",
          "Article L211-2\nI.-Les conditions générales applicables aux contrats de consommation mentionnent, selon des modalités\nfixées par décret :\n1° La nature de l'avantage procuré par le consommateur au sens des articles L. 217-1 et L. 224-25-2 au lieu\nou en complément d'un prix ;\n2° L'existence, les conditions de mise en œuvre et le contenu des garanties légales, en particulier de la\ngarantie légale de conformité pour les biens, les contenus numériques et les services numériques, ainsi que\nde la garantie relative aux vices cachés conformément aux dispositions des articles 1641 à 1649 du code\ncivil, dues par le vendeur ;\n3° Le cas échéant, l'existence d'une garantie commerciale et d'un service après-vente.\nII.-Pour certaines catégories de biens fixées par décret, le document de facturation remis au consommateur\nmentionne l'existence et la durée de la garantie légale de conformité.",
          "Article L224-9\n\nLe consommateur accède gratuitement à ses données de consommation.\nLes modalités d'accès aux données et aux relevés de consommation sont précisées par un décret pris après\navis du Conseil national de la consommation et de la Commission de régulation de l'énergie."
        ],
        "ground_truth": "Le bien est conforme s'il est propre à tout usage spécial recherché par le consommateur, porté à la connaissance du vendeur au moment de la conclusion du contrat et accepté par ce dernier.",
        "expected_article": "Article L. 217-4",
        "retrieved_articles": [
          "L217-4",
          "L217-30",
          "L217-9",
          "L211-2",
          "L224-9"
        ],
        "question_type": "Explicite",
        "latency_ms": 8851.03178024292
      },
      {
        "question": "Si un acheteur précise une exigence spécifique au vendeur lors de l'achat et que celui-ci l'accepte, le produit doit-il respecter cette exigence pour être considéré comme conforme ?",
        "answer": "Selon l'article L217-5 du Code de la consommation, pour qu'un bien soit considéré comme conforme, il doit répondre aux critères énoncés dans cet article, notamment ceux énumérés au paragraphe I. Cela inclut le fait que le bien doit correspondre à la quantité, à la qualité et aux autres caractéristiques que le consommateur peut légitimement attendre pour des biens de même type, en tenant compte des déclarations publiques faites par le vendeur.\n\nSi un acheteur précise une exigence spécifique au vendeur lors de l'achat et que celui-ci l'accepte, le produit doit effectivement respecter cette exigence pour être considéré comme conforme. En effet, si le vendeur accepte une exigence particulière de l'acheteur lors de la conclusion du contrat, cette exigence fait partie des critères que le bien doit remplir pour être conforme aux attentes légitimes du consommateur, conformément à l'article L217-5 du Code de la consommation.",
        "contexts": [
          "Article L217-9\nLe consommateur est en droit d'exiger la mise en conformité du bien aux critères énoncés dans la sous-\nsection 1 de la présente section.\nLe consommateur sollicite auprès du vendeur la mise en conformité du bien, en choisissant entre la\nréparation et le remplacement. A cette fin, le consommateur met le bien à la disposition du vendeur.",
          "Article L217-8\nEn cas de défaut de conformité, le consommateur a droit à la mise en conformité du bien par réparation ou\nremplacement ou, à défaut, à la réduction du prix ou à la résolution du contrat, dans les conditions énoncées\nà la présente sous-section.\nLe consommateur a, par ailleurs, le droit de suspendre le paiement de tout ou partie du prix ou la remise de\nl'avantage prévu au contrat jusqu'à ce que le vendeur ait satisfait aux obligations qui lui incombent au titre du\nprésent chapitre, dans les conditions des articles 1219 et 1220 du code civil.\nLes dispositions du présent chapitre sont sans préjudice de l'allocation de dommages et intérêts.",
          "Article L216-5\nLe professionnel indique par écrit au consommateur lors de son achat, s'il y a lieu, le coût de la livraison\net de mise en service du bien. Un écrit est laissé au consommateur lors de l'entrée en possession du bien,\nmentionnant la possibilité pour le consommateur de formuler des réserves, notamment en cas de défaut du\nbien ou de défaut de remise de la notice d'emploi ou des instructions d'installation.\nL'absence de réserves formulées par le consommateur lors de la réception du bien n'exonère pas le\nprofessionnel de la garantie de conformité du bien qu'il doit au consommateur.",
          "Article L217-10\nLa mise en conformité du bien a lieu dans un délai raisonnable qui ne peut être supérieur à trente jours\nsuivant la demande du consommateur et sans inconvénient majeur pour lui, compte tenu de la nature du bien\net de l'usage recherché par le consommateur.\nLa réparation ou le remplacement du bien non conforme inclut, s'il y a lieu, l'enlèvement et la reprise de ce\nbien et l'installation du bien réparé ou du bien de remplacement par le vendeur.\nUn décret précise les modalités de la mise en conformité du bien.",
          "Article L217-5\nI.-En plus des critères de conformité au contrat, le bien est conforme s'il répond aux critères suivants :\n1° Il est propre à l'usage habituellement attendu d'un bien de même type, compte tenu, s'il y a lieu, de toute\ndisposition du droit de l'Union européenne et du droit national ainsi que de toutes les normes techniques ou,\nen l'absence de telles normes techniques, des codes de conduite spécifiques applicables au secteur concerné ;\n2° Le cas échéant, il possède les qualités que le vendeur a présentées au consommateur sous forme\nd'échantillon ou de modèle, avant la conclusion du contrat ;\n3° Le cas échéant, les éléments numériques qu'il comporte sont fournis selon la version la plus récente qui\nest disponible au moment de la conclusion du contrat, sauf si les parties en conviennent autrement ;\n4° Le cas échéant, il est délivré avec tous les accessoires, y compris l'emballage, et les instructions\nd'installation que le consommateur peut légitimement attendre ;\n5° Le cas échéant, il est fourni avec les mises à jour que le consommateur peut légitimement attendre,\nconformément aux dispositions de l'article L. 217-19 ;\n6° Il correspond à la quantité, à la qualité et aux autres caractéristiques, y compris en termes de durabilité,\nde fonctionnalité, de compatibilité et de sécurité, que le consommateur peut légitimement attendre pour des\nbiens de même type, eu égard à la nature du bien ainsi qu'aux déclarations publiques faites par le vendeur,\npar toute personne en amont dans la chaîne de transactions, ou par une personne agissant pour leur compte, y\ncompris dans la publicité ou sur l'étiquetage.\nII.-Toutefois, le vendeur n'est pas tenu par toutes déclarations publiques mentionnées à l'alinéa qui précède\ns'il démontre :\n1° Qu'il ne les connaissait pas et n'était légitimement pas en mesure de les connaître ;\n2° Qu'au moment de la conclusion du contrat, les déclarations publiques avaient été rectifiées dans des\nconditions comparables aux déclarations initiales ; ou\n3° Que les déclarations publiques n'ont pas pu avoir d'influence sur la décision d'achat.\nIII.-Le consommateur ne peut contester la conformité en invoquant un défaut concernant une ou plusieurs\ncaractéristiques particulières du bien, dont il a été spécifiquement informé qu'elles s'écartaient des critères\nde conformité énoncés au présent article, écart auquel il a expressément et séparément consenti lors de la\nconclusion du contrat."
        ],
        "ground_truth": "Oui, le respect de l'usage spécial validé par le vendeur devient un critère de conformité contractuel.",
        "expected_article": "Article L. 217-4",
        "retrieved_articles": [
          "L217-9",
          "L217-8",
          "L216-5",
          "L217-10",
          "L217-5"
        ],
        "question_type": "Conceptuelle",
        "latency_ms": 5280.2369594573975
      },
      {
        "question": "J'ai acheté un ordinateur en précisant au vendeur que je voulais faire du montage vidéo 4K, ce qu'il a validé. Or, l'ordinateur plante dès que je lance un rendu. Puis-je invoquer un défaut de conformité même si l'ordinateur fonctionne bien pour de la bureautique ?",
        "answer": "Selon l'article L217-5 du Code de la consommation, pour qu'un bien soit conforme, il doit correspondre à l'usage habituellement attendu d'un bien de même type, en tenant compte des déclarations publiques faites par le vendeur. De plus, le bien doit correspondre à la quantité, à la qualité et aux autres caractéristiques que le consommateur peut légitimement attendre pour des biens de même type, notamment en termes de fonctionnalité.\n\nDans votre cas, si vous avez expressément informé le vendeur que vous souhaitiez utiliser l'ordinateur pour du montage vidéo 4K et que le vendeur a validé cette utilisation sans vous informer de limitations potentielles, vous pouvez invoquer un défaut de conformité au regard de l'article L217-5. En effet, si l'ordinateur plante dès que vous lancez un rendu vidéo, cela signifie qu'il ne correspond pas à l'usage spécifique pour lequel vous l'avez acheté, même s'il fonctionne correctement pour d'autres tâches telles que la bureautique.\n\nVous pourriez donc demander au vendeur de mettre en conformité l'ordinateur pour qu'il soit capable de supporter le montage vidéo 4K, conformément à l'article L217-12. Si le vendeur refuse ou si la mise en conformité est impossible ou disproportionnée, vous pourriez alors demander une réparation, un remplacement ou un remboursement, selon les dispositions de l'article L217-12.",
        "contexts": [
          "Article L217-3\nLe vendeur délivre un bien conforme au contrat ainsi qu'aux critères énoncés à l'article L. 217-5.\nIl répond des défauts de conformité existant au moment de la délivrance du bien au sens de l'article L. 216-1,\nqui apparaissent dans un délai de deux ans à compter de celle-ci.\nDans le cas d'un contrat de vente d'un bien comportant des éléments numériques :\n1° Lorsque le contrat prévoit la fourniture continue d'un contenu numérique ou d'un service numérique\npendant une durée inférieure ou égale à deux ans, ou lorsque le contrat ne détermine pas la durée de\nfourniture, le vendeur répond des défauts de conformité de ce contenu numérique ou de ce service numérique\nqui apparaissent dans un délai de deux ans à compter de la délivrance du bien ;\n2° Lorsque le contrat prévoit la fourniture continue d'un contenu numérique ou d'un service numérique\npendant une durée supérieure à deux ans, le vendeur répond des défauts de conformité de ce contenu\nnumérique ou de ce service numérique qui apparaissent au cours de la période durant laquelle celui-ci est\nfourni en vertu du contrat.\nPour de tels biens, le délai applicable ne prive pas le consommateur de son droit aux mises à jour\nconformément aux dispositions de l'article L. 217-19.\nLe vendeur répond également, durant les mêmes délais, des défauts de conformité résultant de l'emballage,\ndes instructions de montage, ou de l'installation lorsque celle-ci a été mise à sa charge par le contrat ou a\nété réalisée sous sa responsabilité, ou encore lorsque l'installation incorrecte, effectuée par le consommateur\ncomme prévu au contrat, est due à des lacunes ou erreurs dans les instructions d'installation fournies par le\nvendeur.\nCe délai de garantie s'applique sans préjudice des articles 2224 et suivants du code civil. Le point de départ\nde la prescription de l'action du consommateur est le jour de la connaissance par ce dernier du défaut de\nconformité.",
          "Article L217-19\nI.-Le vendeur veille à ce que le consommateur soit informé et reçoive les mises à jour nécessaires au\nmaintien de la conformité des biens :\n1° Durant une période à laquelle le consommateur peut légitimement s'attendre, eu égard au type et à la\nfinalité des biens et éléments numériques et compte tenu des circonstances et de la nature du contrat, dans le\ncas d'une opération de fourniture unique du contenu numérique ou du service numérique ;\n2° Durant une période de deux ans à compter du moment où les biens comportant des éléments numériques\nont été délivrés, lorsque le contrat de vente prévoit la fourniture continue du contenu numérique ou du\nservice numérique pendant une certaine période ;\n3° Durant la période pendant laquelle le contenu numérique ou le service numérique est fourni en vertu du\ncontrat lorsque celui-ci en prévoit la fourniture continue pendant une durée supérieure à deux ans.\nII.-Lorsque le consommateur n'installe pas, dans un délai raisonnable, les mises à jour mentionnées au I,\nle vendeur n'est pas responsable des défauts de conformité résultant uniquement de la non-installation des\nmises à jour concernées, à condition que :\n1° Le vendeur ait informé le consommateur de la disponibilité des mises à jour et des conséquences de leur\nnon-installation par le consommateur ; et\n2° La non-installation ou l'installation incorrecte par le consommateur des mises à jour ne soit pas due à des\nlacunes dans les instructions d'installation fournies au consommateur.",
          "Article L217-12\nLe vendeur peut ne pas procéder selon le choix opéré par le consommateur si la mise en conformité sollicitée\nest impossible ou entraîne des coûts disproportionnés au regard notamment :\n1° De la valeur qu'aurait le bien en l'absence de défaut de conformité ;\n2° De l'importance du défaut de conformité ; et\n3° De la possibilité éventuelle d'opter pour l'autre choix sans inconvénient majeur pour le consommateur.\nLe vendeur peut refuser la mise en conformité du bien si celle-ci est impossible ou entraîne des coûts\ndisproportionnés notamment au regard des 1° et 2°.\nLorsque ces conditions ne sont pas respectées, le consommateur peut, après mise en demeure, poursuivre\nl'exécution forcée en nature de la solution initialement sollicitée, conformément aux articles 1221 et suivants\ndu code civil.\nTout refus par le vendeur de procéder selon le choix du consommateur ou de mettre le bien en conformité,\nest motivé par écrit ou sur support durable.",
          "Article L224-25-16\n\nI.-Les défauts de conformité qui apparaissent dans un délai de douze mois à compter de la fourniture du\ncontenu numérique ou du service numérique sont présumés exister au moment de cette fourniture, sauf\npreuve contraire.\nLorsque le contrat prévoit la fourniture continue du contenu numérique ou du service numérique pendant une\npériode donnée, la charge de la preuve quant à la question de savoir si le contenu numérique ou le service\nnumérique était conforme au cours de la période contractuelle de fourniture, incombe au professionnel dans\nle cas d'un défaut de conformité apparaissant au cours de cette période.\nII.-Le professionnel n'est pas responsable du défaut de conformité s'il démontre que celui-ci est directement\nimputable à l'incompatibilité entre le contenu numérique ou le service numérique et l'environnement\nnumérique du consommateur, et que le consommateur avait été informé par le professionnel des exigences\ntechniques de compatibilité de ce contenu ou service avant la conclusion du contrat.\nLe consommateur est tenu de coopérer avec le professionnel, dans la mesure de ce qui est raisonnablement\npossible, nécessaire et le moins intrusif pour lui, afin de déterminer si le défaut de conformité est causé par\ncette incompatibilité. Dans le cas contraire, la charge de la preuve mentionnée au premier ou au deuxième\nalinéa du I du présent article, incombe au consommateur à la condition que le consommateur ait été informé\nde façon claire et compréhensible de son obligation de coopérer avant la conclusion du contrat.\n\nParagraphe 2 : Mise en œuvre de la garantie légale de conformité",
          "Article L217-5\nI.-En plus des critères de conformité au contrat, le bien est conforme s'il répond aux critères suivants :\n1° Il est propre à l'usage habituellement attendu d'un bien de même type, compte tenu, s'il y a lieu, de toute\ndisposition du droit de l'Union européenne et du droit national ainsi que de toutes les normes techniques ou,\nen l'absence de telles normes techniques, des codes de conduite spécifiques applicables au secteur concerné ;\n2° Le cas échéant, il possède les qualités que le vendeur a présentées au consommateur sous forme\nd'échantillon ou de modèle, avant la conclusion du contrat ;\n3° Le cas échéant, les éléments numériques qu'il comporte sont fournis selon la version la plus récente qui\nest disponible au moment de la conclusion du contrat, sauf si les parties en conviennent autrement ;\n4° Le cas échéant, il est délivré avec tous les accessoires, y compris l'emballage, et les instructions\nd'installation que le consommateur peut légitimement attendre ;\n5° Le cas échéant, il est fourni avec les mises à jour que le consommateur peut légitimement attendre,\nconformément aux dispositions de l'article L. 217-19 ;\n6° Il correspond à la quantité, à la qualité et aux autres caractéristiques, y compris en termes de durabilité,\nde fonctionnalité, de compatibilité et de sécurité, que le consommateur peut légitimement attendre pour des\nbiens de même type, eu égard à la nature du bien ainsi qu'aux déclarations publiques faites par le vendeur,\npar toute personne en amont dans la chaîne de transactions, ou par une personne agissant pour leur compte, y\ncompris dans la publicité ou sur l'étiquetage.\nII.-Toutefois, le vendeur n'est pas tenu par toutes déclarations publiques mentionnées à l'alinéa qui précède\ns'il démontre :\n1° Qu'il ne les connaissait pas et n'était légitimement pas en mesure de les connaître ;\n2° Qu'au moment de la conclusion du contrat, les déclarations publiques avaient été rectifiées dans des\nconditions comparables aux déclarations initiales ; ou\n3° Que les déclarations publiques n'ont pas pu avoir d'influence sur la décision d'achat.\nIII.-Le consommateur ne peut contester la conformité en invoquant un défaut concernant une ou plusieurs\ncaractéristiques particulières du bien, dont il a été spécifiquement informé qu'elles s'écartaient des critères\nde conformité énoncés au présent article, écart auquel il a expressément et séparément consenti lors de la\nconclusion du contrat."
        ],
        "ground_truth": "Oui, vous pouvez invoquer un défaut de conformité car le bien n'est pas propre à l'usage spécial que vous avez spécifié et qui a été accepté par le vendeur.",
        "expected_article": "Article L. 217-4",
        "retrieved_articles": [
          "L217-3",
          "L217-19",
          "L217-12",
          "L224-25-16",
          "L217-5"
        ],
        "question_type": "Complexe",
        "latency_ms": 6271.328926086426
      },
      {
        "question": "Quels sont les critères de conformité énumérés à l'article L. 217-5 en plus des critères du contrat ?",
        "answer": "Selon l'article L217-5 du Code de la consommation, en plus des critères de conformité au contrat, les critères de conformité d'un bien sont les suivants :\n1. Il est propre à l'usage habituellement attendu d'un bien de même type.\n2. Il possède les qualités présentées par le vendeur avant la conclusion du contrat.\n3. Les éléments numériques sont fournis selon la version la plus récente disponible au moment de la conclusion du contrat.\n4. Il est délivré avec tous les accessoires et les instructions d'installation que le consommateur peut légitimement attendre.\n5. Il est fourni avec les mises à jour que le consommateur peut légitimement attendre.\n6. Il correspond à la quantité, à la qualité et aux autres caractéristiques que le consommateur peut légitimement attendre pour des biens de même type, eu égard à la nature du bien ainsi qu'aux déclarations publiques faites par le vendeur.\n\nCes critères doivent être respectés pour qu'un bien soit considéré comme conforme au contrat.",
        "contexts": [
          "Article L217-5\nI.-En plus des critères de conformité au contrat, le bien est conforme s'il répond aux critères suivants :\n1° Il est propre à l'usage habituellement attendu d'un bien de même type, compte tenu, s'il y a lieu, de toute\ndisposition du droit de l'Union européenne et du droit national ainsi que de toutes les normes techniques ou,\nen l'absence de telles normes techniques, des codes de conduite spécifiques applicables au secteur concerné ;\n2° Le cas échéant, il possède les qualités que le vendeur a présentées au consommateur sous forme\nd'échantillon ou de modèle, avant la conclusion du contrat ;\n3° Le cas échéant, les éléments numériques qu'il comporte sont fournis selon la version la plus récente qui\nest disponible au moment de la conclusion du contrat, sauf si les parties en conviennent autrement ;\n4° Le cas échéant, il est délivré avec tous les accessoires, y compris l'emballage, et les instructions\nd'installation que le consommateur peut légitimement attendre ;\n5° Le cas échéant, il est fourni avec les mises à jour que le consommateur peut légitimement attendre,\nconformément aux dispositions de l'article L. 217-19 ;\n6° Il correspond à la quantité, à la qualité et aux autres caractéristiques, y compris en termes de durabilité,\nde fonctionnalité, de compatibilité et de sécurité, que le consommateur peut légitimement attendre pour des\nbiens de même type, eu égard à la nature du bien ainsi qu'aux déclarations publiques faites par le vendeur,\npar toute personne en amont dans la chaîne de transactions, ou par une personne agissant pour leur compte, y\ncompris dans la publicité ou sur l'étiquetage.\nII.-Toutefois, le vendeur n'est pas tenu par toutes déclarations publiques mentionnées à l'alinéa qui précède\ns'il démontre :\n1° Qu'il ne les connaissait pas et n'était légitimement pas en mesure de les connaître ;\n2° Qu'au moment de la conclusion du contrat, les déclarations publiques avaient été rectifiées dans des\nconditions comparables aux déclarations initiales ; ou\n3° Que les déclarations publiques n'ont pas pu avoir d'influence sur la décision d'achat.\nIII.-Le consommateur ne peut contester la conformité en invoquant un défaut concernant une ou plusieurs\ncaractéristiques particulières du bien, dont il a été spécifiquement informé qu'elles s'écartaient des critères\nde conformité énoncés au présent article, écart auquel il a expressément et séparément consenti lors de la\nconclusion du contrat.",
          "Article L217-4\nLe bien est conforme au contrat s'il répond notamment, le cas échéant, aux critères suivants :\n1° Il correspond à la description, au type, à la quantité et à la qualité, notamment en ce qui concerne la\nfonctionnalité, la compatibilité, l'interopérabilité, ou toute autre caractéristique prévues au contrat ;\n2° Il est propre à tout usage spécial recherché par le consommateur, porté à la connaissance du vendeur au\nplus tard au moment de la conclusion du contrat et que ce dernier a accepté ;\n3° Il est délivré avec tous les accessoires et les instructions d'installation, devant être fournis conformément\nau contrat ;\n4° Il est mis à jour conformément au contrat.",
          "Article L217-3\nLe vendeur délivre un bien conforme au contrat ainsi qu'aux critères énoncés à l'article L. 217-5.\nIl répond des défauts de conformité existant au moment de la délivrance du bien au sens de l'article L. 216-1,\nqui apparaissent dans un délai de deux ans à compter de celle-ci.\nDans le cas d'un contrat de vente d'un bien comportant des éléments numériques :\n1° Lorsque le contrat prévoit la fourniture continue d'un contenu numérique ou d'un service numérique\npendant une durée inférieure ou égale à deux ans, ou lorsque le contrat ne détermine pas la durée de\nfourniture, le vendeur répond des défauts de conformité de ce contenu numérique ou de ce service numérique\nqui apparaissent dans un délai de deux ans à compter de la délivrance du bien ;\n2° Lorsque le contrat prévoit la fourniture continue d'un contenu numérique ou d'un service numérique\npendant une durée supérieure à deux ans, le vendeur répond des défauts de conformité de ce contenu\nnumérique ou de ce service numérique qui apparaissent au cours de la période durant laquelle celui-ci est\nfourni en vertu du contrat.\nPour de tels biens, le délai applicable ne prive pas le consommateur de son droit aux mises à jour\nconformément aux dispositions de l'article L. 217-19.\nLe vendeur répond également, durant les mêmes délais, des défauts de conformité résultant de l'emballage,\ndes instructions de montage, ou de l'installation lorsque celle-ci a été mise à sa charge par le contrat ou a\nété réalisée sous sa responsabilité, ou encore lorsque l'installation incorrecte, effectuée par le consommateur\ncomme prévu au contrat, est due à des lacunes ou erreurs dans les instructions d'installation fournies par le\nvendeur.\nCe délai de garantie s'applique sans préjudice des articles 2224 et suivants du code civil. Le point de départ\nde la prescription de l'action du consommateur est le jour de la connaissance par ce dernier du défaut de\nconformité.",
          "Article L224-25-14\n\nI.-En plus des critères de conformité prévus au contrat, le contenu numérique ou le service numérique est\nconforme s'il répond aux critères suivants :\n1° Il est propre à l'usage habituellement attendu d'un contenu numérique ou d'un service numérique de même\ntype, compte tenu, s'il y a lieu, de toute disposition du droit de l'Union européenne et du droit national ainsi\nque de toutes les normes techniques, ou en l'absence de telles normes techniques, des codes de conduite\nspécifiques applicables au secteur concerné ;\n2° Le cas échéant, il possède les qualités que le professionnel a présentées au consommateur sous forme de\nversion d'essai ou d'aperçu, avant la conclusion du contrat ;\n3° Il est fourni selon la version la plus récente qui est disponible au moment de la conclusion du contrat, sauf\nsi les parties en conviennent autrement ;\n4° En cas de fourniture continue d'un contenu numérique ou d'un service numérique pendant une période\ndonnée, il est fourni sans interruption tout au long de cette période ;\n5° Le cas échéant, il est fourni avec tous les accessoires et les instructions d'installation ainsi que l'assistance\nà la clientèle, auxquels le consommateur peut légitimement s'attendre ;\n6° Le cas échéant, il est fourni avec les mises à jour que le consommateur peut légitimement attendre,\nconformément aux dispositions de l'article L. 224-25-25 ;\n7° Il correspond à la quantité, à la qualité et aux autres caractéristiques, y compris en termes de\nfonctionnalité, de compatibilité, d'accessibilité, de continuité et de sécurité, que le consommateur peut\nlégitimement attendre pour des contenus numériques ou des services numériques de même type, eu égard à\nla nature de ces contenus ou services ainsi qu'aux déclarations publiques faites par le professionnel, par toute\npersonne en amont dans la chaîne de transactions, ou par une personne agissant pour leur compte, y compris\ndans la publicité ou sur l'étiquetage.\nII.-Toutefois, le professionnel n'est pas tenu par toutes déclarations publiques mentionnées au dernier alinéa\ndu I s'il démontre :\n1° Qu'il ne les connaissait pas et n'était légitimement pas en mesure de les connaître ;\n2° Qu'au moment de la conclusion du contrat, les déclarations publiques avaient été rectifiées dans des\nconditions comparables aux déclarations initiales ; ou\n3° Que les déclarations publiques n'ont pas pu avoir d'influence sur la décision de contracter.\nIII.-Le consommateur ne peut contester la conformité en invoquant un défaut concernant une ou plusieurs\ncaractéristiques particulières du contenu numérique ou du service numérique, dont il a été spécifiquement\ninformé qu'elles s'écartaient des critères de conformité énoncés au présent article, écart auquel il a\nexpressément et séparément consenti lors de la conclusion du contrat.",
          "Article L217-30\nLes dispositions du présent chapitre ne privent pas le consommateur du droit d'exercer l'action résultant de la\ngarantie des vices cachés telle qu'elle résulte des articles 1641 à 1649 du code civil ou toute autre action de\nnature contractuelle ou extracontractuelle qui lui est reconnue par la loi.\nLorsqu'une restriction découlant de la violation des droits de tout tiers, en particulier des droits de propriété\nintellectuelle, empêche ou limite l'utilisation du bien conformément aux dispositions des articles L. 217-4 et\nL. 217-5, la nullité du contrat ou toute autre action de nature contractuelle ou extracontractuelle peuvent être\nencourues par application des dispositions du code civil."
        ],
        "ground_truth": "Le bien doit être propre à l'usage habituellement attendu d'un bien de même type et posséder les qualités que le consommateur peut légitimement attendre eu égard aux déclarations publiques (publicité, étiquetage).",
        "expected_article": "Article L. 217-5",
        "retrieved_articles": [
          "L217-5",
          "L217-4",
          "L217-3",
          "L224-25-14",
          "L217-30"
        ],
        "question_type": "Explicite",
        "latency_ms": 6680.818319320679
      },
      {
        "question": "Un produit doit-il nécessairement correspondre à l'usage habituellement attendu d'un bien de même type pour être conforme ?",
        "answer": "Oui, selon l'article L217-5 du Code de la consommation, pour qu'un produit soit considéré comme conforme, il doit être propre à l'usage habituellement attendu d'un bien de même type. Cela signifie que le produit doit correspondre aux critères de qualité, de fonctionnalité, de compatibilité et de sécurité que le consommateur peut légitimement attendre pour des biens similaires. Ainsi, la conformité d'un produit est évaluée en fonction des attentes normales des consommateurs par rapport à ce type de produit.",
        "contexts": [
          "Article L217-5\nI.-En plus des critères de conformité au contrat, le bien est conforme s'il répond aux critères suivants :\n1° Il est propre à l'usage habituellement attendu d'un bien de même type, compte tenu, s'il y a lieu, de toute\ndisposition du droit de l'Union européenne et du droit national ainsi que de toutes les normes techniques ou,\nen l'absence de telles normes techniques, des codes de conduite spécifiques applicables au secteur concerné ;\n2° Le cas échéant, il possède les qualités que le vendeur a présentées au consommateur sous forme\nd'échantillon ou de modèle, avant la conclusion du contrat ;\n3° Le cas échéant, les éléments numériques qu'il comporte sont fournis selon la version la plus récente qui\nest disponible au moment de la conclusion du contrat, sauf si les parties en conviennent autrement ;\n4° Le cas échéant, il est délivré avec tous les accessoires, y compris l'emballage, et les instructions\nd'installation que le consommateur peut légitimement attendre ;\n5° Le cas échéant, il est fourni avec les mises à jour que le consommateur peut légitimement attendre,\nconformément aux dispositions de l'article L. 217-19 ;\n6° Il correspond à la quantité, à la qualité et aux autres caractéristiques, y compris en termes de durabilité,\nde fonctionnalité, de compatibilité et de sécurité, que le consommateur peut légitimement attendre pour des\nbiens de même type, eu égard à la nature du bien ainsi qu'aux déclarations publiques faites par le vendeur,\npar toute personne en amont dans la chaîne de transactions, ou par une personne agissant pour leur compte, y\ncompris dans la publicité ou sur l'étiquetage.\nII.-Toutefois, le vendeur n'est pas tenu par toutes déclarations publiques mentionnées à l'alinéa qui précède\ns'il démontre :\n1° Qu'il ne les connaissait pas et n'était légitimement pas en mesure de les connaître ;\n2° Qu'au moment de la conclusion du contrat, les déclarations publiques avaient été rectifiées dans des\nconditions comparables aux déclarations initiales ; ou\n3° Que les déclarations publiques n'ont pas pu avoir d'influence sur la décision d'achat.\nIII.-Le consommateur ne peut contester la conformité en invoquant un défaut concernant une ou plusieurs\ncaractéristiques particulières du bien, dont il a été spécifiquement informé qu'elles s'écartaient des critères\nde conformité énoncés au présent article, écart auquel il a expressément et séparément consenti lors de la\nconclusion du contrat.",
          "Article L224-25-14\n\nI.-En plus des critères de conformité prévus au contrat, le contenu numérique ou le service numérique est\nconforme s'il répond aux critères suivants :\n1° Il est propre à l'usage habituellement attendu d'un contenu numérique ou d'un service numérique de même\ntype, compte tenu, s'il y a lieu, de toute disposition du droit de l'Union européenne et du droit national ainsi\nque de toutes les normes techniques, ou en l'absence de telles normes techniques, des codes de conduite\nspécifiques applicables au secteur concerné ;\n2° Le cas échéant, il possède les qualités que le professionnel a présentées au consommateur sous forme de\nversion d'essai ou d'aperçu, avant la conclusion du contrat ;\n3° Il est fourni selon la version la plus récente qui est disponible au moment de la conclusion du contrat, sauf\nsi les parties en conviennent autrement ;\n4° En cas de fourniture continue d'un contenu numérique ou d'un service numérique pendant une période\ndonnée, il est fourni sans interruption tout au long de cette période ;\n5° Le cas échéant, il est fourni avec tous les accessoires et les instructions d'installation ainsi que l'assistance\nà la clientèle, auxquels le consommateur peut légitimement s'attendre ;\n6° Le cas échéant, il est fourni avec les mises à jour que le consommateur peut légitimement attendre,\nconformément aux dispositions de l'article L. 224-25-25 ;\n7° Il correspond à la quantité, à la qualité et aux autres caractéristiques, y compris en termes de\nfonctionnalité, de compatibilité, d'accessibilité, de continuité et de sécurité, que le consommateur peut\nlégitimement attendre pour des contenus numériques ou des services numériques de même type, eu égard à\nla nature de ces contenus ou services ainsi qu'aux déclarations publiques faites par le professionnel, par toute\npersonne en amont dans la chaîne de transactions, ou par une personne agissant pour leur compte, y compris\ndans la publicité ou sur l'étiquetage.\nII.-Toutefois, le professionnel n'est pas tenu par toutes déclarations publiques mentionnées au dernier alinéa\ndu I s'il démontre :\n1° Qu'il ne les connaissait pas et n'était légitimement pas en mesure de les connaître ;\n2° Qu'au moment de la conclusion du contrat, les déclarations publiques avaient été rectifiées dans des\nconditions comparables aux déclarations initiales ; ou\n3° Que les déclarations publiques n'ont pas pu avoir d'influence sur la décision de contracter.\nIII.-Le consommateur ne peut contester la conformité en invoquant un défaut concernant une ou plusieurs\ncaractéristiques particulières du contenu numérique ou du service numérique, dont il a été spécifiquement\ninformé qu'elles s'écartaient des critères de conformité énoncés au présent article, écart auquel il a\nexpressément et séparément consenti lors de la conclusion du contrat.",
          "Article L217-11\n\nLa mise en conformité du bien a lieu sans aucun frais pour le consommateur.\nLe consommateur n'est pas tenu de payer pour l'utilisation normale qu'il a faite du bien remplacé pendant la\npériode antérieure à son remplacement.",
          "Article L217-9\nLe consommateur est en droit d'exiger la mise en conformité du bien aux critères énoncés dans la sous-\nsection 1 de la présente section.\nLe consommateur sollicite auprès du vendeur la mise en conformité du bien, en choisissant entre la\nréparation et le remplacement. A cette fin, le consommateur met le bien à la disposition du vendeur.",
          "Article L217-10\nLa mise en conformité du bien a lieu dans un délai raisonnable qui ne peut être supérieur à trente jours\nsuivant la demande du consommateur et sans inconvénient majeur pour lui, compte tenu de la nature du bien\net de l'usage recherché par le consommateur.\nLa réparation ou le remplacement du bien non conforme inclut, s'il y a lieu, l'enlèvement et la reprise de ce\nbien et l'installation du bien réparé ou du bien de remplacement par le vendeur.\nUn décret précise les modalités de la mise en conformité du bien."
        ],
        "ground_truth": "Oui, sauf si le consommateur a consenti expressément à une caractéristique particulière s'écartant de ces critères.",
        "expected_article": "Article L. 217-5",
        "retrieved_articles": [
          "L217-5",
          "L224-25-14",
          "L217-11",
          "L217-9",
          "L217-10"
        ],
        "question_type": "Conceptuelle",
        "latency_ms": 4865.1111125946045
      }
    ]
  }
}