user_input,retrieved_contexts,response,reference,faithfulness,answer_relevancy,context_precision,context_recall
Que stipule l'article L. 217-4 concernant l'usage spécial recherché par le consommateur ?,"[""Article L217-4\nLe bien est conforme au contrat s'il répond notamment, le cas échéant, aux critères suivants :\n1° Il correspond à la description, au type, à la quantité et à la qualité, notamment en ce qui concerne la\nfonctionnalité, la compatibilité, l'interopérabilité, ou toute autre caractéristique prévues au contrat ;\n2° Il est propre à tout usage spécial recherché par le consommateur, porté à la connaissance du vendeur au\nplus tard au moment de la conclusion du contrat et que ce dernier a accepté ;\n3° Il est délivré avec tous les accessoires et les instructions d'installation, devant être fournis conformément\nau contrat ;\n4° Il est mis à jour conformément au contrat."", ""Article L217-10\nLa mise en conformité du bien a lieu dans un délai raisonnable qui ne peut être supérieur à trente jours\nsuivant la demande du consommateur et sans inconvénient majeur pour lui, compte tenu de la nature du bien\net de l'usage recherché par le consommateur.\nLa réparation ou le remplacement du bien non conforme inclut, s'il y a lieu, l'enlèvement et la reprise de ce\nbien et l'installation du bien réparé ou du bien de remplacement par le vendeur.\nUn décret précise les modalités de la mise en conformité du bien."", ""Article L217-30\nLes dispositions du présent chapitre ne privent pas le consommateur du droit d'exercer l'action résultant de la\ngarantie des vices cachés telle qu'elle résulte des articles 1641 à 1649 du code civil ou toute autre action de\nnature contractuelle ou extracontractuelle qui lui est reconnue par la loi.\nLorsqu'une restriction découlant de la violation des droits de tout tiers, en particulier des droits de propriété\nintellectuelle, empêche ou limite l'utilisation du bien conformément aux dispositions des articles L. 217-4 et\nL. 217-5, la nullité du contrat ou toute autre action de nature contractuelle ou extracontractuelle peuvent être\nencourues par application des dispositions du code civil."", ""Article L217-9\nLe consommateur est en droit d'exiger la mise en conformité du bien aux critères énoncés dans la sous-\nsection 1 de la présente section.\nLe consommateur sollicite auprès du vendeur la mise en conformité du bien, en choisissant entre la\nréparation et le remplacement. A cette fin, le consommateur met le bien à la disposition du vendeur."", ""Article L217-11\n\nLa mise en conformité du bien a lieu sans aucun frais pour le consommateur.\nLe consommateur n'est pas tenu de payer pour l'utilisation normale qu'il a faite du bien remplacé pendant la\npériode antérieure à son remplacement.""]","Selon l'article L217-4, le bien est conforme au contrat s'il est propre à tout usage spécial recherché par le consommateur, porté à la connaissance du vendeur au plus tard au moment de la conclusion du contrat et que ce dernier a accepté. Ainsi, si le consommateur informe le vendeur d'un usage spécial qu'il souhaite faire du bien et que le vendeur accepte cette demande lors de la conclusion du contrat, le bien doit être conforme à cet usage spécial pour être en accord avec le contrat.","Le bien est conforme s'il est propre à tout usage spécial recherché par le consommateur, porté à la connaissance du vendeur au moment de la conclusion du contrat et accepté par ce dernier.",0.6,,0.99999999995,1.0
"Si un acheteur précise une exigence spécifique au vendeur lors de l'achat et que celui-ci l'accepte, le produit doit-il respecter cette exigence pour être considéré comme conforme ?","[""Article L217-9\nLe consommateur est en droit d'exiger la mise en conformité du bien aux critères énoncés dans la sous-\nsection 1 de la présente section.\nLe consommateur sollicite auprès du vendeur la mise en conformité du bien, en choisissant entre la\nréparation et le remplacement. A cette fin, le consommateur met le bien à la disposition du vendeur."", ""Article L217-8\nEn cas de défaut de conformité, le consommateur a droit à la mise en conformité du bien par réparation ou\nremplacement ou, à défaut, à la réduction du prix ou à la résolution du contrat, dans les conditions énoncées\nà la présente sous-section.\nLe consommateur a, par ailleurs, le droit de suspendre le paiement de tout ou partie du prix ou la remise de\nl'avantage prévu au contrat jusqu'à ce que le vendeur ait satisfait aux obligations qui lui incombent au titre du\nprésent chapitre, dans les conditions des articles 1219 et 1220 du code civil.\nLes dispositions du présent chapitre sont sans préjudice de l'allocation de dommages et intérêts."", ""Article L216-5\nLe professionnel indique par écrit au consommateur lors de son achat, s'il y a lieu, le coût de la livraison\net de mise en service du bien. Un écrit est laissé au consommateur lors de l'entrée en possession du bien,\nmentionnant la possibilité pour le consommateur de formuler des réserves, notamment en cas de défaut du\nbien ou de défaut de remise de la notice d'emploi ou des instructions d'installation.\nL'absence de réserves formulées par le consommateur lors de la réception du bien n'exonère pas le\nprofessionnel de la garantie de conformité du bien qu'il doit au consommateur."", ""Article L217-21\nLa garantie commerciale s'entend de tout engagement contractuel d'un professionnel, qu'il s'agisse du\nvendeur ou du producteur, y compris par l'intermédiaire de toute autre personne agissant en leur nom ou\npour leur compte (ci-après dénommé “ garant ”), à l'égard du consommateur. Cet engagement a pour objet le\nremboursement du prix d'achat, le remplacement, la réparation du bien ou toute autre prestation de service en\nrelation avec le bien, ou encore toute exigence éventuelle non liée à la conformité et énoncée dans la garantie\ncommerciale, en sus des obligations légales du vendeur visant à garantir la conformité du bien.\nToute garantie commerciale lie le garant conformément aux conditions qu'elle prévoit ou aux conditions\nindiquées dans la publicité qui en a été faite antérieurement à la conclusion du contrat si les conditions\nde cette publicité sont plus favorables, sauf si le garant démontre que la publicité a été rectifiée avant la\nconclusion du contrat selon des modalités identiques ou comparables à la publicité initiale."", ""Article L217-10\nLa mise en conformité du bien a lieu dans un délai raisonnable qui ne peut être supérieur à trente jours\nsuivant la demande du consommateur et sans inconvénient majeur pour lui, compte tenu de la nature du bien\net de l'usage recherché par le consommateur.\nLa réparation ou le remplacement du bien non conforme inclut, s'il y a lieu, l'enlèvement et la reprise de ce\nbien et l'installation du bien réparé ou du bien de remplacement par le vendeur.\nUn décret précise les modalités de la mise en conformité du bien.""]","Selon l'article L217-9 du Code de la consommation, le consommateur a le droit d'exiger la mise en conformité du bien aux critères convenus lors de l'achat. Si le vendeur accepte une exigence spécifique formulée par l'acheteur lors de l'achat, le bien doit effectivement respecter cette exigence pour être considéré comme conforme. En cas de non-conformité par rapport à cette exigence spécifique, le consommateur peut demander la mise en conformité du bien par le vendeur, que ce soit par réparation, remplacement, réduction du prix ou résolution du contrat, conformément à l'article L217-8.","Oui, le respect de l'usage spécial validé par le vendeur devient un critère de conformité contractuel.",0.625,,0.99999999998,0.0
"J'ai acheté un ordinateur en précisant au vendeur que je voulais faire du montage vidéo 4K, ce qu'il a validé. Or, l'ordinateur plante dès que je lance un rendu. Puis-je invoquer un défaut de conformité même si l'ordinateur fonctionne bien pour de la bureautique ?","[""Article L217-3\nLe vendeur délivre un bien conforme au contrat ainsi qu'aux critères énoncés à l'article L. 217-5.\nIl répond des défauts de conformité existant au moment de la délivrance du bien au sens de l'article L. 216-1,\nqui apparaissent dans un délai de deux ans à compter de celle-ci.\nDans le cas d'un contrat de vente d'un bien comportant des éléments numériques :\n1° Lorsque le contrat prévoit la fourniture continue d'un contenu numérique ou d'un service numérique\npendant une durée inférieure ou égale à deux ans, ou lorsque le contrat ne détermine pas la durée de\nfourniture, le vendeur répond des défauts de conformité de ce contenu numérique ou de ce service numérique\nqui apparaissent dans un délai de deux ans à compter de la délivrance du bien ;\n2° Lorsque le contrat prévoit la fourniture continue d'un contenu numérique ou d'un service numérique\npendant une durée supérieure à deux ans, le vendeur répond des défauts de conformité de ce contenu\nnumérique ou de ce service numérique qui apparaissent au cours de la période durant laquelle celui-ci est\nfourni en vertu du contrat.\nPour de tels biens, le délai applicable ne prive pas le consommateur de son droit aux mises à jour\nconformément aux dispositions de l'article L. 217-19.\nLe vendeur répond également, durant les mêmes délais, des défauts de conformité résultant de l'emballage,\ndes instructions de montage, ou de l'installation lorsque celle-ci a été mise à sa charge par le contrat ou a\nété réalisée sous sa responsabilité, ou encore lorsque l'installation incorrecte, effectuée par le consommateur\ncomme prévu au contrat, est due à des lacunes ou erreurs dans les instructions d'installation fournies par le\nvendeur.\nCe délai de garantie s'applique sans préjudice des articles 2224 et suivants du code civil. Le point de départ\nde la prescription de l'action du consommateur est le jour de la connaissance par ce dernier du défaut de\nconformité."", ""Article L217-19\nI.-Le vendeur veille à ce que le consommateur soit informé et reçoive les mises à jour nécessaires au\nmaintien de la conformité des biens :\n1° Durant une période à laquelle le consommateur peut légitimement s'attendre, eu égard au type et à la\nfinalité des biens et éléments numériques et compte tenu des circonstances et de la nature du contrat, dans le\ncas d'une opération de fourniture unique du contenu numérique ou du service numérique ;\n2° Durant une période de deux ans à compter du moment où les biens comportant des éléments numériques\nont été délivrés, lorsque le contrat de vente prévoit la fourniture continue du contenu numérique ou du\nservice numérique pendant une certaine période ;\n3° Durant la période pendant laquelle le contenu numérique ou le service numérique est fourni en vertu du\ncontrat lorsque celui-ci en prévoit la fourniture continue pendant une durée supérieure à deux ans.\nII.-Lorsque le consommateur n'installe pas, dans un délai raisonnable, les mises à jour mentionnées au I,\nle vendeur n'est pas responsable des défauts de conformité résultant uniquement de la non-installation des\nmises à jour concernées, à condition que :\n1° Le vendeur ait informé le consommateur de la disponibilité des mises à jour et des conséquences de leur\nnon-installation par le consommateur ; et\n2° La non-installation ou l'installation incorrecte par le consommateur des mises à jour ne soit pas due à des\nlacunes dans les instructions d'installation fournies au consommateur."", ""Article L217-12\nLe vendeur peut ne pas procéder selon le choix opéré par le consommateur si la mise en conformité sollicitée\nest impossible ou entraîne des coûts disproportionnés au regard notamment :\n1° De la valeur qu'aurait le bien en l'absence de défaut de conformité ;\n2° De l'importance du défaut de conformité ; et\n3° De la possibilité éventuelle d'opter pour l'autre choix sans inconvénient majeur pour le consommateur.\nLe vendeur peut refuser la mise en conformité du bien si celle-ci est impossible ou entraîne des coûts\ndisproportionnés notamment au regard des 1° et 2°.\nLorsque ces conditions ne sont pas respectées, le consommateur peut, après mise en demeure, poursuivre\nl'exécution forcée en nature de la solution initialement sollicitée, conformément aux articles 1221 et suivants\ndu code civil.\nTout refus par le vendeur de procéder selon le choix du consommateur ou de mettre le bien en conformité,\nest motivé par écrit ou sur support durable."", ""Article L216-5\nLe professionnel indique par écrit au consommateur lors de son achat, s'il y a lieu, le coût de la livraison\net de mise en service du bien. Un écrit est laissé au consommateur lors de l'entrée en possession du bien,\nmentionnant la possibilité pour le consommateur de formuler des réserves, notamment en cas de défaut du\nbien ou de défaut de remise de la notice d'emploi ou des instructions d'installation.\nL'absence de réserves formulées par le consommateur lors de la réception du bien n'exonère pas le\nprofessionnel de la garantie de conformité du bien qu'il doit au consommateur."", ""Article L217-5\nI.-En plus des critères de conformité au contrat, le bien est conforme s'il répond aux critères suivants :\n1° Il est propre à l'usage habituellement attendu d'un bien de même type, compte tenu, s'il y a lieu, de toute\ndisposition du droit de l'Union européenne et du droit national ainsi que de toutes les normes techniques ou,\nen l'absence de telles normes techniques, des codes de conduite spécifiques applicables au secteur concerné ;\n2° Le cas échéant, il possède les qualités que le vendeur a présentées au consommateur sous forme\nd'échantillon ou de modèle, avant la conclusion du contrat ;\n3° Le cas échéant, les éléments numériques qu'il comporte sont fournis selon la version la plus récente qui\nest disponible au moment de la conclusion du contrat, sauf si les parties en conviennent autrement ;\n4° Le cas échéant, il est délivré avec tous les accessoires, y compris l'emballage, et les instructions\nd'installation que le consommateur peut légitimement attendre ;\n5° Le cas échéant, il est fourni avec les mises à jour que le consommateur peut légitimement attendre,\nconformément aux dispositions de l'article L. 217-19 ;\n6° Il correspond à la quantité, à la qualité et aux autres caractéristiques, y compris en termes de durabilité,\nde fonctionnalité, de compatibilité et de sécurité, que le consommateur peut légitimement attendre pour des\nbiens de même type, eu égard à la nature du bien ainsi qu'aux déclarations publiques faites par le vendeur,\npar toute personne en amont dans la chaîne de transactions, ou par une personne agissant pour leur compte, y\ncompris dans la publicité ou sur l'étiquetage.\nII.-Toutefois, le vendeur n'est pas tenu par toutes déclarations publiques mentionnées à l'alinéa qui précède\ns'il démontre :\n1° Qu'il ne les connaissait pas et n'était légitimement pas en mesure de les connaître ;\n2° Qu'au moment de la conclusion du contrat, les déclarations publiques avaient été rectifiées dans des\nconditions comparables aux déclarations initiales ; ou\n3° Que les déclarations publiques n'ont pas pu avoir d'influence sur la décision d'achat.\nIII.-Le consommateur ne peut contester la conformité en invoquant un défaut concernant une ou plusieurs\ncaractéristiques particulières du bien, dont il a été spécifiquement informé qu'elles s'écartaient des critères\nde conformité énoncés au présent article, écart auquel il a expressément et séparément consenti lors de la\nconclusion du contrat.""]","Selon l'article L217-5 du Code de la consommation, pour qu'un bien soit conforme, il doit non seulement être propre à l'usage habituellement attendu d'un bien de même type, mais aussi correspondre à la quantité, à la qualité et aux autres caractéristiques que le consommateur peut légitimement attendre pour des biens de même type. De plus, le bien doit correspondre aux déclarations publiques faites par le vendeur, notamment en ce qui concerne ses caractéristiques et ses performances.

Dans votre cas, si vous avez expressément informé le vendeur que vous souhaitiez utiliser l'ordinateur pour du montage vidéo 4K et que le vendeur a validé cette utilisation sans vous informer de possibles limitations, vous pouvez invoquer un défaut de conformité au regard de l'article L217-5. En effet, si l'ordinateur plante dès que vous lancez un rendu vidéo, cela signifie qu'il ne correspond pas aux caractéristiques et aux performances annoncées pour un tel usage spécifique.

Ainsi, vous pouvez légitimement demander au vendeur de mettre en conformité l'ordinateur avec l'usage pour lequel vous l'avez acheté, conformément à l'article L217-12. Si le vendeur refuse ou que la mise en conformité est impossible ou disproportionnée, vous pourriez avoir droit à un remplacement de l'ordinateur, à une réduction du prix ou à un remboursement, selon les dispositions de l'article L217-9.","Oui, vous pouvez invoquer un défaut de conformité car le bien n'est pas propre à l'usage spécial que vous avez spécifié et qui a été accepté par le vendeur.",0.8571428571428571,,0.99999999998,1.0
Quels sont les critères de conformité énumérés à l'article L. 217-5 en plus des critères du contrat ?,"[""Article L217-5\nI.-En plus des critères de conformité au contrat, le bien est conforme s'il répond aux critères suivants :\n1° Il est propre à l'usage habituellement attendu d'un bien de même type, compte tenu, s'il y a lieu, de toute\ndisposition du droit de l'Union européenne et du droit national ainsi que de toutes les normes techniques ou,\nen l'absence de telles normes techniques, des codes de conduite spécifiques applicables au secteur concerné ;\n2° Le cas échéant, il possède les qualités que le vendeur a présentées au consommateur sous forme\nd'échantillon ou de modèle, avant la conclusion du contrat ;\n3° Le cas échéant, les éléments numériques qu'il comporte sont fournis selon la version la plus récente qui\nest disponible au moment de la conclusion du contrat, sauf si les parties en conviennent autrement ;\n4° Le cas échéant, il est délivré avec tous les accessoires, y compris l'emballage, et les instructions\nd'installation que le consommateur peut légitimement attendre ;\n5° Le cas échéant, il est fourni avec les mises à jour que le consommateur peut légitimement attendre,\nconformément aux dispositions de l'article L. 217-19 ;\n6° Il correspond à la quantité, à la qualité et aux autres caractéristiques, y compris en termes de durabilité,\nde fonctionnalité, de compatibilité et de sécurité, que le consommateur peut légitimement attendre pour des\nbiens de même type, eu égard à la nature du bien ainsi qu'aux déclarations publiques faites par le vendeur,\npar toute personne en amont dans la chaîne de transactions, ou par une personne agissant pour leur compte, y\ncompris dans la publicité ou sur l'étiquetage.\nII.-Toutefois, le vendeur n'est pas tenu par toutes déclarations publiques mentionnées à l'alinéa qui précède\ns'il démontre :\n1° Qu'il ne les connaissait pas et n'était légitimement pas en mesure de les connaître ;\n2° Qu'au moment de la conclusion du contrat, les déclarations publiques avaient été rectifiées dans des\nconditions comparables aux déclarations initiales ; ou\n3° Que les déclarations publiques n'ont pas pu avoir d'influence sur la décision d'achat.\nIII.-Le consommateur ne peut contester la conformité en invoquant un défaut concernant une ou plusieurs\ncaractéristiques particulières du bien, dont il a été spécifiquement informé qu'elles s'écartaient des critères\nde conformité énoncés au présent article, écart auquel il a expressément et séparément consenti lors de la\nconclusion du contrat."", ""Article L217-4\nLe bien est conforme au contrat s'il répond notamment, le cas échéant, aux critères suivants :\n1° Il correspond à la description, au type, à la quantité et à la qualité, notamment en ce qui concerne la\nfonctionnalité, la compatibilité, l'interopérabilité, ou toute autre caractéristique prévues au contrat ;\n2° Il est propre à tout usage spécial recherché par le consommateur, porté à la connaissance du vendeur au\nplus tard au moment de la conclusion du contrat et que ce dernier a accepté ;\n3° Il est délivré avec tous les accessoires et les instructions d'installation, devant être fournis conformément\nau contrat ;\n4° Il est mis à jour conformément au contrat."", ""Article L217-3\nLe vendeur délivre un bien conforme au contrat ainsi qu'aux critères énoncés à l'article L. 217-5.\nIl répond des défauts de conformité existant au moment de la délivrance du bien au sens de l'article L. 216-1,\nqui apparaissent dans un délai de deux ans à compter de celle-ci.\nDans le cas d'un contrat de vente d'un bien comportant des éléments numériques :\n1° Lorsque le contrat prévoit la fourniture continue d'un contenu numérique ou d'un service numérique\npendant une durée inférieure ou égale à deux ans, ou lorsque le contrat ne détermine pas la durée de\nfourniture, le vendeur répond des défauts de conformité de ce contenu numérique ou de ce service numérique\nqui apparaissent dans un délai de deux ans à compter de la délivrance du bien ;\n2° Lorsque le contrat prévoit la fourniture continue d'un contenu numérique ou d'un service numérique\npendant une durée supérieure à deux ans, le vendeur répond des défauts de conformité de ce contenu\nnumérique ou de ce service numérique qui apparaissent au cours de la période durant laquelle celui-ci est\nfourni en vertu du contrat.\nPour de tels biens, le délai applicable ne prive pas le consommateur de son droit aux mises à jour\nconformément aux dispositions de l'article L. 217-19.\nLe vendeur répond également, durant les mêmes délais, des défauts de conformité résultant de l'emballage,\ndes instructions de montage, ou de l'installation lorsque celle-ci a été mise à sa charge par le contrat ou a\nété réalisée sous sa responsabilité, ou encore lorsque l'installation incorrecte, effectuée par le consommateur\ncomme prévu au contrat, est due à des lacunes ou erreurs dans les instructions d'installation fournies par le\nvendeur.\nCe délai de garantie s'applique sans préjudice des articles 2224 et suivants du code civil. Le point de départ\nde la prescription de l'action du consommateur est le jour de la connaissance par ce dernier du défaut de\nconformité."", ""Article L217-21\nLa garantie commerciale s'entend de tout engagement contractuel d'un professionnel, qu'il s'agisse du\nvendeur ou du producteur, y compris par l'intermédiaire de toute autre personne agissant en leur nom ou\npour leur compte (ci-après dénommé “ garant ”), à l'égard du consommateur. Cet engagement a pour objet le\nremboursement du prix d'achat, le remplacement, la réparation du bien ou toute autre prestation de service en\nrelation avec le bien, ou encore toute exigence éventuelle non liée à la conformité et énoncée dans la garantie\ncommerciale, en sus des obligations légales du vendeur visant à garantir la conformité du bien.\nToute garantie commerciale lie le garant conformément aux conditions qu'elle prévoit ou aux conditions\nindiquées dans la publicité qui en a été faite antérieurement à la conclusion du contrat si les conditions\nde cette publicité sont plus favorables, sauf si le garant démontre que la publicité a été rectifiée avant la\nconclusion du contrat selon des modalités identiques ou comparables à la publicité initiale."", ""Article L217-30\nLes dispositions du présent chapitre ne privent pas le consommateur du droit d'exercer l'action résultant de la\ngarantie des vices cachés telle qu'elle résulte des articles 1641 à 1649 du code civil ou toute autre action de\nnature contractuelle ou extracontractuelle qui lui est reconnue par la loi.\nLorsqu'une restriction découlant de la violation des droits de tout tiers, en particulier des droits de propriété\nintellectuelle, empêche ou limite l'utilisation du bien conformément aux dispositions des articles L. 217-4 et\nL. 217-5, la nullité du contrat ou toute autre action de nature contractuelle ou extracontractuelle peuvent être\nencourues par application des dispositions du code civil.""]","Selon l'article L217-5 du Code de la consommation, en plus des critères de conformité au contrat, un bien est conforme s'il répond aux critères suivants :
1. Il est propre à l'usage habituellement attendu d'un bien de même type.
2. Il possède les qualités présentées par le vendeur avant la conclusion du contrat.
3. Les éléments numériques sont fournis selon la version la plus récente disponible au moment de la conclusion du contrat.
4. Il est délivré avec tous les accessoires, y compris l'emballage, et les instructions d'installation que le consommateur peut légitimement attendre.
5. Il est fourni avec les mises à jour que le consommateur peut légitimement attendre.
6. Il correspond à la quantité, à la qualité et aux autres caractéristiques que le consommateur peut légitimement attendre pour des biens de même type, eu égard à la nature du bien ainsi qu'aux déclarations publiques faites par le vendeur.

Ces critères complètent les obligations de conformité du vendeur envers le consommateur.","Le bien doit être propre à l'usage habituellement attendu d'un bien de même type et posséder les qualités que le consommateur peut légitimement attendre eu égard aux déclarations publiques (publicité, étiquetage).",1.0,,0.8333333332916666,1.0
Un produit doit-il nécessairement correspondre à l'usage habituellement attendu d'un bien de même type pour être conforme ?,"[""Article L217-5\nI.-En plus des critères de conformité au contrat, le bien est conforme s'il répond aux critères suivants :\n1° Il est propre à l'usage habituellement attendu d'un bien de même type, compte tenu, s'il y a lieu, de toute\ndisposition du droit de l'Union européenne et du droit national ainsi que de toutes les normes techniques ou,\nen l'absence de telles normes techniques, des codes de conduite spécifiques applicables au secteur concerné ;\n2° Le cas échéant, il possède les qualités que le vendeur a présentées au consommateur sous forme\nd'échantillon ou de modèle, avant la conclusion du contrat ;\n3° Le cas échéant, les éléments numériques qu'il comporte sont fournis selon la version la plus récente qui\nest disponible au moment de la conclusion du contrat, sauf si les parties en conviennent autrement ;\n4° Le cas échéant, il est délivré avec tous les accessoires, y compris l'emballage, et les instructions\nd'installation que le consommateur peut légitimement attendre ;\n5° Le cas échéant, il est fourni avec les mises à jour que le consommateur peut légitimement attendre,\nconformément aux dispositions de l'article L. 217-19 ;\n6° Il correspond à la quantité, à la qualité et aux autres caractéristiques, y compris en termes de durabilité,\nde fonctionnalité, de compatibilité et de sécurité, que le consommateur peut légitimement attendre pour des\nbiens de même type, eu égard à la nature du bien ainsi qu'aux déclarations publiques faites par le vendeur,\npar toute personne en amont dans la chaîne de transactions, ou par une personne agissant pour leur compte, y\ncompris dans la publicité ou sur l'étiquetage.\nII.-Toutefois, le vendeur n'est pas tenu par toutes déclarations publiques mentionnées à l'alinéa qui précède\ns'il démontre :\n1° Qu'il ne les connaissait pas et n'était légitimement pas en mesure de les connaître ;\n2° Qu'au moment de la conclusion du contrat, les déclarations publiques avaient été rectifiées dans des\nconditions comparables aux déclarations initiales ; ou\n3° Que les déclarations publiques n'ont pas pu avoir d'influence sur la décision d'achat.\nIII.-Le consommateur ne peut contester la conformité en invoquant un défaut concernant une ou plusieurs\ncaractéristiques particulières du bien, dont il a été spécifiquement informé qu'elles s'écartaient des critères\nde conformité énoncés au présent article, écart auquel il a expressément et séparément consenti lors de la\nconclusion du contrat."", ""Article L217-11\n\nLa mise en conformité du bien a lieu sans aucun frais pour le consommateur.\nLe consommateur n'est pas tenu de payer pour l'utilisation normale qu'il a faite du bien remplacé pendant la\npériode antérieure à son remplacement."", ""Article L217-9\nLe consommateur est en droit d'exiger la mise en conformité du bien aux critères énoncés dans la sous-\nsection 1 de la présente section.\nLe consommateur sollicite auprès du vendeur la mise en conformité du bien, en choisissant entre la\nréparation et le remplacement. A cette fin, le consommateur met le bien à la disposition du vendeur."", ""Article L217-10\nLa mise en conformité du bien a lieu dans un délai raisonnable qui ne peut être supérieur à trente jours\nsuivant la demande du consommateur et sans inconvénient majeur pour lui, compte tenu de la nature du bien\net de l'usage recherché par le consommateur.\nLa réparation ou le remplacement du bien non conforme inclut, s'il y a lieu, l'enlèvement et la reprise de ce\nbien et l'installation du bien réparé ou du bien de remplacement par le vendeur.\nUn décret précise les modalités de la mise en conformité du bien."", ""Article L217-8\nEn cas de défaut de conformité, le consommateur a droit à la mise en conformité du bien par réparation ou\nremplacement ou, à défaut, à la réduction du prix ou à la résolution du contrat, dans les conditions énoncées\nà la présente sous-section.\nLe consommateur a, par ailleurs, le droit de suspendre le paiement de tout ou partie du prix ou la remise de\nl'avantage prévu au contrat jusqu'à ce que le vendeur ait satisfait aux obligations qui lui incombent au titre du\nprésent chapitre, dans les conditions des articles 1219 et 1220 du code civil.\nLes dispositions du présent chapitre sont sans préjudice de l'allocation de dommages et intérêts.""]","Oui, selon l'article L217-5 I.1 du Code de la consommation, pour qu'un bien soit considéré comme conforme, il doit être propre à l'usage habituellement attendu d'un bien de même type. Cela signifie que le produit doit correspondre aux attentes normales que pourrait avoir un consommateur pour un bien similaire. Ainsi, cette condition est l'un des critères de conformité au contrat.","Oui, sauf si le consommateur a consenti expressément à une caractéristique particulière s'écartant de ces critères.",1.0,,0.699999999965,1.0
"J'ai acheté une montre connectée ""étanche"" selon la publicité, mais le manuel dit qu'elle ne résiste qu'aux éclaboussures. Elle a pris l'eau sous la douche. Le vendeur est-il responsable au regard des déclarations publiques faites dans la publicité ?","[""Article L217-5\nI.-En plus des critères de conformité au contrat, le bien est conforme s'il répond aux critères suivants :\n1° Il est propre à l'usage habituellement attendu d'un bien de même type, compte tenu, s'il y a lieu, de toute\ndisposition du droit de l'Union européenne et du droit national ainsi que de toutes les normes techniques ou,\nen l'absence de telles normes techniques, des codes de conduite spécifiques applicables au secteur concerné ;\n2° Le cas échéant, il possède les qualités que le vendeur a présentées au consommateur sous forme\nd'échantillon ou de modèle, avant la conclusion du contrat ;\n3° Le cas échéant, les éléments numériques qu'il comporte sont fournis selon la version la plus récente qui\nest disponible au moment de la conclusion du contrat, sauf si les parties en conviennent autrement ;\n4° Le cas échéant, il est délivré avec tous les accessoires, y compris l'emballage, et les instructions\nd'installation que le consommateur peut légitimement attendre ;\n5° Le cas échéant, il est fourni avec les mises à jour que le consommateur peut légitimement attendre,\nconformément aux dispositions de l'article L. 217-19 ;\n6° Il correspond à la quantité, à la qualité et aux autres caractéristiques, y compris en termes de durabilité,\nde fonctionnalité, de compatibilité et de sécurité, que le consommateur peut légitimement attendre pour des\nbiens de même type, eu égard à la nature du bien ainsi qu'aux déclarations publiques faites par le vendeur,\npar toute personne en amont dans la chaîne de transactions, ou par une personne agissant pour leur compte, y\ncompris dans la publicité ou sur l'étiquetage.\nII.-Toutefois, le vendeur n'est pas tenu par toutes déclarations publiques mentionnées à l'alinéa qui précède\ns'il démontre :\n1° Qu'il ne les connaissait pas et n'était légitimement pas en mesure de les connaître ;\n2° Qu'au moment de la conclusion du contrat, les déclarations publiques avaient été rectifiées dans des\nconditions comparables aux déclarations initiales ; ou\n3° Que les déclarations publiques n'ont pas pu avoir d'influence sur la décision d'achat.\nIII.-Le consommateur ne peut contester la conformité en invoquant un défaut concernant une ou plusieurs\ncaractéristiques particulières du bien, dont il a été spécifiquement informé qu'elles s'écartaient des critères\nde conformité énoncés au présent article, écart auquel il a expressément et séparément consenti lors de la\nconclusion du contrat."", ""Article L217-19\nI.-Le vendeur veille à ce que le consommateur soit informé et reçoive les mises à jour nécessaires au\nmaintien de la conformité des biens :\n1° Durant une période à laquelle le consommateur peut légitimement s'attendre, eu égard au type et à la\nfinalité des biens et éléments numériques et compte tenu des circonstances et de la nature du contrat, dans le\ncas d'une opération de fourniture unique du contenu numérique ou du service numérique ;\n2° Durant une période de deux ans à compter du moment où les biens comportant des éléments numériques\nont été délivrés, lorsque le contrat de vente prévoit la fourniture continue du contenu numérique ou du\nservice numérique pendant une certaine période ;\n3° Durant la période pendant laquelle le contenu numérique ou le service numérique est fourni en vertu du\ncontrat lorsque celui-ci en prévoit la fourniture continue pendant une durée supérieure à deux ans.\nII.-Lorsque le consommateur n'installe pas, dans un délai raisonnable, les mises à jour mentionnées au I,\nle vendeur n'est pas responsable des défauts de conformité résultant uniquement de la non-installation des\nmises à jour concernées, à condition que :\n1° Le vendeur ait informé le consommateur de la disponibilité des mises à jour et des conséquences de leur\nnon-installation par le consommateur ; et\n2° La non-installation ou l'installation incorrecte par le consommateur des mises à jour ne soit pas due à des\nlacunes dans les instructions d'installation fournies au consommateur."", ""Article L217-3\nLe vendeur délivre un bien conforme au contrat ainsi qu'aux critères énoncés à l'article L. 217-5.\nIl répond des défauts de conformité existant au moment de la délivrance du bien au sens de l'article L. 216-1,\nqui apparaissent dans un délai de deux ans à compter de celle-ci.\nDans le cas d'un contrat de vente d'un bien comportant des éléments numériques :\n1° Lorsque le contrat prévoit la fourniture continue d'un contenu numérique ou d'un service numérique\npendant une durée inférieure ou égale à deux ans, ou lorsque le contrat ne détermine pas la durée de\nfourniture, le vendeur répond des défauts de conformité de ce contenu numérique ou de ce service numérique\nqui apparaissent dans un délai de deux ans à compter de la délivrance du bien ;\n2° Lorsque le contrat prévoit la fourniture continue d'un contenu numérique ou d'un service numérique\npendant une durée supérieure à deux ans, le vendeur répond des défauts de conformité de ce contenu\nnumérique ou de ce service numérique qui apparaissent au cours de la période durant laquelle celui-ci est\nfourni en vertu du contrat.\nPour de tels biens, le délai applicable ne prive pas le consommateur de son droit aux mises à jour\nconformément aux dispositions de l'article L. 217-19.\nLe vendeur répond également, durant les mêmes délais, des défauts de conformité résultant de l'emballage,\ndes instructions de montage, ou de l'installation lorsque celle-ci a été mise à sa charge par le contrat ou a\nété réalisée sous sa responsabilité, ou encore lorsque l'installation incorrecte, effectuée par le consommateur\ncomme prévu au contrat, est due à des lacunes ou erreurs dans les instructions d'installation fournies par le\nvendeur.\nCe délai de garantie s'applique sans préjudice des articles 2224 et suivants du code civil. Le point de départ\nde la prescription de l'action du consommateur est le jour de la connaissance par ce dernier du défaut de\nconformité."", ""Article L217-21\nLa garantie commerciale s'entend de tout engagement contractuel d'un professionnel, qu'il s'agisse du\nvendeur ou du producteur, y compris par l'intermédiaire de toute autre personne agissant en leur nom ou\npour leur compte (ci-après dénommé “ garant ”), à l'égard du consommateur. Cet engagement a pour objet le\nremboursement du prix d'achat, le remplacement, la réparation du bien ou toute autre prestation de service en\nrelation avec le bien, ou encore toute exigence éventuelle non liée à la conformité et énoncée dans la garantie\ncommerciale, en sus des obligations légales du vendeur visant à garantir la conformité du bien.\nToute garantie commerciale lie le garant conformément aux conditions qu'elle prévoit ou aux conditions\nindiquées dans la publicité qui en a été faite antérieurement à la conclusion du contrat si les conditions\nde cette publicité sont plus favorables, sauf si le garant démontre que la publicité a été rectifiée avant la\nconclusion du contrat selon des modalités identiques ou comparables à la publicité initiale."", ""Article L217-12\nLe vendeur peut ne pas procéder selon le choix opéré par le consommateur si la mise en conformité sollicitée\nest impossible ou entraîne des coûts disproportionnés au regard notamment :\n1° De la valeur qu'aurait le bien en l'absence de défaut de conformité ;\n2° De l'importance du défaut de conformité ; et\n3° De la possibilité éventuelle d'opter pour l'autre choix sans inconvénient majeur pour le consommateur.\nLe vendeur peut refuser la mise en conformité du bien si celle-ci est impossible ou entraîne des coûts\ndisproportionnés notamment au regard des 1° et 2°.\nLorsque ces conditions ne sont pas respectées, le consommateur peut, après mise en demeure, poursuivre\nl'exécution forcée en nature de la solution initialement sollicitée, conformément aux articles 1221 et suivants\ndu code civil.\nTout refus par le vendeur de procéder selon le choix du consommateur ou de mettre le bien en conformité,\nest motivé par écrit ou sur support durable.""]","Selon l'article L217-5 du Code de la consommation, le bien doit correspondre aux déclarations publiques faites par le vendeur, notamment dans la publicité ou sur l'étiquetage. En l'occurrence, si la publicité indiquait que la montre connectée était ""étanche"" mais que le manuel précise qu'elle ne résiste qu'aux éclaboussures, il y a un écart entre les déclarations publiques et les caractéristiques réelles du bien.

En conséquence, en vertu de l'article L217-3 du Code de la consommation, le vendeur est responsable des défauts de conformité du bien existant au moment de la délivrance, et ce pendant une période de deux ans à compter de celle-ci. Dans ce cas, si la montre connectée n'est pas conforme à ce qui a été annoncé dans la publicité, le vendeur est tenu de prendre en charge la situation.

Ainsi, vous pouvez demander au vendeur de mettre en conformité le bien en le réparant, en le remplaçant ou en vous remboursant, conformément à l'article L217-12 du Code de la consommation. Si le vendeur refuse ou si la mise en conformité est impossible ou disproportionnée, vous pouvez exiger l'exécution forcée de la solution initialement sollicitée après mise en demeure.

En conclusion, dans le cas où la montre connectée n'est pas conforme à ce qui a été annoncé dans la publicité en termes d'étanchéité, le vendeur est effectivement responsable au regard des dispositions légales en vigueur.","Oui, le vendeur est tenu par les déclarations publiques (publicité) sur les qualités du bien, sauf s'il prouve qu'il ne les connaissait pas ou qu'elles ont été rectifiées avant la vente.",1.0,,0.99999999998,1.0
"Selon l'article L. 217-12, dans quel cas le vendeur peut-il refuser de procéder selon le choix opéré par le consommateur (réparation ou remplacement) ?","[""Article L217-12\nLe vendeur peut ne pas procéder selon le choix opéré par le consommateur si la mise en conformité sollicitée\nest impossible ou entraîne des coûts disproportionnés au regard notamment :\n1° De la valeur qu'aurait le bien en l'absence de défaut de conformité ;\n2° De l'importance du défaut de conformité ; et\n3° De la possibilité éventuelle d'opter pour l'autre choix sans inconvénient majeur pour le consommateur.\nLe vendeur peut refuser la mise en conformité du bien si celle-ci est impossible ou entraîne des coûts\ndisproportionnés notamment au regard des 1° et 2°.\nLorsque ces conditions ne sont pas respectées, le consommateur peut, après mise en demeure, poursuivre\nl'exécution forcée en nature de la solution initialement sollicitée, conformément aux articles 1221 et suivants\ndu code civil.\nTout refus par le vendeur de procéder selon le choix du consommateur ou de mettre le bien en conformité,\nest motivé par écrit ou sur support durable."", ""Article L217-14\nLe consommateur a droit à une réduction du prix du bien ou à la résolution du contrat dans les cas suivants :\n1° Lorsque le professionnel refuse toute mise en conformité ;\n2° Lorsque la mise en conformité intervient au-delà d'un délai de trente jours suivant la demande du\nconsommateur ou si elle lui occasionne un inconvénient majeur ;\n3° Si le consommateur supporte définitivement les frais de reprise ou d'enlèvement du bien non conforme, ou\ns'il supporte l'installation du bien réparé ou de remplacement ou les frais y afférents ;\n4° Lorsque la non-conformité du bien persiste en dépit de la tentative de mise en conformité du vendeur\nrestée infructueuse.\nLe consommateur a également droit à une réduction du prix du bien ou à la résolution du contrat lorsque\nle défaut de conformité est si grave qu'il justifie que la réduction du prix ou la résolution du contrat soit\nimmédiate. Le consommateur n'est alors pas tenu de demander la réparation ou le remplacement du bien au\npréalable.\n\nLe consommateur n'a pas droit à la résolution de la vente si le défaut de conformité est mineur, ce qu'il\nincombe au vendeur de démontrer. Le présent alinéa n'est pas applicable aux contrats dans lesquels le\nconsommateur ne procède pas au paiement d'un prix."", ""Article L217-20\nS'agissant des mises à jour qui ne sont pas nécessaires au maintien de la conformité du bien, le vendeur\nrespecte les conditions suivantes :\n1° Le contrat autorise le principe de telles mises à jour et en fournit une raison valable ;\n2° Le vendeur informe le consommateur, de manière claire et compréhensible, raisonnablement en avance et\nsur un support durable, de la mise à jour envisagée en lui précisant la date à laquelle elle intervient ;\n3° La mise à jour est effectuée sans coût supplémentaire pour le consommateur ;\n4° Le vendeur informe le consommateur que celui-ci est en droit de refuser la mise à jour ou, le cas échéant,\nde la désinstaller, si la mise à jour a une incidence négative sur son accès au contenu numérique ou au\nservice numérique ou à son utilisation de ceux-ci.\nDans ce dernier cas, la résolution du contrat est de droit et sans frais pour le consommateur, dans un\ndélai maximal de trente jours, à moins que la mise à jour n'ait qu'une incidence mineure pour lui. Le\nconsommateur ne peut toutefois résoudre le contrat si le vendeur lui a proposé de conserver le contenu\nnumérique ou le service numérique sans modification, y compris au moyen d'une désinstallation de la mise à\njour, et si ce dernier demeure en conformité dans les conditions prévues à la présente section.\nLorsque le consommateur exerce son droit à la résolution du contrat, les dispositions des articles L. 217-16 et\nL. 217-17 s'appliquent.\nLe présent article n'est pas applicable en cas d'offre groupée au sens de l'article L. 224-42-2.\n\nSection 3 : Garantie commerciale"", ""Article L217-21\nLa garantie commerciale s'entend de tout engagement contractuel d'un professionnel, qu'il s'agisse du\nvendeur ou du producteur, y compris par l'intermédiaire de toute autre personne agissant en leur nom ou\npour leur compte (ci-après dénommé “ garant ”), à l'égard du consommateur. Cet engagement a pour objet le\nremboursement du prix d'achat, le remplacement, la réparation du bien ou toute autre prestation de service en\nrelation avec le bien, ou encore toute exigence éventuelle non liée à la conformité et énoncée dans la garantie\ncommerciale, en sus des obligations légales du vendeur visant à garantir la conformité du bien.\nToute garantie commerciale lie le garant conformément aux conditions qu'elle prévoit ou aux conditions\nindiquées dans la publicité qui en a été faite antérieurement à la conclusion du contrat si les conditions\nde cette publicité sont plus favorables, sauf si le garant démontre que la publicité a été rectifiée avant la\nconclusion du contrat selon des modalités identiques ou comparables à la publicité initiale."", ""Article L217-26\nLorsqu'il propose des réparations forfaitaires, le vendeur informe le consommateur par écrit ou sur un\nsupport durable, au plus tard lors de la conclusion du contrat, le cas échéant, de l'origine de la panne, de la\nnature de l'intervention envisagée et des pièces à remplacer.\nIl informe dans les mêmes conditions le consommateur que ce dernier ne bénéficie pas de la garantie\nlégale de conformité pour les pièces ou fournitures fournies à titre accessoire dans le cadre de la prestation\neffectuée, à moins que celles-ci constituent l'objet principal du contrat conclu ou qu'elles n'aient été acquises\npar le consommateur dans le cadre d'un contrat de vente distinct.""]","Selon l'article L217-12, le vendeur peut refuser de procéder selon le choix opéré par le consommateur (réparation ou remplacement) si la mise en conformité sollicitée est impossible ou entraîne des coûts disproportionnés au regard notamment de la valeur qu'aurait le bien en l'absence de défaut de conformité, de l'importance du défaut de conformité et de la possibilité éventuelle d'opter pour l'autre choix sans inconvénient majeur pour le consommateur. En d'autres termes, le vendeur peut refuser si la mise en conformité demandée est impossible ou disproportionnée par rapport à ces critères.","Le vendeur peut refuser le choix du consommateur si celui-ci est impossible ou entraîne des coûts disproportionnés par rapport à l'autre option, compte tenu de la valeur du bien ou de l'importance du défaut.",0.8888888888888888,,0.9999999999,1.0
Le vendeur a-t-il le droit de m'imposer la réparation de mon appareil en panne si je demande son remplacement à neuf ?,"[""Article L217-9\nLe consommateur est en droit d'exiger la mise en conformité du bien aux critères énoncés dans la sous-\nsection 1 de la présente section.\nLe consommateur sollicite auprès du vendeur la mise en conformité du bien, en choisissant entre la\nréparation et le remplacement. A cette fin, le consommateur met le bien à la disposition du vendeur."", ""Article L217-26\nLorsqu'il propose des réparations forfaitaires, le vendeur informe le consommateur par écrit ou sur un\nsupport durable, au plus tard lors de la conclusion du contrat, le cas échéant, de l'origine de la panne, de la\nnature de l'intervention envisagée et des pièces à remplacer.\nIl informe dans les mêmes conditions le consommateur que ce dernier ne bénéficie pas de la garantie\nlégale de conformité pour les pièces ou fournitures fournies à titre accessoire dans le cadre de la prestation\neffectuée, à moins que celles-ci constituent l'objet principal du contrat conclu ou qu'elles n'aient été acquises\npar le consommateur dans le cadre d'un contrat de vente distinct."", ""Article L217-13\nTout bien réparé dans le cadre de la garantie légale de conformité bénéficie d'une extension de cette garantie\nde six mois.\nDès lors que le consommateur fait le choix de la réparation mais que celle-ci n'est pas mise en œuvre par\nle vendeur, la mise en conformité par le remplacement du bien fait courir, au bénéfice du consommateur,\nun nouveau délai de garantie légale de conformité attaché au bien remplacé. Cette disposition s'applique à\ncompter du jour où le bien de remplacement est délivré au consommateur."", ""Article L217-8\nEn cas de défaut de conformité, le consommateur a droit à la mise en conformité du bien par réparation ou\nremplacement ou, à défaut, à la réduction du prix ou à la résolution du contrat, dans les conditions énoncées\nà la présente sous-section.\nLe consommateur a, par ailleurs, le droit de suspendre le paiement de tout ou partie du prix ou la remise de\nl'avantage prévu au contrat jusqu'à ce que le vendeur ait satisfait aux obligations qui lui incombent au titre du\nprésent chapitre, dans les conditions des articles 1219 et 1220 du code civil.\nLes dispositions du présent chapitre sont sans préjudice de l'allocation de dommages et intérêts."", ""Article L217-10\nLa mise en conformité du bien a lieu dans un délai raisonnable qui ne peut être supérieur à trente jours\nsuivant la demande du consommateur et sans inconvénient majeur pour lui, compte tenu de la nature du bien\net de l'usage recherché par le consommateur.\nLa réparation ou le remplacement du bien non conforme inclut, s'il y a lieu, l'enlèvement et la reprise de ce\nbien et l'installation du bien réparé ou du bien de remplacement par le vendeur.\nUn décret précise les modalités de la mise en conformité du bien.""]","Selon l'article L217-9 du Code de la consommation, le consommateur a le droit d'exiger la mise en conformité du bien en choisissant entre la réparation et le remplacement. Ainsi, si vous demandez le remplacement de votre appareil en panne, le vendeur ne peut pas vous imposer la réparation à la place. Vous avez le droit de choisir entre ces deux options, conformément à la loi.","Oui, mais uniquement si le remplacement entraîne un coût disproportionné pour le vendeur par rapport à la réparation.",0.75,,0.99999999998,0.0
"Mon lave-linge est en panne. Je demande un remplacement à neuf, mais le vendeur me dit que changer la petite pièce défectueuse coûte 10 fois moins cher et qu'il va donc procéder à la réparation. A-t-il le droit de faire cela ?","[""Article L217-9\nLe consommateur est en droit d'exiger la mise en conformité du bien aux critères énoncés dans la sous-\nsection 1 de la présente section.\nLe consommateur sollicite auprès du vendeur la mise en conformité du bien, en choisissant entre la\nréparation et le remplacement. A cette fin, le consommateur met le bien à la disposition du vendeur."", ""Article L217-8\nEn cas de défaut de conformité, le consommateur a droit à la mise en conformité du bien par réparation ou\nremplacement ou, à défaut, à la réduction du prix ou à la résolution du contrat, dans les conditions énoncées\nà la présente sous-section.\nLe consommateur a, par ailleurs, le droit de suspendre le paiement de tout ou partie du prix ou la remise de\nl'avantage prévu au contrat jusqu'à ce que le vendeur ait satisfait aux obligations qui lui incombent au titre du\nprésent chapitre, dans les conditions des articles 1219 et 1220 du code civil.\nLes dispositions du présent chapitre sont sans préjudice de l'allocation de dommages et intérêts."", ""Article L217-26\nLorsqu'il propose des réparations forfaitaires, le vendeur informe le consommateur par écrit ou sur un\nsupport durable, au plus tard lors de la conclusion du contrat, le cas échéant, de l'origine de la panne, de la\nnature de l'intervention envisagée et des pièces à remplacer.\nIl informe dans les mêmes conditions le consommateur que ce dernier ne bénéficie pas de la garantie\nlégale de conformité pour les pièces ou fournitures fournies à titre accessoire dans le cadre de la prestation\neffectuée, à moins que celles-ci constituent l'objet principal du contrat conclu ou qu'elles n'aient été acquises\npar le consommateur dans le cadre d'un contrat de vente distinct."", ""Article L217-13\nTout bien réparé dans le cadre de la garantie légale de conformité bénéficie d'une extension de cette garantie\nde six mois.\nDès lors que le consommateur fait le choix de la réparation mais que celle-ci n'est pas mise en œuvre par\nle vendeur, la mise en conformité par le remplacement du bien fait courir, au bénéfice du consommateur,\nun nouveau délai de garantie légale de conformité attaché au bien remplacé. Cette disposition s'applique à\ncompter du jour où le bien de remplacement est délivré au consommateur."", ""Article L217-10\nLa mise en conformité du bien a lieu dans un délai raisonnable qui ne peut être supérieur à trente jours\nsuivant la demande du consommateur et sans inconvénient majeur pour lui, compte tenu de la nature du bien\net de l'usage recherché par le consommateur.\nLa réparation ou le remplacement du bien non conforme inclut, s'il y a lieu, l'enlèvement et la reprise de ce\nbien et l'installation du bien réparé ou du bien de remplacement par le vendeur.\nUn décret précise les modalités de la mise en conformité du bien.""]","Selon l'article L217-9 du Code de la consommation, en cas de défaut de conformité, le consommateur a le droit d'exiger la mise en conformité du bien en choisissant entre la réparation et le remplacement. Cependant, le vendeur peut proposer la réparation si celle-ci est moins coûteuse que le remplacement et qu'elle peut être effectuée dans un délai raisonnable, comme le prévoit l'article L217-10.

Donc, si le vendeur vous informe que la réparation est moins coûteuse et peut être effectuée dans un délai raisonnable, il est en droit de procéder à la réparation de votre lave-linge plutôt que de le remplacer.","Oui, le vendeur est en droit d'imposer la réparation car le coût du remplacement est manifestement disproportionné par rapport à la réparation.",0.5,,0.99999999998,1.0
Quel est le délai de rétractation prévu par l'article L. 221-18 pour un contrat conclu à distance ?,"[""Article L221-18\nLe consommateur dispose d'un délai de quatorze jours pour exercer son droit de rétractation d'un contrat\nconclu à distance, à la suite d'un démarchage téléphonique ou hors établissement, sans avoir à motiver sa\ndécision ni à supporter d'autres coûts que ceux prévus aux articles L. 221-23 à L. 221-25.\nLe délai mentionné au premier alinéa court à compter du jour :\n1° De la conclusion du contrat, pour les contrats de prestation de services et ceux mentionnés à l'article L.\n221-4 ;\n2° De la réception du bien par le consommateur ou un tiers, autre que le transporteur, désigné par lui, pour\nles contrats de vente de biens. Pour les contrats conclus hors établissement, le consommateur peut exercer\nson droit de rétractation à compter de la conclusion du contrat.\nDans le cas d'une commande portant sur plusieurs biens livrés séparément ou dans le cas d'une commande\nd'un bien composé de lots ou de pièces multiples dont la livraison est échelonnée sur une période définie, le\ndélai court à compter de la réception du dernier bien ou lot ou de la dernière pièce.\nPour les contrats prévoyant la livraison régulière de biens pendant une période définie, le délai court à\ncompter de la réception du premier bien."", ""Article L221-20\nLorsque les informations relatives au droit de rétractation n'ont pas été fournies au consommateur dans les\nconditions prévues au 7° de l'article L. 221-5, le délai de rétractation est prolongé de douze mois à compter\nde l'expiration du délai de rétractation initial, déterminé conformément à l'article L. 221-18.\nToutefois, lorsque la fourniture de ces informations intervient pendant cette prolongation, le délai de\nrétractation expire au terme d'une période de quatorze jours à compter du jour où le consommateur a reçu ces\ninformations."", ""Article L221-21\n\nLe consommateur exerce son droit de rétractation en informant le professionnel de sa décision de se rétracter\npar l'envoi, avant l'expiration du délai prévu à l'article L. 221-18, du formulaire de rétractation mentionné\nau 7° de l'article L. 221-5 ou de toute autre déclaration, dénuée d'ambiguïté, exprimant sa volonté de se\nrétracter.\nLe professionnel peut également permettre au consommateur de remplir et de transmettre en ligne, sur son\nsite internet, le formulaire ou la déclaration prévus au premier alinéa. Dans cette hypothèse, le professionnel\ncommunique, sans délai, au consommateur un accusé de réception de la rétractation sur un support durable."", ""Article L221-25\n\nSi le consommateur souhaite que l'exécution d'une prestation de services ou d'un contrat mentionné au\npremier alinéa de l'article L. 221-4 commence avant la fin du délai de rétractation prévu à l'article L. 221-18\net si le contrat soumet le consommateur à une obligation de payer, le professionnel recueille sa demande\nexpresse par tout moyen pour les contrats conclus à distance et sur papier ou sur support durable pour\nles contrats conclus hors établissement. Il demande au consommateur de reconnaître qu'après qu'il aura\nentièrement exécuté le contrat, celui-ci ne disposera plus du droit de rétractation.\nLe consommateur qui a exercé son droit de rétractation d'un contrat de prestation de services ou d'un contrat\nmentionné au premier alinéa de l'article L. 221-4 dont l'exécution a commencé, à sa demande expresse, avant\nla fin du délai de rétractation verse au professionnel un montant correspondant au service fourni jusqu'à\nla communication de sa décision de se rétracter ; ce montant est proportionné au prix total de la prestation\nconvenu dans le contrat. Si le prix total est excessif, le montant approprié est calculé sur la base de la valeur\nmarchande de ce qui a été fourni.\nAucune somme n'est due par le consommateur ayant exercé son droit de rétractation si sa demande expresse\nn'a pas été recueillie en application du premier alinéa ou si le professionnel n'a pas respecté l'obligation\nd'information prévue au 9° de l'article L. 221-5."", ""Article L221-19\nConformément au règlement n° 1182/71/ CEE du Conseil du 3 juin 1971 portant détermination des règles\napplicables aux délais, aux dates et aux termes :\n1° Le jour où le contrat est conclu ou le jour de la réception du bien n'est pas compté dans le délai mentionné\nà l'article L. 221-18 ;\n2° Le délai commence à courir au début de la première heure du premier jour et prend fin à l'expiration de la\ndernière heure du dernier jour du délai ;\n3° Si ce délai expire un samedi, un dimanche ou un jour férié ou chômé, il est prorogé jusqu'au premier jour\nouvrable suivant.""]","Selon l'article L221-18 du Code de la consommation, le consommateur dispose d'un délai de quatorze jours pour exercer son droit de rétractation d'un contrat conclu à distance, à la suite d'un démarchage téléphonique ou hors établissement. Ce délai de rétractation court à compter du jour de la réception du bien par le consommateur pour les contrats de vente de biens.",Le délai de rétractation est de quatorze jours.,1.0,,0.99999999995,1.0
Combien de temps ai-je pour changer d'avis et renvoyer un produit acheté sur internet sans avoir à me justifier ?,"[""Article L222-15\nLe fournisseur rembourse au consommateur dans les meilleurs délais et au plus tard dans les trente jours\ntoutes les sommes qu'il a perçues de celui-ci en application du contrat, à l'exception du montant mentionné\nau premier alinéa de l'article L. 222-13. Ce délai commence à courir le jour où le fournisseur reçoit\nnotification par le consommateur de sa volonté de se rétracter.\nLe consommateur restitue au fournisseur dans les meilleurs délais et au plus tard dans les trente jours\ntoute somme et tout bien qu'il a reçus de ce dernier. Ce délai commence à courir à compter du jour où le\nconsommateur communique au fournisseur sa volonté de se rétracter.\nSection 5 : Dispositions particulières"", ""Article L222-7\nLe consommateur dispose d'un délai de quatorze jours calendaires révolus pour exercer son droit de\nrétractation, sans avoir à justifier de motif ni à supporter de pénalités.\nLe délai pendant lequel peut s'exercer le droit de rétractation court à compter du jour où :\n1° Le contrat à distance est conclu ;\n2° Le consommateur reçoit les conditions contractuelles et les informations, conformément à l'article L.\n222-6, si cette dernière date est postérieure à celle mentionnée au 1°."", ""Article L221-20\nLorsque les informations relatives au droit de rétractation n'ont pas été fournies au consommateur dans les\nconditions prévues au 7° de l'article L. 221-5, le délai de rétractation est prolongé de douze mois à compter\nde l'expiration du délai de rétractation initial, déterminé conformément à l'article L. 221-18.\nToutefois, lorsque la fourniture de ces informations intervient pendant cette prolongation, le délai de\nrétractation expire au terme d'une période de quatorze jours à compter du jour où le consommateur a reçu ces\ninformations."", 'Article L217-17\nLe remboursement au consommateur des sommes dues par le vendeur au titre de la présente sous-section\nest effectué dès réception du bien ou de la preuve de son renvoi par le consommateur et au plus tard dans les\nquatorze jours suivants.\nLe vendeur rembourse ces sommes en recourant au même moyen de paiement que celui utilisé par le\nconsommateur lors de la conclusion du contrat, sauf accord exprès de ce dernier et en tout état de cause sans\nfrais supplémentaire.\nSous-section 3 : Mises à jour', ""Article L221-23\nLe consommateur renvoie ou restitue les biens au professionnel ou à une personne désignée par ce dernier,\nsans retard excessif et, au plus tard, dans les quatorze jours suivant la communication de sa décision de se\nrétracter conformément à l'article L. 221-21, à moins que le professionnel ne propose de récupérer lui-même\nces biens.\nLe consommateur ne supporte que les coûts directs de renvoi des biens, sauf si le professionnel accepte de\nles prendre à sa charge ou s'il a omis d'informer le consommateur que ces coûts sont à sa charge. Néanmoins,\npour les contrats conclus hors établissement, lorsque les biens sont livrés au domicile du consommateur au\nmoment de la conclusion du contrat, le professionnel récupère les biens à ses frais s'ils ne peuvent pas être\nrenvoyés normalement par voie postale en raison de leur nature.\nLa responsabilité du consommateur ne peut être engagée qu'en cas de dépréciation des biens résultant\nde manipulations autres que celles nécessaires pour établir la nature, les caractéristiques et le bon\nfonctionnement de ces biens, sous réserve que le professionnel ait informé le consommateur de son droit de\nrétractation, conformément au 7° de l'article L. 221-5.""]","Pour changer d'avis et renvoyer un produit acheté sur internet sans avoir à vous justifier, vous disposez d'un délai de rétractation de 14 jours calendaires révolus à compter de la réception du produit, conformément à l'article L222-7 du Code de la consommation. Ce délai vous permet de notifier votre volonté de vous rétracter et de renvoyer le produit au vendeur dans les 14 jours suivant cette notification, comme le précise l'article L221-23. Le vendeur devra alors vous rembourser dans les 14 jours suivant la réception du produit ou la preuve de son renvoi, selon l'article L217-17.",Vous disposez de 14 jours à compter de la réception du bien pour exercer votre droit de rétractation sans justification.,1.0,,0.99999999998,1.0
J'ai reçu ma commande de vêtements achetée en ligne le 1er du mois. Nous sommes le 10. Puis-je encore renvoyer le colis et demander le remboursement sans donner de motif ?,"[""Article L221-24\nLorsque le droit de rétractation est exercé, le professionnel rembourse le consommateur de la totalité des\nsommes versées, y compris les frais de livraison, sans retard injustifié et au plus tard dans les quatorze jours\nà compter de la date à laquelle il est informé de la décision du consommateur de se rétracter.\nPour les contrats de vente de biens, à moins qu'il ne propose de récupérer lui-même les biens, le\nprofessionnel peut différer le remboursement jusqu'à récupération des biens ou jusqu'à ce que le\nconsommateur ait fourni une preuve de l'expédition de ces biens, la date retenue étant celle du premier de ces\nfaits.\nLe professionnel effectue ce remboursement en utilisant le même moyen de paiement que celui utilisé par\nle consommateur pour la transaction initiale, sauf accord exprès du consommateur pour qu'il utilise un autre\nmoyen de paiement et dans la mesure où le remboursement n'occasionne pas de frais pour le consommateur.\nLe professionnel n'est pas tenu de rembourser les frais supplémentaires si le consommateur a expressément\nchoisi un mode de livraison plus coûteux que le mode de livraison standard proposé par le professionnel."", ""Article L222-7\nLe consommateur dispose d'un délai de quatorze jours calendaires révolus pour exercer son droit de\nrétractation, sans avoir à justifier de motif ni à supporter de pénalités.\nLe délai pendant lequel peut s'exercer le droit de rétractation court à compter du jour où :\n1° Le contrat à distance est conclu ;\n2° Le consommateur reçoit les conditions contractuelles et les informations, conformément à l'article L.\n222-6, si cette dernière date est postérieure à celle mentionnée au 1°."", 'Article L217-17\nLe remboursement au consommateur des sommes dues par le vendeur au titre de la présente sous-section\nest effectué dès réception du bien ou de la preuve de son renvoi par le consommateur et au plus tard dans les\nquatorze jours suivants.\nLe vendeur rembourse ces sommes en recourant au même moyen de paiement que celui utilisé par le\nconsommateur lors de la conclusion du contrat, sauf accord exprès de ce dernier et en tout état de cause sans\nfrais supplémentaire.\nSous-section 3 : Mises à jour', ""Article L216-5\nLe professionnel indique par écrit au consommateur lors de son achat, s'il y a lieu, le coût de la livraison\net de mise en service du bien. Un écrit est laissé au consommateur lors de l'entrée en possession du bien,\nmentionnant la possibilité pour le consommateur de formuler des réserves, notamment en cas de défaut du\nbien ou de défaut de remise de la notice d'emploi ou des instructions d'installation.\nL'absence de réserves formulées par le consommateur lors de la réception du bien n'exonère pas le\nprofessionnel de la garantie de conformité du bien qu'il doit au consommateur."", ""Article L221-23\nLe consommateur renvoie ou restitue les biens au professionnel ou à une personne désignée par ce dernier,\nsans retard excessif et, au plus tard, dans les quatorze jours suivant la communication de sa décision de se\nrétracter conformément à l'article L. 221-21, à moins que le professionnel ne propose de récupérer lui-même\nces biens.\nLe consommateur ne supporte que les coûts directs de renvoi des biens, sauf si le professionnel accepte de\nles prendre à sa charge ou s'il a omis d'informer le consommateur que ces coûts sont à sa charge. Néanmoins,\npour les contrats conclus hors établissement, lorsque les biens sont livrés au domicile du consommateur au\nmoment de la conclusion du contrat, le professionnel récupère les biens à ses frais s'ils ne peuvent pas être\nrenvoyés normalement par voie postale en raison de leur nature.\nLa responsabilité du consommateur ne peut être engagée qu'en cas de dépréciation des biens résultant\nde manipulations autres que celles nécessaires pour établir la nature, les caractéristiques et le bon\nfonctionnement de ces biens, sous réserve que le professionnel ait informé le consommateur de son droit de\nrétractation, conformément au 7° de l'article L. 221-5.""]","Oui, en vertu de l'article L222-7 du Code de la consommation, vous disposez d'un délai de quatorze jours pour exercer votre droit de rétractation sans avoir à justifier de motif ni à supporter de pénalités. Comme vous avez reçu votre commande le 1er du mois et que nous sommes le 10, vous êtes toujours dans ce délai de rétractation. Vous pouvez donc renvoyer le colis et demander le remboursement sans donner de motif, conformément à la loi.","Oui, car le délai de 14 jours cours à compter de la réception du bien, vous êtes donc toujours dans les temps.",0.5714285714285714,,0.99999999998,1.0
Citez trois types de contrats pour lesquels le droit de rétractation ne peut être exercé selon l'article L. 221-28.,"[""Article L221-28\nLe droit de rétractation ne peut être exercé pour les contrats :\n1° De fourniture de services pleinement exécutés avant la fin du délai de rétractation et, si le contrat soumet\nle consommateur à une obligation de payer, dont l'exécution a commencé avec son accord préalable et\nexprès et avec la reconnaissance par lui de la perte de son droit de rétractation, lorsque la prestation aura été\npleinement exécutée par le professionnel ;\n2° De fourniture de biens ou de services dont le prix dépend de fluctuations sur le marché financier\néchappant au contrôle du professionnel et susceptibles de se produire pendant le délai de rétractation ;\n3° De fourniture de biens confectionnés selon les spécifications du consommateur ou nettement\npersonnalisés ;\n4° De fourniture de biens susceptibles de se détériorer ou de se périmer rapidement ;\n5° De fourniture de biens qui ont été descellés par le consommateur après la livraison et qui ne peuvent être\nrenvoyés pour des raisons d'hygiène ou de protection de la santé ;\n6° De fourniture de biens qui, après avoir été livrés et de par leur nature, sont mélangés de manière\nindissociable avec d'autres articles ;\n7° De fourniture de boissons alcoolisées dont la livraison est différée au-delà de trente jours et dont la\nvaleur convenue à la conclusion du contrat dépend de fluctuations sur le marché échappant au contrôle du\nprofessionnel ;\n8° De travaux d'entretien ou de réparation à réaliser en urgence au domicile du consommateur et\nexpressément sollicités par lui, dans la limite des pièces de rechange et travaux strictement nécessaires pour\nrépondre à l'urgence ;\n9° De fourniture d'enregistrements audio ou vidéo ou de logiciels informatiques lorsqu'ils ont été descellés\npar le consommateur après la livraison ;\n10° De fourniture d'un journal, d'un périodique ou d'un magazine, sauf pour les contrats d'abonnement à ces\npublications ;\n11° Conclus lors d'une enchère publique ;\n\n12° De prestations de services d'hébergement, autres que d'hébergement résidentiel, de services de transport\nde biens, de locations de voitures, de restauration ou d'activités de loisirs qui doivent être fournis à une date\nou à une période déterminée ;\n13° De fourniture d'un contenu numérique sans support matériel dont l'exécution a commencé avant la fin du\ndélai de rétractation et, si le contrat soumet le consommateur à une obligation de payer, lorsque :\na) Il a donné préalablement son consentement exprès pour que l'exécution du contrat commence avant\nl'expiration du délai de rétractation ; et\nb) Il a reconnu qu'il perdra son droit de rétractation ; et\nc) Le professionnel a fourni une confirmation de l'accord du consommateur conformément aux dispositions\ndu deuxième l'alinéa de l'article L. 221-13.\nSection 7 : Dispositions d'ordre public"", ""Article L222-9\nLe droit de rétractation ne s'applique pas :\n1° A la fourniture d'instruments financiers mentionnés à l'article L. 211-1 du code monétaire et financier\nainsi qu'aux services de réception-transmission et exécution d'ordres pour le compte de tiers mentionnés à\nl'article L. 321-1 du même code ;\n1° bis Aux contrats résultant des opérations mentionnées au paragraphe 1 de l'article 13 du règlement\n(UE) 2023/1114 du 31 mai 2023 sur les marchés de crypto-actifs, pour lesquels seul l'article 13 du même\nrèglement est applicable ;\n\n2° Aux contrats exécutés intégralement par les deux parties à la demande expresse du consommateur avant\nque ce dernier n'exerce son droit de rétractation ;\n3° Aux contrats de crédit immobilier définis à l'article L. 313-1 ;\n4° Aux contrats de prêts viagers hypothécaires définis à l'article L. 315-1."", ""Article L221-27\nL'exercice du droit de rétractation met fin à l'obligation des parties soit d'exécuter le contrat à distance ou le\ncontrat hors établissement, soit de le conclure lorsque le consommateur a fait une offre.\nL'exercice du droit de rétractation d'un contrat principal à distance ou hors établissement met\nautomatiquement fin à tout contrat accessoire, sans frais pour le consommateur autres que ceux prévus aux\narticles L. 221-23 à L. 221-25."", ""Article L221-24\nLorsque le droit de rétractation est exercé, le professionnel rembourse le consommateur de la totalité des\nsommes versées, y compris les frais de livraison, sans retard injustifié et au plus tard dans les quatorze jours\nà compter de la date à laquelle il est informé de la décision du consommateur de se rétracter.\nPour les contrats de vente de biens, à moins qu'il ne propose de récupérer lui-même les biens, le\nprofessionnel peut différer le remboursement jusqu'à récupération des biens ou jusqu'à ce que le\nconsommateur ait fourni une preuve de l'expédition de ces biens, la date retenue étant celle du premier de ces\nfaits.\nLe professionnel effectue ce remboursement en utilisant le même moyen de paiement que celui utilisé par\nle consommateur pour la transaction initiale, sauf accord exprès du consommateur pour qu'il utilise un autre\nmoyen de paiement et dans la mesure où le remboursement n'occasionne pas de frais pour le consommateur.\nLe professionnel n'est pas tenu de rembourser les frais supplémentaires si le consommateur a expressément\nchoisi un mode de livraison plus coûteux que le mode de livraison standard proposé par le professionnel."", ""Article L221-18\nLe consommateur dispose d'un délai de quatorze jours pour exercer son droit de rétractation d'un contrat\nconclu à distance, à la suite d'un démarchage téléphonique ou hors établissement, sans avoir à motiver sa\ndécision ni à supporter d'autres coûts que ceux prévus aux articles L. 221-23 à L. 221-25.\nLe délai mentionné au premier alinéa court à compter du jour :\n1° De la conclusion du contrat, pour les contrats de prestation de services et ceux mentionnés à l'article L.\n221-4 ;\n2° De la réception du bien par le consommateur ou un tiers, autre que le transporteur, désigné par lui, pour\nles contrats de vente de biens. Pour les contrats conclus hors établissement, le consommateur peut exercer\nson droit de rétractation à compter de la conclusion du contrat.\nDans le cas d'une commande portant sur plusieurs biens livrés séparément ou dans le cas d'une commande\nd'un bien composé de lots ou de pièces multiples dont la livraison est échelonnée sur une période définie, le\ndélai court à compter de la réception du dernier bien ou lot ou de la dernière pièce.\nPour les contrats prévoyant la livraison régulière de biens pendant une période définie, le délai court à\ncompter de la réception du premier bien.""]","Selon l'article L221-28 du Code de la consommation, voici trois types de contrats pour lesquels le droit de rétractation ne peut être exercé :
1. Les contrats de fourniture de biens confectionnés selon les spécifications du consommateur ou nettement personnalisés (article L221-28, 3°).
2. Les contrats de fourniture de biens susceptibles de se détériorer ou de se périmer rapidement (article L221-28, 4°).
3. Les contrats de fourniture de biens qui ont été descellés par le consommateur après la livraison et qui ne peuvent être renvoyés pour des raisons d'hygiène ou de protection de la santé (article L221-28, 5°).","Les biens confectionnés selon les spécifications du consommateur (personnalisés), les biens susceptibles de se détériorer rapidement, et les biens descellés par le consommateur ne pouvant être renvoyés pour des raisons d'hygiène.",0.75,,0.699999999965,1.0
Puis-je me rétracter après avoir acheté un bien personnalisé ou un logiciel que j'ai déjà descellé ?,"[""Article L221-28\nLe droit de rétractation ne peut être exercé pour les contrats :\n1° De fourniture de services pleinement exécutés avant la fin du délai de rétractation et, si le contrat soumet\nle consommateur à une obligation de payer, dont l'exécution a commencé avec son accord préalable et\nexprès et avec la reconnaissance par lui de la perte de son droit de rétractation, lorsque la prestation aura été\npleinement exécutée par le professionnel ;\n2° De fourniture de biens ou de services dont le prix dépend de fluctuations sur le marché financier\néchappant au contrôle du professionnel et susceptibles de se produire pendant le délai de rétractation ;\n3° De fourniture de biens confectionnés selon les spécifications du consommateur ou nettement\npersonnalisés ;\n4° De fourniture de biens susceptibles de se détériorer ou de se périmer rapidement ;\n5° De fourniture de biens qui ont été descellés par le consommateur après la livraison et qui ne peuvent être\nrenvoyés pour des raisons d'hygiène ou de protection de la santé ;\n6° De fourniture de biens qui, après avoir été livrés et de par leur nature, sont mélangés de manière\nindissociable avec d'autres articles ;\n7° De fourniture de boissons alcoolisées dont la livraison est différée au-delà de trente jours et dont la\nvaleur convenue à la conclusion du contrat dépend de fluctuations sur le marché échappant au contrôle du\nprofessionnel ;\n8° De travaux d'entretien ou de réparation à réaliser en urgence au domicile du consommateur et\nexpressément sollicités par lui, dans la limite des pièces de rechange et travaux strictement nécessaires pour\nrépondre à l'urgence ;\n9° De fourniture d'enregistrements audio ou vidéo ou de logiciels informatiques lorsqu'ils ont été descellés\npar le consommateur après la livraison ;\n10° De fourniture d'un journal, d'un périodique ou d'un magazine, sauf pour les contrats d'abonnement à ces\npublications ;\n11° Conclus lors d'une enchère publique ;\n\n12° De prestations de services d'hébergement, autres que d'hébergement résidentiel, de services de transport\nde biens, de locations de voitures, de restauration ou d'activités de loisirs qui doivent être fournis à une date\nou à une période déterminée ;\n13° De fourniture d'un contenu numérique sans support matériel dont l'exécution a commencé avant la fin du\ndélai de rétractation et, si le contrat soumet le consommateur à une obligation de payer, lorsque :\na) Il a donné préalablement son consentement exprès pour que l'exécution du contrat commence avant\nl'expiration du délai de rétractation ; et\nb) Il a reconnu qu'il perdra son droit de rétractation ; et\nc) Le professionnel a fourni une confirmation de l'accord du consommateur conformément aux dispositions\ndu deuxième l'alinéa de l'article L. 221-13.\nSection 7 : Dispositions d'ordre public"", ""Article L221-5\nI.-Préalablement à la conclusion d'un contrat de vente de biens ou de fourniture de services, de contenu\nnumérique ou de services numériques, le professionnel fournit au consommateur, de manière lisible et\ncompréhensible, les informations suivantes :\n1° Les caractéristiques essentielles du bien, du service, du service numérique ou du contenu numérique ;\n2° Le prix du bien, du service, du service numérique ou du contenu numérique, en application des articles L.\n112-1 à L. 112-4 ;\n3° La date à laquelle ou le délai dans lequel le professionnel s'engage à livrer le bien ou à fournir le service,\nle service numérique ou le contenu numérique ;\n4° Les informations relatives à son identité, à ses coordonnées postales, téléphoniques et électroniques, aux\nmodalités de résiliation, aux modes de règlement des litiges, aux autres conditions contractuelles et, le cas\néchéant, aux coûts de l'utilisation de la technique de communication à distance, à l'existence de codes de\nbonne conduite et aux cautions et garanties financières ;\n5° S'il y a lieu, les informations relatives aux garanties légales, aux fonctionnalités, à la compatibilité\net à l'interopérabilité du contenu numérique, du service numérique ou du bien comportant des éléments\nnumériques, aux autres conditions contractuelles et, le cas échéant, à l'existence de toute restriction\nd'installation de logiciel ;\n\n6° La possibilité de recourir à un médiateur de la consommation dans les conditions prévues au titre Ier du\nlivre VI ;\n7° Lorsque le droit de rétractation existe, les conditions, le délai et les modalités d'exercice de ce droit ainsi\nque le formulaire type de rétractation, dont les conditions de présentation et les mentions qu'il contient sont\nfixées par décret en Conseil d'Etat ;\n8° Le cas échéant, le fait que le consommateur supporte les frais de renvoi du bien en cas de rétractation\net, pour les contrats à distance, le coût de renvoi du bien lorsque celui-ci, en raison de sa nature, ne peut\nnormalement être renvoyé par la poste ;\n9° L'information sur l'obligation du consommateur de payer des frais lorsqu'il exerce son droit de rétractation\nd'un contrat de prestation de services, de distribution d'eau, de fourniture de gaz ou d'électricité et\nd'abonnement à un réseau de chauffage urbain dont il a demandé expressément l'exécution avant la fin du\ndélai de rétractation ; ces frais sont calculés selon les modalités fixées à l'article L. 221-25 ;\n10° Lorsque le droit de rétractation ne peut être exercé en application de l'article L. 221-28, l'information\nselon laquelle le consommateur ne bénéficie pas de ce droit ou, le cas échéant, les circonstances dans\nlesquelles il le perd ;\n11° L'application d'un prix personnalisé sur la base d'une prise de décision automatisée, s'il y a lieu.\nLa liste et le contenu de ces informations sont précisés par décret en Conseil d'Etat.\nDans le cas d'une vente aux enchères publiques telle que définie par le premier alinéa de l'article L. 321-3\ndu code de commerce, les informations relatives à l'identité et aux coordonnées postales, téléphoniques et\nélectroniques du professionnel prévues au 4° du I du présent article peuvent être remplacées par celles du\nmandataire.\nII.-Outre les informations prévues au I, tout professionnel, avant la conclusion d'un contrat de fourniture\nde services et, lorsqu'il n'y a pas de contrat, avant l'exécution de la prestation de services, fournit les\ninformations complémentaires prévues par l'article L. 111-2."", ""Article L222-15\nLe fournisseur rembourse au consommateur dans les meilleurs délais et au plus tard dans les trente jours\ntoutes les sommes qu'il a perçues de celui-ci en application du contrat, à l'exception du montant mentionné\nau premier alinéa de l'article L. 222-13. Ce délai commence à courir le jour où le fournisseur reçoit\nnotification par le consommateur de sa volonté de se rétracter.\nLe consommateur restitue au fournisseur dans les meilleurs délais et au plus tard dans les trente jours\ntoute somme et tout bien qu'il a reçus de ce dernier. Ce délai commence à courir à compter du jour où le\nconsommateur communique au fournisseur sa volonté de se rétracter.\nSection 5 : Dispositions particulières"", ""Article L222-7\nLe consommateur dispose d'un délai de quatorze jours calendaires révolus pour exercer son droit de\nrétractation, sans avoir à justifier de motif ni à supporter de pénalités.\nLe délai pendant lequel peut s'exercer le droit de rétractation court à compter du jour où :\n1° Le contrat à distance est conclu ;\n2° Le consommateur reçoit les conditions contractuelles et les informations, conformément à l'article L.\n222-6, si cette dernière date est postérieure à celle mentionnée au 1°."", ""Article L221-24\nLorsque le droit de rétractation est exercé, le professionnel rembourse le consommateur de la totalité des\nsommes versées, y compris les frais de livraison, sans retard injustifié et au plus tard dans les quatorze jours\nà compter de la date à laquelle il est informé de la décision du consommateur de se rétracter.\nPour les contrats de vente de biens, à moins qu'il ne propose de récupérer lui-même les biens, le\nprofessionnel peut différer le remboursement jusqu'à récupération des biens ou jusqu'à ce que le\nconsommateur ait fourni une preuve de l'expédition de ces biens, la date retenue étant celle du premier de ces\nfaits.\nLe professionnel effectue ce remboursement en utilisant le même moyen de paiement que celui utilisé par\nle consommateur pour la transaction initiale, sauf accord exprès du consommateur pour qu'il utilise un autre\nmoyen de paiement et dans la mesure où le remboursement n'occasionne pas de frais pour le consommateur.\nLe professionnel n'est pas tenu de rembourser les frais supplémentaires si le consommateur a expressément\nchoisi un mode de livraison plus coûteux que le mode de livraison standard proposé par le professionnel.""]","Selon l'article L221-28, le droit de rétractation ne peut pas être exercé pour la fourniture de biens confectionnés selon les spécifications du consommateur ou nettement personnalisés (point 3) ni pour la fourniture d'enregistrements audio ou vidéo ou de logiciels informatiques lorsqu'ils ont été descellés par le consommateur après la livraison (point 9).

Par conséquent, si vous avez acheté un bien personnalisé ou un logiciel que vous avez déjà descellé, vous ne pourrez pas exercer votre droit de rétractation conformément à la loi française.","Non, le droit de rétractation est exclu pour les biens nettement personnalisés et pour les logiciels descellés après livraison.",1.0,,0.99999999998,1.0
"J'ai commandé une bague gravée à mes initiales sur un site web. Elle ne me plaît pas. Le site refuse le retour en disant que c'est du ""sur-mesure"". Ont-ils raison légalement ?","[""Article L217-6\nLorsqu'à l'occasion du contrat, un traitement de données à caractère personnel est opéré par le professionnel,\nun manquement de sa part aux obligations lui incombant au titre du règlement (UE) 2016/679 du 27 avril\n2016 et de la loi n° 78-17 du 6 janvier 1978 relative à l'informatique, aux fichiers et aux libertés, dès lors\nque ce manquement entraîne le non-respect d'un ou de plusieurs critères de conformité énoncés à la présente\nsection, est assimilé à un défaut de conformité, sans préjudice des autres recours prévus par ces textes."", ""Article L221-26-1\nI.-Le professionnel s'abstient d'utiliser tout contenu, autre que les données à caractère personnel pour\nlesquelles il respecte les obligations résultant du règlement (UE) 2016/679 du Parlement européen et du\nConseil du 27 avril 2016, qui a été fourni ou créé par le consommateur lors de l'utilisation du contenu\nnumérique ou du service numérique fourni par le professionnel, sauf lorsque ce contenu :\n1° N'est d'aucune utilité pour le consommateur dès lors qu'il ne l'utilise plus ;\n2° N'a trait qu'à l'activité du consommateur lorsqu'il utilise le contenu numérique ou le service numérique\nfourni par le professionnel ;\n3° A été agrégé avec d'autres données par le professionnel et ne peut être désagrégé ou ne peut l'être que\nmoyennant des efforts disproportionnés ;\n4° A été généré conjointement par le consommateur et d'autres personnes, et d'autres consommateurs\npeuvent continuer à en faire usage.\nII.-Sauf dans les situations visées aux 1° à 3° du II, le professionnel met à la disposition du consommateur,\nà la demande de ce dernier, tout contenu, autre que les données à caractère personnel, qui a été fourni ou\ncréé par le consommateur lors de l'utilisation du contenu numérique ou du service numérique fourni par le\nprofessionnel.\n\nIII.-Le consommateur a le droit de récupérer ce contenu numérique sans frais, sans que le professionnel y\nfasse obstacle, dans un délai raisonnable et dans un format couramment utilisé et compatible avec une lecture\npar machine.\nIV.-En cas de rétractation du contrat, le professionnel peut empêcher toute utilisation ultérieure du contenu\nnumérique ou du service numérique par le consommateur, notamment en faisant en sorte que le contenu\nnumérique ou le service numérique soit inaccessible au consommateur ou en désactivant le compte\nd'utilisateur du consommateur, sans préjudice du II.\nV.-Lorsque le consommateur a exercé son droit de rétractation, il s'abstient d'utiliser le contenu numérique et\nde le rendre accessible à des tiers."", ""Article L221-14\nPour les contrats conclus par voie électronique, le professionnel rappelle au consommateur, avant qu'il ne\npasse sa commande, de manière lisible et compréhensible, les informations relatives aux caractéristiques\nessentielles des biens ou des services qui font l'objet de la commande, à leur prix, à la durée du contrat et, s'il\ny a lieu, à la durée minimale des obligations de ce dernier au titre du contrat, telles que prévues à l'article L.\n221-5.\nLe professionnel veille à ce que le consommateur, lors de sa commande, reconnaisse explicitement son\nobligation de paiement. A cette fin, la fonction utilisée par le consommateur pour valider sa commande\n\ncomporte la mention claire et lisible : commande avec obligation de paiement ou une formule analogue,\ndénuée de toute ambiguïté, indiquant que la passation d'une commande oblige à son paiement.\nLes sites de commerce en ligne indiquent clairement et lisiblement, au plus tard au début du processus de\ncommande, les moyens de paiement acceptés par le professionnel et les éventuelles restrictions de livraison."", 'Article L217-17\nLe remboursement au consommateur des sommes dues par le vendeur au titre de la présente sous-section\nest effectué dès réception du bien ou de la preuve de son renvoi par le consommateur et au plus tard dans les\nquatorze jours suivants.\nLe vendeur rembourse ces sommes en recourant au même moyen de paiement que celui utilisé par le\nconsommateur lors de la conclusion du contrat, sauf accord exprès de ce dernier et en tout état de cause sans\nfrais supplémentaire.\nSous-section 3 : Mises à jour', ""Article L217-11\n\nLa mise en conformité du bien a lieu sans aucun frais pour le consommateur.\nLe consommateur n'est pas tenu de payer pour l'utilisation normale qu'il a faite du bien remplacé pendant la\npériode antérieure à son remplacement.""]","Selon l'article L221-14 du Code de la consommation, pour les contrats conclus par voie électronique, le professionnel doit rappeler au consommateur, avant qu'il ne passe sa commande, les informations relatives aux caractéristiques essentielles des biens ou des services faisant l'objet de la commande. De plus, le professionnel doit veiller à ce que le consommateur reconnaisse explicitement son obligation de paiement.

Cependant, concernant le retour de produits personnalisés ou sur-mesure, l'article L221-26-1 ne prévoit pas explicitement de disposition spécifique. Dans ce cas, il est recommandé de se référer aux conditions générales de vente du site web pour connaître les modalités de retour et d'échange des produits personnalisés.

En conclusion, si le site web a clairement informé le consommateur que les produits personnalisés ne peuvent pas être retournés, il est possible que le refus de retour de la bague gravée soit légal. Il est conseillé de vérifier les conditions générales de vente du site pour plus de précisions sur ce sujet.","Oui, le site a raison car le droit de rétractation ne s'applique pas aux biens confectionnés selon les spécifications du consommateur ou nettement personnalisés.",0.5,,0.5833333333041666,1.0
"À défaut d'indication de date, quel est le délai maximal de livraison prévu par l'article L. 216-1 après la conclusion du contrat ?","[""Article L216-1\nLe professionnel délivre le bien ou fournit le service à la date ou dans le délai indiqué au consommateur,\nconformément au 3° de l'article L. 111-1, sauf si les parties en conviennent autrement.\nPour l'application du présent titre, on entend par délivrance d'un bien, le transfert au consommateur de la\npossession physique ou du contrôle du bien. Dans le cas d'un bien comportant des éléments numériques, la\ndélivrance inclut également la fourniture de ces éléments au sens de l'article L. 224-25-4.\nA défaut d'indication ou d'accord quant à la date de délivrance ou de fourniture, le professionnel délivre le\nbien ou fournit le service sans retard injustifié et au plus tard trente jours après la conclusion du contrat.\nLe présent chapitre s'applique également à la fourniture d'un contenu numérique sur un support matériel\nservant exclusivement à son transport."", ""Article L216-7\nLorsque le contrat est résolu dans les conditions prévues à l'article L. 216-6, le professionnel rembourse\nle consommateur de la totalité des sommes versées, au plus tard dans les quatorze jours suivant la date à\nlaquelle le contrat a été dénoncé."", ""Article L216-6\nI.-En cas de manquement du professionnel à son obligation de délivrance du bien ou de fourniture du service\ndans les conditions prévues à l'article L. 216-1, le consommateur peut :\n1° Notifier au professionnel la suspension du paiement de tout ou partie du prix jusqu'à ce que le\nprofessionnel s'exécute, dans les conditions des articles 1219 et 1220 du code civil ;\n2° Résoudre le contrat si, après avoir mis en demeure le professionnel d'effectuer la délivrance ou de fournir\nle service dans un délai supplémentaire raisonnable, ce dernier ne s'est pas exécuté dans ce délai.\nLe contrat est considéré comme résolu à la réception par le professionnel de la lettre ou de l'écrit l'informant\nde cette résolution, à moins que le professionnel ne se soit exécuté entre-temps.\nII.-Le consommateur peut toutefois immédiatement résoudre le contrat :\n1° Lorsque le professionnel refuse de délivrer le bien ou de fournir le service ou lorsqu'il est manifeste qu'il\nne livrera pas le bien ou ne fournira pas le service ;\n2° Lorsque le professionnel n'exécute pas son obligation de délivrance du bien ou de fourniture du service\nà la date ou à l'expiration du délai prévu à l'article L. 216-1 et que cette date ou ce délai constitue pour le\nconsommateur une condition essentielle du contrat. Cette condition essentielle résulte des circonstances\nqui entourent la conclusion du contrat ou d'une demande expresse du consommateur avant la conclusion du\ncontrat.\nLes dispositions du présent article sont sans préjudice de l'allocation de dommages et intérêts."", ""Article L217-3\nLe vendeur délivre un bien conforme au contrat ainsi qu'aux critères énoncés à l'article L. 217-5.\nIl répond des défauts de conformité existant au moment de la délivrance du bien au sens de l'article L. 216-1,\nqui apparaissent dans un délai de deux ans à compter de celle-ci.\nDans le cas d'un contrat de vente d'un bien comportant des éléments numériques :\n1° Lorsque le contrat prévoit la fourniture continue d'un contenu numérique ou d'un service numérique\npendant une durée inférieure ou égale à deux ans, ou lorsque le contrat ne détermine pas la durée de\nfourniture, le vendeur répond des défauts de conformité de ce contenu numérique ou de ce service numérique\nqui apparaissent dans un délai de deux ans à compter de la délivrance du bien ;\n2° Lorsque le contrat prévoit la fourniture continue d'un contenu numérique ou d'un service numérique\npendant une durée supérieure à deux ans, le vendeur répond des défauts de conformité de ce contenu\nnumérique ou de ce service numérique qui apparaissent au cours de la période durant laquelle celui-ci est\nfourni en vertu du contrat.\nPour de tels biens, le délai applicable ne prive pas le consommateur de son droit aux mises à jour\nconformément aux dispositions de l'article L. 217-19.\nLe vendeur répond également, durant les mêmes délais, des défauts de conformité résultant de l'emballage,\ndes instructions de montage, ou de l'installation lorsque celle-ci a été mise à sa charge par le contrat ou a\nété réalisée sous sa responsabilité, ou encore lorsque l'installation incorrecte, effectuée par le consommateur\ncomme prévu au contrat, est due à des lacunes ou erreurs dans les instructions d'installation fournies par le\nvendeur.\nCe délai de garantie s'applique sans préjudice des articles 2224 et suivants du code civil. Le point de départ\nde la prescription de l'action du consommateur est le jour de la connaissance par ce dernier du défaut de\nconformité."", ""Article L221-18\nLe consommateur dispose d'un délai de quatorze jours pour exercer son droit de rétractation d'un contrat\nconclu à distance, à la suite d'un démarchage téléphonique ou hors établissement, sans avoir à motiver sa\ndécision ni à supporter d'autres coûts que ceux prévus aux articles L. 221-23 à L. 221-25.\nLe délai mentionné au premier alinéa court à compter du jour :\n1° De la conclusion du contrat, pour les contrats de prestation de services et ceux mentionnés à l'article L.\n221-4 ;\n2° De la réception du bien par le consommateur ou un tiers, autre que le transporteur, désigné par lui, pour\nles contrats de vente de biens. Pour les contrats conclus hors établissement, le consommateur peut exercer\nson droit de rétractation à compter de la conclusion du contrat.\nDans le cas d'une commande portant sur plusieurs biens livrés séparément ou dans le cas d'une commande\nd'un bien composé de lots ou de pièces multiples dont la livraison est échelonnée sur une période définie, le\ndélai court à compter de la réception du dernier bien ou lot ou de la dernière pièce.\nPour les contrats prévoyant la livraison régulière de biens pendant une période définie, le délai court à\ncompter de la réception du premier bien.""]","Selon l'article L216-1, à défaut d'indication de date de livraison ou d'accord entre les parties, le professionnel doit délivrer le bien sans retard injustifié et au plus tard trente jours après la conclusion du contrat.","À défaut d'indication, le professionnel doit livrer le bien sans retard injustifié et au plus tard trente jours après la conclusion du contrat.",1.0,,0.8333333332916666,1.0
"Si aucune date n'est précisée lors de ma commande, combien de temps le vendeur a-t-il maximum pour me livrer ?","[""Article L222-15\nLe fournisseur rembourse au consommateur dans les meilleurs délais et au plus tard dans les trente jours\ntoutes les sommes qu'il a perçues de celui-ci en application du contrat, à l'exception du montant mentionné\nau premier alinéa de l'article L. 222-13. Ce délai commence à courir le jour où le fournisseur reçoit\nnotification par le consommateur de sa volonté de se rétracter.\nLe consommateur restitue au fournisseur dans les meilleurs délais et au plus tard dans les trente jours\ntoute somme et tout bien qu'il a reçus de ce dernier. Ce délai commence à courir à compter du jour où le\nconsommateur communique au fournisseur sa volonté de se rétracter.\nSection 5 : Dispositions particulières"", ""Article L221-18\nLe consommateur dispose d'un délai de quatorze jours pour exercer son droit de rétractation d'un contrat\nconclu à distance, à la suite d'un démarchage téléphonique ou hors établissement, sans avoir à motiver sa\ndécision ni à supporter d'autres coûts que ceux prévus aux articles L. 221-23 à L. 221-25.\nLe délai mentionné au premier alinéa court à compter du jour :\n1° De la conclusion du contrat, pour les contrats de prestation de services et ceux mentionnés à l'article L.\n221-4 ;\n2° De la réception du bien par le consommateur ou un tiers, autre que le transporteur, désigné par lui, pour\nles contrats de vente de biens. Pour les contrats conclus hors établissement, le consommateur peut exercer\nson droit de rétractation à compter de la conclusion du contrat.\nDans le cas d'une commande portant sur plusieurs biens livrés séparément ou dans le cas d'une commande\nd'un bien composé de lots ou de pièces multiples dont la livraison est échelonnée sur une période définie, le\ndélai court à compter de la réception du dernier bien ou lot ou de la dernière pièce.\nPour les contrats prévoyant la livraison régulière de biens pendant une période définie, le délai court à\ncompter de la réception du premier bien."", ""Article L217-3\nLe vendeur délivre un bien conforme au contrat ainsi qu'aux critères énoncés à l'article L. 217-5.\nIl répond des défauts de conformité existant au moment de la délivrance du bien au sens de l'article L. 216-1,\nqui apparaissent dans un délai de deux ans à compter de celle-ci.\nDans le cas d'un contrat de vente d'un bien comportant des éléments numériques :\n1° Lorsque le contrat prévoit la fourniture continue d'un contenu numérique ou d'un service numérique\npendant une durée inférieure ou égale à deux ans, ou lorsque le contrat ne détermine pas la durée de\nfourniture, le vendeur répond des défauts de conformité de ce contenu numérique ou de ce service numérique\nqui apparaissent dans un délai de deux ans à compter de la délivrance du bien ;\n2° Lorsque le contrat prévoit la fourniture continue d'un contenu numérique ou d'un service numérique\npendant une durée supérieure à deux ans, le vendeur répond des défauts de conformité de ce contenu\nnumérique ou de ce service numérique qui apparaissent au cours de la période durant laquelle celui-ci est\nfourni en vertu du contrat.\nPour de tels biens, le délai applicable ne prive pas le consommateur de son droit aux mises à jour\nconformément aux dispositions de l'article L. 217-19.\nLe vendeur répond également, durant les mêmes délais, des défauts de conformité résultant de l'emballage,\ndes instructions de montage, ou de l'installation lorsque celle-ci a été mise à sa charge par le contrat ou a\nété réalisée sous sa responsabilité, ou encore lorsque l'installation incorrecte, effectuée par le consommateur\ncomme prévu au contrat, est due à des lacunes ou erreurs dans les instructions d'installation fournies par le\nvendeur.\nCe délai de garantie s'applique sans préjudice des articles 2224 et suivants du code civil. Le point de départ\nde la prescription de l'action du consommateur est le jour de la connaissance par ce dernier du défaut de\nconformité."", ""Article L217-13\nTout bien réparé dans le cadre de la garantie légale de conformité bénéficie d'une extension de cette garantie\nde six mois.\nDès lors que le consommateur fait le choix de la réparation mais que celle-ci n'est pas mise en œuvre par\nle vendeur, la mise en conformité par le remplacement du bien fait courir, au bénéfice du consommateur,\nun nouveau délai de garantie légale de conformité attaché au bien remplacé. Cette disposition s'applique à\ncompter du jour où le bien de remplacement est délivré au consommateur."", 'Article L217-17\nLe remboursement au consommateur des sommes dues par le vendeur au titre de la présente sous-section\nest effectué dès réception du bien ou de la preuve de son renvoi par le consommateur et au plus tard dans les\nquatorze jours suivants.\nLe vendeur rembourse ces sommes en recourant au même moyen de paiement que celui utilisé par le\nconsommateur lors de la conclusion du contrat, sauf accord exprès de ce dernier et en tout état de cause sans\nfrais supplémentaire.\nSous-section 3 : Mises à jour']","Selon l'article L221-18 du Code de la consommation, si aucune date n'est précisée lors de la commande, le vendeur a l'obligation de livrer le bien dans un délai maximum de 30 jours à compter de la conclusion du contrat. Au-delà de ce délai, le consommateur est en droit d'exiger le remboursement de la somme versée.",Le vendeur a un délai maximum de 30 jours pour livrer le bien.,0.0,,0.9999999999,1.0
J'ai commandé un canapé il y a 40 jours. Aucune date de livraison n'était indiquée. Je n'ai toujours rien reçu. Puis-je exiger la livraison ou annuler ma commande ?,"[""Article L222-15\nLe fournisseur rembourse au consommateur dans les meilleurs délais et au plus tard dans les trente jours\ntoutes les sommes qu'il a perçues de celui-ci en application du contrat, à l'exception du montant mentionné\nau premier alinéa de l'article L. 222-13. Ce délai commence à courir le jour où le fournisseur reçoit\nnotification par le consommateur de sa volonté de se rétracter.\nLe consommateur restitue au fournisseur dans les meilleurs délais et au plus tard dans les trente jours\ntoute somme et tout bien qu'il a reçus de ce dernier. Ce délai commence à courir à compter du jour où le\nconsommateur communique au fournisseur sa volonté de se rétracter.\nSection 5 : Dispositions particulières"", ""Article L216-5\nLe professionnel indique par écrit au consommateur lors de son achat, s'il y a lieu, le coût de la livraison\net de mise en service du bien. Un écrit est laissé au consommateur lors de l'entrée en possession du bien,\nmentionnant la possibilité pour le consommateur de formuler des réserves, notamment en cas de défaut du\nbien ou de défaut de remise de la notice d'emploi ou des instructions d'installation.\nL'absence de réserves formulées par le consommateur lors de la réception du bien n'exonère pas le\nprofessionnel de la garantie de conformité du bien qu'il doit au consommateur."", ""Article L222-7\nLe consommateur dispose d'un délai de quatorze jours calendaires révolus pour exercer son droit de\nrétractation, sans avoir à justifier de motif ni à supporter de pénalités.\nLe délai pendant lequel peut s'exercer le droit de rétractation court à compter du jour où :\n1° Le contrat à distance est conclu ;\n2° Le consommateur reçoit les conditions contractuelles et les informations, conformément à l'article L.\n222-6, si cette dernière date est postérieure à celle mentionnée au 1°."", ""Article L217-10\nLa mise en conformité du bien a lieu dans un délai raisonnable qui ne peut être supérieur à trente jours\nsuivant la demande du consommateur et sans inconvénient majeur pour lui, compte tenu de la nature du bien\net de l'usage recherché par le consommateur.\nLa réparation ou le remplacement du bien non conforme inclut, s'il y a lieu, l'enlèvement et la reprise de ce\nbien et l'installation du bien réparé ou du bien de remplacement par le vendeur.\nUn décret précise les modalités de la mise en conformité du bien."", ""Article L222-8\nLe délai mentionné à l'article L. 222-7 court à compter du jour où :\n1° Le contrat à distance est conclu ;\n2° Le consommateur reçoit les conditions contractuelles et les informations conformément à l'article L.\n222-6, si cette dernière date est postérieure à celle mentionnée au 1° du présent article.""]","Selon l'article L217-10 du Code de la consommation, la mise en conformité du bien doit avoir lieu dans un délai raisonnable qui ne peut être supérieur à trente jours suivant la demande du consommateur. Dans votre cas, étant donné que vous avez commandé un canapé il y a 40 jours et que vous n'avez toujours rien reçu sans qu'aucune date de livraison ne vous ait été indiquée, le vendeur est en retard. Vous pouvez donc exiger la livraison dans un délai raisonnable.

Si le vendeur ne peut pas vous livrer dans un délai raisonnable, vous avez le droit d'annuler votre commande. Conformément à l'article L222-15, le fournisseur doit vous rembourser dans les trente jours suivant votre demande d'annulation. Vous pouvez donc exiger la livraison de votre canapé dans un délai raisonnable ou demander le remboursement de votre commande.","Oui, le délai légal de 30 jours étant dépassé, vous pouvez mettre le vendeur en demeure de livrer, et à défaut d'exécution, résoudre (annuler) le contrat.",0.6666666666666666,,0.99999999998,1.0
Quelles sont les obligations d'information du professionnel avant la reconduction tacite d'un contrat selon l'article L. 215-1 ?,"[""Article L215-1\nPour les contrats de prestations de services conclus pour une durée déterminée avec une clause de\nreconduction tacite, le professionnel prestataire de services informe le consommateur par écrit, par lettre\nnominative ou courrier électronique dédiés, au plus tôt trois mois et au plus tard un mois avant le terme\nde la période autorisant le rejet de la reconduction, de la possibilité de ne pas reconduire le contrat qu'il\na conclu avec une clause de reconduction tacite. Cette information, délivrée dans des termes clairs et\ncompréhensibles, mentionne, dans un encadré apparent, la date limite de non-reconduction.\nLorsque cette information ne lui a pas été adressée conformément aux dispositions du premier alinéa,\nle consommateur peut mettre gratuitement un terme au contrat, à tout moment à compter de la date de\nreconduction.\n\nLes avances effectuées après la dernière date de reconduction ou, s'agissant des contrats à durée\nindéterminée, après la date de transformation du contrat initial à durée déterminée, sont dans ce cas\nremboursées dans un délai de trente jours à compter de la date de résiliation, déduction faite des sommes\ncorrespondant, jusqu'à celle-ci, à l'exécution du contrat.\nLes dispositions du présent article s'appliquent sans préjudice de celles qui soumettent légalement certains\ncontrats à des règles particulières en ce qui concerne l'information du consommateur.\nPar exception au premier alinéa du présent article, pour les contrats de fourniture de service de télévision au\nsens de l'article 2 de la loi n° 86-1067 du 30 septembre 1986 relative à la liberté de communication et pour\nles contrats de fourniture de services de médias audiovisuels à la demande, le consommateur peut mettre\ngratuitement un terme au contrat, à tout moment à compter de la première reconduction, dès lors qu'il change\nde domicile ou que son foyer fiscal évolue."", ""Article L215-1-1\nLorsqu'un contrat a été conclu par voie électronique ou a été conclu par un autre moyen et que le\nprofessionnel, au jour de la résiliation par le consommateur, offre au consommateur la possibilité de conclure\ndes contrats par voie électronique, la résiliation est rendue possible selon cette modalité.\nA cet effet, le professionnel met à la disposition du consommateur une fonctionnalité gratuite permettant\nd'accomplir, par voie électronique, la notification et les démarches nécessaires à la résiliation du contrat.\nLorsque le consommateur notifie la résiliation du contrat, le professionnel lui confirme la réception de\nla notification et l'informe, sur un support durable et dans des délais raisonnables, de la date à laquelle le\ncontrat prend fin et des effets de la résiliation.\nUn décret fixe notamment les modalités techniques de nature à garantir une identification du consommateur\net un accès facile, direct et permanent à la fonctionnalité mentionnée au deuxième alinéa, telles que\nses modalités de présentation et d'utilisation. Il détermine les informations devant être fournies par le\nconsommateur."", ""Article L221-12\nLorsque la technique de communication à distance utilisée impose des limites d'espace ou de temps pour la\nprésentation des informations, le professionnel fournit au consommateur par le moyen de communication\nutilisé par celui-ci, avant la conclusion du contrat et dans les conditions prévues à l'article L. 221-5, au\nmoins les informations relatives aux caractéristiques essentielles des biens ou des services, à leur prix, à son\nidentité, à la durée du contrat et au droit de rétractation.\nLe professionnel transmet au consommateur les autres informations prévues au même article par tout autre\nmoyen adapté à la technique de communication à distance utilisée."", ""Article L221-11\nLorsque le contrat est conclu à distance, le professionnel fournit au consommateur, de manière lisible et\ncompréhensible, les informations prévues à l'article L. 221-5 ou les met à sa disposition par tout moyen\nadapté à la technique de communication à distance utilisée."", 'Article L211-3\nLors de la conclusion de tout contrat écrit, le consommateur est informé par le professionnel de la possibilité\nde recourir, en cas de contestation, à la procédure de médiation de la consommation dans les conditions\nprévues au titre Ier du livre VI.']","Selon l'article L215-1 du Code de la consommation, pour les contrats de prestations de services conclus pour une durée déterminée avec une clause de reconduction tacite, le professionnel prestataire de services doit informer le consommateur par écrit, par lettre nominative ou courrier électronique dédiés, au plus tôt trois mois et au plus tard un mois avant le terme de la période autorisant le rejet de la reconduction. Cette information doit être délivrée dans des termes clairs et compréhensibles, mentionner de manière apparente la date limite de non-reconduction, et permettre au consommateur de ne pas reconduire le contrat. Si cette information n'est pas transmise correctement, le consommateur a le droit de résilier le contrat à tout moment à compter de la date de reconduction.","Le professionnel doit informer le consommateur par écrit, entre 3 mois et 1 mois avant la date limite de résiliation, de la possibilité de ne pas reconduire le contrat.",1.0,,0.99999999995,1.0
Mon abonnement s'est renouvelé automatiquement sans que je sois prévenu. Puis-je le résilier gratuitement ?,"[""Article L215-1-1\nLorsqu'un contrat a été conclu par voie électronique ou a été conclu par un autre moyen et que le\nprofessionnel, au jour de la résiliation par le consommateur, offre au consommateur la possibilité de conclure\ndes contrats par voie électronique, la résiliation est rendue possible selon cette modalité.\nA cet effet, le professionnel met à la disposition du consommateur une fonctionnalité gratuite permettant\nd'accomplir, par voie électronique, la notification et les démarches nécessaires à la résiliation du contrat.\nLorsque le consommateur notifie la résiliation du contrat, le professionnel lui confirme la réception de\nla notification et l'informe, sur un support durable et dans des délais raisonnables, de la date à laquelle le\ncontrat prend fin et des effets de la résiliation.\nUn décret fixe notamment les modalités techniques de nature à garantir une identification du consommateur\net un accès facile, direct et permanent à la fonctionnalité mentionnée au deuxième alinéa, telles que\nses modalités de présentation et d'utilisation. Il détermine les informations devant être fournies par le\nconsommateur."", ""Article L221-10\nLe professionnel ne peut recevoir aucun paiement ou aucune contrepartie, sous quelque forme que ce soit, de\nla part du consommateur avant l'expiration d'un délai de sept jours à compter de la conclusion du contrat hors\nétablissement.\nToutefois, ne sont pas soumis aux dispositions du premier alinéa :\n1° La souscription à domicile d'un abonnement à une publication quotidienne et assimilée, au sens de l'article\n39 bis du code général des impôts ;\n2° Les contrats à exécution successive, conclus dans les conditions prévues au présent chapitre et proposés\npar un organisme agréé ou relevant d'une décision de l'autorité administrative, ayant pour objet la fourniture\nde services mentionnés à l'article L. 7231-1 du code du travail ;\n3° Les contrats conclus au cours de réunions organisées par le vendeur à son domicile ou au domicile d'un\nconsommateur ayant préalablement et expressément accepté que cette opération se déroule à son domicile ;\n4° Les contrats ayant pour objet des travaux d'entretien ou de réparation à réaliser en urgence au domicile du\nconsommateur et expressément sollicités par lui, dans la limite des pièces de rechange et travaux strictement\nnécessaires pour répondre à l'urgence.\nPour les contrats mentionnés aux 1° et 2°, le consommateur dispose d'un droit de résiliation du contrat à tout\nmoment et sans préavis, frais ou indemnité et d'un droit au remboursement, dans un délai de quinze jours,\ndes sommes versées au prorata de la durée du contrat restant à courir."", ""Article L221-26-1\nI.-Le professionnel s'abstient d'utiliser tout contenu, autre que les données à caractère personnel pour\nlesquelles il respecte les obligations résultant du règlement (UE) 2016/679 du Parlement européen et du\nConseil du 27 avril 2016, qui a été fourni ou créé par le consommateur lors de l'utilisation du contenu\nnumérique ou du service numérique fourni par le professionnel, sauf lorsque ce contenu :\n1° N'est d'aucune utilité pour le consommateur dès lors qu'il ne l'utilise plus ;\n2° N'a trait qu'à l'activité du consommateur lorsqu'il utilise le contenu numérique ou le service numérique\nfourni par le professionnel ;\n3° A été agrégé avec d'autres données par le professionnel et ne peut être désagrégé ou ne peut l'être que\nmoyennant des efforts disproportionnés ;\n4° A été généré conjointement par le consommateur et d'autres personnes, et d'autres consommateurs\npeuvent continuer à en faire usage.\nII.-Sauf dans les situations visées aux 1° à 3° du II, le professionnel met à la disposition du consommateur,\nà la demande de ce dernier, tout contenu, autre que les données à caractère personnel, qui a été fourni ou\ncréé par le consommateur lors de l'utilisation du contenu numérique ou du service numérique fourni par le\nprofessionnel.\n\nIII.-Le consommateur a le droit de récupérer ce contenu numérique sans frais, sans que le professionnel y\nfasse obstacle, dans un délai raisonnable et dans un format couramment utilisé et compatible avec une lecture\npar machine.\nIV.-En cas de rétractation du contrat, le professionnel peut empêcher toute utilisation ultérieure du contenu\nnumérique ou du service numérique par le consommateur, notamment en faisant en sorte que le contenu\nnumérique ou le service numérique soit inaccessible au consommateur ou en désactivant le compte\nd'utilisateur du consommateur, sans préjudice du II.\nV.-Lorsque le consommateur a exercé son droit de rétractation, il s'abstient d'utiliser le contenu numérique et\nde le rendre accessible à des tiers."", 'Article L217-17\nLe remboursement au consommateur des sommes dues par le vendeur au titre de la présente sous-section\nest effectué dès réception du bien ou de la preuve de son renvoi par le consommateur et au plus tard dans les\nquatorze jours suivants.\nLe vendeur rembourse ces sommes en recourant au même moyen de paiement que celui utilisé par le\nconsommateur lors de la conclusion du contrat, sauf accord exprès de ce dernier et en tout état de cause sans\nfrais supplémentaire.\nSous-section 3 : Mises à jour', ""Article L215-1\nPour les contrats de prestations de services conclus pour une durée déterminée avec une clause de\nreconduction tacite, le professionnel prestataire de services informe le consommateur par écrit, par lettre\nnominative ou courrier électronique dédiés, au plus tôt trois mois et au plus tard un mois avant le terme\nde la période autorisant le rejet de la reconduction, de la possibilité de ne pas reconduire le contrat qu'il\na conclu avec une clause de reconduction tacite. Cette information, délivrée dans des termes clairs et\ncompréhensibles, mentionne, dans un encadré apparent, la date limite de non-reconduction.\nLorsque cette information ne lui a pas été adressée conformément aux dispositions du premier alinéa,\nle consommateur peut mettre gratuitement un terme au contrat, à tout moment à compter de la date de\nreconduction.\n\nLes avances effectuées après la dernière date de reconduction ou, s'agissant des contrats à durée\nindéterminée, après la date de transformation du contrat initial à durée déterminée, sont dans ce cas\nremboursées dans un délai de trente jours à compter de la date de résiliation, déduction faite des sommes\ncorrespondant, jusqu'à celle-ci, à l'exécution du contrat.\nLes dispositions du présent article s'appliquent sans préjudice de celles qui soumettent légalement certains\ncontrats à des règles particulières en ce qui concerne l'information du consommateur.\nPar exception au premier alinéa du présent article, pour les contrats de fourniture de service de télévision au\nsens de l'article 2 de la loi n° 86-1067 du 30 septembre 1986 relative à la liberté de communication et pour\nles contrats de fourniture de services de médias audiovisuels à la demande, le consommateur peut mettre\ngratuitement un terme au contrat, à tout moment à compter de la première reconduction, dès lors qu'il change\nde domicile ou que son foyer fiscal évolue.""]","Oui, selon l'article L215-1, si votre abonnement s'est renouvelé automatiquement sans que vous ayez été informé de la possibilité de ne pas reconduire le contrat, vous avez le droit de le résilier gratuitement à tout moment à compter de la date de reconduction. Vous avez également droit au remboursement des avances effectuées après la dernière date de reconduction dans un délai de trente jours à compter de la date de résiliation.","Oui, si le professionnel ne vous a pas informé dans les délais légaux, vous pouvez mettre un terme au contrat gratuitement à tout moment après la date de reconduction.",1.0,,0.99999999998,1.0
J'ai un abonnement à une salle de sport qui s'est renouvelé hier pour un an. Je n'ai reçu aucun courrier ou mail me prévenant de la date limite pour résilier le mois dernier. Puis-je mettre fin au contrat immédiatement et être remboursé ?,"[""Article L221-10\nLe professionnel ne peut recevoir aucun paiement ou aucune contrepartie, sous quelque forme que ce soit, de\nla part du consommateur avant l'expiration d'un délai de sept jours à compter de la conclusion du contrat hors\nétablissement.\nToutefois, ne sont pas soumis aux dispositions du premier alinéa :\n1° La souscription à domicile d'un abonnement à une publication quotidienne et assimilée, au sens de l'article\n39 bis du code général des impôts ;\n2° Les contrats à exécution successive, conclus dans les conditions prévues au présent chapitre et proposés\npar un organisme agréé ou relevant d'une décision de l'autorité administrative, ayant pour objet la fourniture\nde services mentionnés à l'article L. 7231-1 du code du travail ;\n3° Les contrats conclus au cours de réunions organisées par le vendeur à son domicile ou au domicile d'un\nconsommateur ayant préalablement et expressément accepté que cette opération se déroule à son domicile ;\n4° Les contrats ayant pour objet des travaux d'entretien ou de réparation à réaliser en urgence au domicile du\nconsommateur et expressément sollicités par lui, dans la limite des pièces de rechange et travaux strictement\nnécessaires pour répondre à l'urgence.\nPour les contrats mentionnés aux 1° et 2°, le consommateur dispose d'un droit de résiliation du contrat à tout\nmoment et sans préavis, frais ou indemnité et d'un droit au remboursement, dans un délai de quinze jours,\ndes sommes versées au prorata de la durée du contrat restant à courir."", ""Article L216-7\nLorsque le contrat est résolu dans les conditions prévues à l'article L. 216-6, le professionnel rembourse\nle consommateur de la totalité des sommes versées, au plus tard dans les quatorze jours suivant la date à\nlaquelle le contrat a été dénoncé."", ""Article L222-15\nLe fournisseur rembourse au consommateur dans les meilleurs délais et au plus tard dans les trente jours\ntoutes les sommes qu'il a perçues de celui-ci en application du contrat, à l'exception du montant mentionné\nau premier alinéa de l'article L. 222-13. Ce délai commence à courir le jour où le fournisseur reçoit\nnotification par le consommateur de sa volonté de se rétracter.\nLe consommateur restitue au fournisseur dans les meilleurs délais et au plus tard dans les trente jours\ntoute somme et tout bien qu'il a reçus de ce dernier. Ce délai commence à courir à compter du jour où le\nconsommateur communique au fournisseur sa volonté de se rétracter.\nSection 5 : Dispositions particulières"", ""Article L215-1\nPour les contrats de prestations de services conclus pour une durée déterminée avec une clause de\nreconduction tacite, le professionnel prestataire de services informe le consommateur par écrit, par lettre\nnominative ou courrier électronique dédiés, au plus tôt trois mois et au plus tard un mois avant le terme\nde la période autorisant le rejet de la reconduction, de la possibilité de ne pas reconduire le contrat qu'il\na conclu avec une clause de reconduction tacite. Cette information, délivrée dans des termes clairs et\ncompréhensibles, mentionne, dans un encadré apparent, la date limite de non-reconduction.\nLorsque cette information ne lui a pas été adressée conformément aux dispositions du premier alinéa,\nle consommateur peut mettre gratuitement un terme au contrat, à tout moment à compter de la date de\nreconduction.\n\nLes avances effectuées après la dernière date de reconduction ou, s'agissant des contrats à durée\nindéterminée, après la date de transformation du contrat initial à durée déterminée, sont dans ce cas\nremboursées dans un délai de trente jours à compter de la date de résiliation, déduction faite des sommes\ncorrespondant, jusqu'à celle-ci, à l'exécution du contrat.\nLes dispositions du présent article s'appliquent sans préjudice de celles qui soumettent légalement certains\ncontrats à des règles particulières en ce qui concerne l'information du consommateur.\nPar exception au premier alinéa du présent article, pour les contrats de fourniture de service de télévision au\nsens de l'article 2 de la loi n° 86-1067 du 30 septembre 1986 relative à la liberté de communication et pour\nles contrats de fourniture de services de médias audiovisuels à la demande, le consommateur peut mettre\ngratuitement un terme au contrat, à tout moment à compter de la première reconduction, dès lors qu'il change\nde domicile ou que son foyer fiscal évolue."", 'Article L217-17\nLe remboursement au consommateur des sommes dues par le vendeur au titre de la présente sous-section\nest effectué dès réception du bien ou de la preuve de son renvoi par le consommateur et au plus tard dans les\nquatorze jours suivants.\nLe vendeur rembourse ces sommes en recourant au même moyen de paiement que celui utilisé par le\nconsommateur lors de la conclusion du contrat, sauf accord exprès de ce dernier et en tout état de cause sans\nfrais supplémentaire.\nSous-section 3 : Mises à jour']","Selon l'article L215-1 du Code de la consommation, pour les contrats de prestations de services conclus pour une durée déterminée avec une clause de reconduction tacite, le professionnel prestataire de services doit informer le consommateur par écrit, au plus tôt trois mois et au plus tard un mois avant le terme de la période autorisant le rejet de la reconduction, de la possibilité de ne pas reconduire le contrat. Si cette information n'a pas été correctement communiquée, le consommateur a le droit de mettre fin au contrat à tout moment à compter de la date de reconduction.

Dans votre cas, si vous n'avez pas reçu d'information sur la reconduction de votre abonnement à la salle de sport, vous avez le droit de résilier le contrat immédiatement et de demander le remboursement des sommes versées. Le professionnel devra vous rembourser dans un délai de trente jours à compter de la résiliation, déduction faite des sommes correspondant à l'exécution du contrat jusqu'à cette date, conformément à l'article L215-1.

Ainsi, vous pouvez mettre fin à votre abonnement à la salle de sport et demander le remboursement des sommes versées en raison du défaut d'information sur la reconduction tacite de votre contrat.","Oui, vous pouvez résilier immédiatement et sans frais car l'information obligatoire n'a pas été envoyée. Les avances versées après la reconduction doivent vous être remboursées sous 30 jours.",0.7777777777777778,,0.99999999998,1.0
Liste les informations que le professionnel doit communiquer au consommateur avant la conclusion du contrat selon l'article L. 111-1.,"[""Article L221-5\nI.-Préalablement à la conclusion d'un contrat de vente de biens ou de fourniture de services, de contenu\nnumérique ou de services numériques, le professionnel fournit au consommateur, de manière lisible et\ncompréhensible, les informations suivantes :\n1° Les caractéristiques essentielles du bien, du service, du service numérique ou du contenu numérique ;\n2° Le prix du bien, du service, du service numérique ou du contenu numérique, en application des articles L.\n112-1 à L. 112-4 ;\n3° La date à laquelle ou le délai dans lequel le professionnel s'engage à livrer le bien ou à fournir le service,\nle service numérique ou le contenu numérique ;\n4° Les informations relatives à son identité, à ses coordonnées postales, téléphoniques et électroniques, aux\nmodalités de résiliation, aux modes de règlement des litiges, aux autres conditions contractuelles et, le cas\néchéant, aux coûts de l'utilisation de la technique de communication à distance, à l'existence de codes de\nbonne conduite et aux cautions et garanties financières ;\n5° S'il y a lieu, les informations relatives aux garanties légales, aux fonctionnalités, à la compatibilité\net à l'interopérabilité du contenu numérique, du service numérique ou du bien comportant des éléments\nnumériques, aux autres conditions contractuelles et, le cas échéant, à l'existence de toute restriction\nd'installation de logiciel ;\n\n6° La possibilité de recourir à un médiateur de la consommation dans les conditions prévues au titre Ier du\nlivre VI ;\n7° Lorsque le droit de rétractation existe, les conditions, le délai et les modalités d'exercice de ce droit ainsi\nque le formulaire type de rétractation, dont les conditions de présentation et les mentions qu'il contient sont\nfixées par décret en Conseil d'Etat ;\n8° Le cas échéant, le fait que le consommateur supporte les frais de renvoi du bien en cas de rétractation\net, pour les contrats à distance, le coût de renvoi du bien lorsque celui-ci, en raison de sa nature, ne peut\nnormalement être renvoyé par la poste ;\n9° L'information sur l'obligation du consommateur de payer des frais lorsqu'il exerce son droit de rétractation\nd'un contrat de prestation de services, de distribution d'eau, de fourniture de gaz ou d'électricité et\nd'abonnement à un réseau de chauffage urbain dont il a demandé expressément l'exécution avant la fin du\ndélai de rétractation ; ces frais sont calculés selon les modalités fixées à l'article L. 221-25 ;\n10° Lorsque le droit de rétractation ne peut être exercé en application de l'article L. 221-28, l'information\nselon laquelle le consommateur ne bénéficie pas de ce droit ou, le cas échéant, les circonstances dans\nlesquelles il le perd ;\n11° L'application d'un prix personnalisé sur la base d'une prise de décision automatisée, s'il y a lieu.\nLa liste et le contenu de ces informations sont précisés par décret en Conseil d'Etat.\nDans le cas d'une vente aux enchères publiques telle que définie par le premier alinéa de l'article L. 321-3\ndu code de commerce, les informations relatives à l'identité et aux coordonnées postales, téléphoniques et\nélectroniques du professionnel prévues au 4° du I du présent article peuvent être remplacées par celles du\nmandataire.\nII.-Outre les informations prévues au I, tout professionnel, avant la conclusion d'un contrat de fourniture\nde services et, lorsqu'il n'y a pas de contrat, avant l'exécution de la prestation de services, fournit les\ninformations complémentaires prévues par l'article L. 111-2."", ""Article L215-1-1\nLorsqu'un contrat a été conclu par voie électronique ou a été conclu par un autre moyen et que le\nprofessionnel, au jour de la résiliation par le consommateur, offre au consommateur la possibilité de conclure\ndes contrats par voie électronique, la résiliation est rendue possible selon cette modalité.\nA cet effet, le professionnel met à la disposition du consommateur une fonctionnalité gratuite permettant\nd'accomplir, par voie électronique, la notification et les démarches nécessaires à la résiliation du contrat.\nLorsque le consommateur notifie la résiliation du contrat, le professionnel lui confirme la réception de\nla notification et l'informe, sur un support durable et dans des délais raisonnables, de la date à laquelle le\ncontrat prend fin et des effets de la résiliation.\nUn décret fixe notamment les modalités techniques de nature à garantir une identification du consommateur\net un accès facile, direct et permanent à la fonctionnalité mentionnée au deuxième alinéa, telles que\nses modalités de présentation et d'utilisation. Il détermine les informations devant être fournies par le\nconsommateur."", ""Article L221-14\nPour les contrats conclus par voie électronique, le professionnel rappelle au consommateur, avant qu'il ne\npasse sa commande, de manière lisible et compréhensible, les informations relatives aux caractéristiques\nessentielles des biens ou des services qui font l'objet de la commande, à leur prix, à la durée du contrat et, s'il\ny a lieu, à la durée minimale des obligations de ce dernier au titre du contrat, telles que prévues à l'article L.\n221-5.\nLe professionnel veille à ce que le consommateur, lors de sa commande, reconnaisse explicitement son\nobligation de paiement. A cette fin, la fonction utilisée par le consommateur pour valider sa commande\n\ncomporte la mention claire et lisible : commande avec obligation de paiement ou une formule analogue,\ndénuée de toute ambiguïté, indiquant que la passation d'une commande oblige à son paiement.\nLes sites de commerce en ligne indiquent clairement et lisiblement, au plus tard au début du processus de\ncommande, les moyens de paiement acceptés par le professionnel et les éventuelles restrictions de livraison."", 'Article L211-3\nLors de la conclusion de tout contrat écrit, le consommateur est informé par le professionnel de la possibilité\nde recourir, en cas de contestation, à la procédure de médiation de la consommation dans les conditions\nprévues au titre Ier du livre VI.', ""Article L212-1\nDans les contrats conclus entre professionnels et consommateurs, sont abusives les clauses qui ont pour\nobjet ou pour effet de créer, au détriment du consommateur, un déséquilibre significatif entre les droits et\nobligations des parties au contrat.\nSans préjudice des règles d'interprétation prévues aux articles 1188, 1189, 1191 et 1192 du code civil, le\ncaractère abusif d'une clause s'apprécie en se référant, au moment de la conclusion du contrat, à toutes les\ncirconstances qui entourent sa conclusion, de même qu'à toutes les autres clauses du contrat. Il s'apprécie\négalement au regard de celles contenues dans un autre contrat lorsque les deux contrats sont juridiquement\nliés dans leur conclusion ou leur exécution.\nL'appréciation du caractère abusif des clauses au sens du premier alinéa ne porte ni sur la définition de l'objet\nprincipal du contrat ni sur l'adéquation du prix ou de la rémunération au bien vendu ou au service offert pour\nautant que les clauses soient rédigées de façon claire et compréhensible.\nUn décret en Conseil d'Etat, pris après avis de la commission des clauses abusives, détermine des types de\nclauses qui, eu égard à la gravité des atteintes qu'elles portent à l'équilibre du contrat, doivent être regardées,\nde manière irréfragable, comme abusives au sens du premier alinéa.\nUn décret pris dans les mêmes conditions, détermine une liste de clauses présumées abusives ; en cas de\nlitige concernant un contrat comportant une telle clause, le professionnel doit apporter la preuve du caractère\nnon abusif de la clause litigieuse.\nCes dispositions sont applicables quels que soient la forme ou le support du contrat. Il en est ainsi notamment\ndes bons de commande, factures, bons de garantie, bordereaux ou bons de livraison, billets ou tickets,\ncontenant des stipulations négociées librement ou non ou des références à des conditions générales\npréétablies.""]","Selon l'article L221-5 du Code de la consommation, le professionnel doit fournir au consommateur, de manière lisible et compréhensible, les informations suivantes avant la conclusion d'un contrat de vente de biens ou de fourniture de services, de contenu numérique ou de services numériques:
1. Les caractéristiques essentielles du bien, du service, du service numérique ou du contenu numérique ;
2. Le prix du bien, du service, du service numérique ou du contenu numérique ;
3. La date à laquelle ou le délai dans lequel le professionnel s'engage à livrer le bien ou à fournir le service, le service numérique ou le contenu numérique ;
4. Les informations relatives à son identité, à ses coordonnées postales, téléphoniques et électroniques, aux modalités de résiliation, aux modes de règlement des litiges, aux autres conditions contractuelles, et le cas échéant, aux coûts de l'utilisation de la technique de communication à distance, à l'existence de codes de bonne conduite et aux cautions et garanties financières ;
5. S'il y a lieu, les informations relatives aux garanties légales, aux fonctionnalités, à la compatibilité et à l'interopérabilité du contenu numérique, du service numérique ou du bien comportant des éléments numériques, aux autres conditions contractuelles, et le cas échéant, à l'existence de toute restriction d'installation de logiciel ;
6. La possibilité de recourir à un médiateur de la consommation dans les conditions prévues au titre Ier du livre VI ;
7. Lorsque le droit de rétractation existe, les conditions, le délai et les modalités d'exercice de ce droit ainsi que le formulaire type de rétractation ;
8. Le cas échéant, le fait que le consommateur supporte les frais de renvoi du bien en cas de rétractation et, pour les contrats à distance, le coût de renvoi du bien lorsque celui-ci, en raison de sa nature, ne peut normalement être renvoyé par la poste ;
9. L'information sur l'obligation du consommateur de payer des frais lorsqu'il exerce son droit de rétractation d'un contrat de prestation de services, de distribution d'eau, de fourniture de gaz ou d'électricité et d'abonnement à un réseau de chauffage urbain ;
10. L'information selon laquelle le consommateur ne bénéficie pas du droit de rétractation dans certaines circonstances ;
11. L'application d'un prix personnalisé sur la base d'une prise de décision automatisée, le cas échéant.

En résumé, avant la conclusion d'un contrat, le professionnel doit fournir au consommateur toutes ces informations conformément à l'article L221-5 du Code de la consommation.","Les caractéristiques essentielles du bien/service, le prix, la date/délai de livraison, l'identité du professionnel, et l'existence des garanties légales.",,,0.8333333332916666,1.0
Un vendeur est-il obligé de m'informer sur les caractéristiques essentielles du bien et l'existence de garanties avant que je ne paie ?,"[""Article L221-14\nPour les contrats conclus par voie électronique, le professionnel rappelle au consommateur, avant qu'il ne\npasse sa commande, de manière lisible et compréhensible, les informations relatives aux caractéristiques\nessentielles des biens ou des services qui font l'objet de la commande, à leur prix, à la durée du contrat et, s'il\ny a lieu, à la durée minimale des obligations de ce dernier au titre du contrat, telles que prévues à l'article L.\n221-5.\nLe professionnel veille à ce que le consommateur, lors de sa commande, reconnaisse explicitement son\nobligation de paiement. A cette fin, la fonction utilisée par le consommateur pour valider sa commande\n\ncomporte la mention claire et lisible : commande avec obligation de paiement ou une formule analogue,\ndénuée de toute ambiguïté, indiquant que la passation d'une commande oblige à son paiement.\nLes sites de commerce en ligne indiquent clairement et lisiblement, au plus tard au début du processus de\ncommande, les moyens de paiement acceptés par le professionnel et les éventuelles restrictions de livraison."", ""Article L221-5\nI.-Préalablement à la conclusion d'un contrat de vente de biens ou de fourniture de services, de contenu\nnumérique ou de services numériques, le professionnel fournit au consommateur, de manière lisible et\ncompréhensible, les informations suivantes :\n1° Les caractéristiques essentielles du bien, du service, du service numérique ou du contenu numérique ;\n2° Le prix du bien, du service, du service numérique ou du contenu numérique, en application des articles L.\n112-1 à L. 112-4 ;\n3° La date à laquelle ou le délai dans lequel le professionnel s'engage à livrer le bien ou à fournir le service,\nle service numérique ou le contenu numérique ;\n4° Les informations relatives à son identité, à ses coordonnées postales, téléphoniques et électroniques, aux\nmodalités de résiliation, aux modes de règlement des litiges, aux autres conditions contractuelles et, le cas\néchéant, aux coûts de l'utilisation de la technique de communication à distance, à l'existence de codes de\nbonne conduite et aux cautions et garanties financières ;\n5° S'il y a lieu, les informations relatives aux garanties légales, aux fonctionnalités, à la compatibilité\net à l'interopérabilité du contenu numérique, du service numérique ou du bien comportant des éléments\nnumériques, aux autres conditions contractuelles et, le cas échéant, à l'existence de toute restriction\nd'installation de logiciel ;\n\n6° La possibilité de recourir à un médiateur de la consommation dans les conditions prévues au titre Ier du\nlivre VI ;\n7° Lorsque le droit de rétractation existe, les conditions, le délai et les modalités d'exercice de ce droit ainsi\nque le formulaire type de rétractation, dont les conditions de présentation et les mentions qu'il contient sont\nfixées par décret en Conseil d'Etat ;\n8° Le cas échéant, le fait que le consommateur supporte les frais de renvoi du bien en cas de rétractation\net, pour les contrats à distance, le coût de renvoi du bien lorsque celui-ci, en raison de sa nature, ne peut\nnormalement être renvoyé par la poste ;\n9° L'information sur l'obligation du consommateur de payer des frais lorsqu'il exerce son droit de rétractation\nd'un contrat de prestation de services, de distribution d'eau, de fourniture de gaz ou d'électricité et\nd'abonnement à un réseau de chauffage urbain dont il a demandé expressément l'exécution avant la fin du\ndélai de rétractation ; ces frais sont calculés selon les modalités fixées à l'article L. 221-25 ;\n10° Lorsque le droit de rétractation ne peut être exercé en application de l'article L. 221-28, l'information\nselon laquelle le consommateur ne bénéficie pas de ce droit ou, le cas échéant, les circonstances dans\nlesquelles il le perd ;\n11° L'application d'un prix personnalisé sur la base d'une prise de décision automatisée, s'il y a lieu.\nLa liste et le contenu de ces informations sont précisés par décret en Conseil d'Etat.\nDans le cas d'une vente aux enchères publiques telle que définie par le premier alinéa de l'article L. 321-3\ndu code de commerce, les informations relatives à l'identité et aux coordonnées postales, téléphoniques et\nélectroniques du professionnel prévues au 4° du I du présent article peuvent être remplacées par celles du\nmandataire.\nII.-Outre les informations prévues au I, tout professionnel, avant la conclusion d'un contrat de fourniture\nde services et, lorsqu'il n'y a pas de contrat, avant l'exécution de la prestation de services, fournit les\ninformations complémentaires prévues par l'article L. 111-2."", ""Article L217-26\nLorsqu'il propose des réparations forfaitaires, le vendeur informe le consommateur par écrit ou sur un\nsupport durable, au plus tard lors de la conclusion du contrat, le cas échéant, de l'origine de la panne, de la\nnature de l'intervention envisagée et des pièces à remplacer.\nIl informe dans les mêmes conditions le consommateur que ce dernier ne bénéficie pas de la garantie\nlégale de conformité pour les pièces ou fournitures fournies à titre accessoire dans le cadre de la prestation\neffectuée, à moins que celles-ci constituent l'objet principal du contrat conclu ou qu'elles n'aient été acquises\npar le consommateur dans le cadre d'un contrat de vente distinct."", ""Article L217-9\nLe consommateur est en droit d'exiger la mise en conformité du bien aux critères énoncés dans la sous-\nsection 1 de la présente section.\nLe consommateur sollicite auprès du vendeur la mise en conformité du bien, en choisissant entre la\nréparation et le remplacement. A cette fin, le consommateur met le bien à la disposition du vendeur."", ""Article L217-19\nI.-Le vendeur veille à ce que le consommateur soit informé et reçoive les mises à jour nécessaires au\nmaintien de la conformité des biens :\n1° Durant une période à laquelle le consommateur peut légitimement s'attendre, eu égard au type et à la\nfinalité des biens et éléments numériques et compte tenu des circonstances et de la nature du contrat, dans le\ncas d'une opération de fourniture unique du contenu numérique ou du service numérique ;\n2° Durant une période de deux ans à compter du moment où les biens comportant des éléments numériques\nont été délivrés, lorsque le contrat de vente prévoit la fourniture continue du contenu numérique ou du\nservice numérique pendant une certaine période ;\n3° Durant la période pendant laquelle le contenu numérique ou le service numérique est fourni en vertu du\ncontrat lorsque celui-ci en prévoit la fourniture continue pendant une durée supérieure à deux ans.\nII.-Lorsque le consommateur n'installe pas, dans un délai raisonnable, les mises à jour mentionnées au I,\nle vendeur n'est pas responsable des défauts de conformité résultant uniquement de la non-installation des\nmises à jour concernées, à condition que :\n1° Le vendeur ait informé le consommateur de la disponibilité des mises à jour et des conséquences de leur\nnon-installation par le consommateur ; et\n2° La non-installation ou l'installation incorrecte par le consommateur des mises à jour ne soit pas due à des\nlacunes dans les instructions d'installation fournies au consommateur.""]","Oui, le vendeur est effectivement obligé de vous informer sur les caractéristiques essentielles du bien ainsi que sur l'existence de garanties avant que vous ne passiez votre commande et ne payiez. 

Selon l'article L221-14 du Code de la consommation, pour les contrats conclus par voie électronique, le professionnel doit rappeler au consommateur, avant qu'il ne passe sa commande, de manière lisible et compréhensible, les informations relatives aux caractéristiques essentielles des biens, leur prix, ainsi que les garanties éventuelles. De plus, le professionnel doit veiller à ce que le consommateur reconnaisse explicitement son obligation de paiement avant de valider sa commande.

Ainsi, le vendeur a l'obligation légale de vous fournir ces informations essentielles avant que vous ne procédiez au paiement, afin de garantir une transparence et une protection adéquate des consommateurs.","Oui, c'est une obligation générale d'information précontractuelle.",0.75,,0.94999999997625,1.0
Je viens d'acheter un service numérique mais le vendeur ne m'a jamais précisé qu'il fallait une configuration informatique très spécifique pour l'utiliser. Ai-je été correctement informé conformément à la loi ?,"[""Article L217-19\nI.-Le vendeur veille à ce que le consommateur soit informé et reçoive les mises à jour nécessaires au\nmaintien de la conformité des biens :\n1° Durant une période à laquelle le consommateur peut légitimement s'attendre, eu égard au type et à la\nfinalité des biens et éléments numériques et compte tenu des circonstances et de la nature du contrat, dans le\ncas d'une opération de fourniture unique du contenu numérique ou du service numérique ;\n2° Durant une période de deux ans à compter du moment où les biens comportant des éléments numériques\nont été délivrés, lorsque le contrat de vente prévoit la fourniture continue du contenu numérique ou du\nservice numérique pendant une certaine période ;\n3° Durant la période pendant laquelle le contenu numérique ou le service numérique est fourni en vertu du\ncontrat lorsque celui-ci en prévoit la fourniture continue pendant une durée supérieure à deux ans.\nII.-Lorsque le consommateur n'installe pas, dans un délai raisonnable, les mises à jour mentionnées au I,\nle vendeur n'est pas responsable des défauts de conformité résultant uniquement de la non-installation des\nmises à jour concernées, à condition que :\n1° Le vendeur ait informé le consommateur de la disponibilité des mises à jour et des conséquences de leur\nnon-installation par le consommateur ; et\n2° La non-installation ou l'installation incorrecte par le consommateur des mises à jour ne soit pas due à des\nlacunes dans les instructions d'installation fournies au consommateur."", ""Article L217-20\nS'agissant des mises à jour qui ne sont pas nécessaires au maintien de la conformité du bien, le vendeur\nrespecte les conditions suivantes :\n1° Le contrat autorise le principe de telles mises à jour et en fournit une raison valable ;\n2° Le vendeur informe le consommateur, de manière claire et compréhensible, raisonnablement en avance et\nsur un support durable, de la mise à jour envisagée en lui précisant la date à laquelle elle intervient ;\n3° La mise à jour est effectuée sans coût supplémentaire pour le consommateur ;\n4° Le vendeur informe le consommateur que celui-ci est en droit de refuser la mise à jour ou, le cas échéant,\nde la désinstaller, si la mise à jour a une incidence négative sur son accès au contenu numérique ou au\nservice numérique ou à son utilisation de ceux-ci.\nDans ce dernier cas, la résolution du contrat est de droit et sans frais pour le consommateur, dans un\ndélai maximal de trente jours, à moins que la mise à jour n'ait qu'une incidence mineure pour lui. Le\nconsommateur ne peut toutefois résoudre le contrat si le vendeur lui a proposé de conserver le contenu\nnumérique ou le service numérique sans modification, y compris au moyen d'une désinstallation de la mise à\njour, et si ce dernier demeure en conformité dans les conditions prévues à la présente section.\nLorsque le consommateur exerce son droit à la résolution du contrat, les dispositions des articles L. 217-16 et\nL. 217-17 s'appliquent.\nLe présent article n'est pas applicable en cas d'offre groupée au sens de l'article L. 224-42-2.\n\nSection 3 : Garantie commerciale"", ""Article L217-2\nLes dispositions du présent chapitre ne sont pas applicables :\n1° Aux biens vendus sur saisie ou par autorité de justice ;\n2° Aux biens d'occasion vendus aux enchères publiques au sens des articles L. 320-1 et suivants du code de\ncommerce dès lors que les consommateurs ont la faculté d'y assister en personne ;\n3° Aux ventes d'animaux domestiques ;\n4° Aux contenus numériques et aux services numériques ne relevant pas d'un contrat de vente de bien\ncomportant des éléments numériques, ni aux contenus numériques fournis sur un support matériel servant\nexclusivement à leur transport. De tels contenus sont régis par les dispositions des articles L. 224-25-1 et\nsuivants ;\n\n5° Aux contenus numériques et services numériques énumérés au II de l'article L. 224-25-3, y compris\nlorsque ceux-ci sont intégrés ou interconnectés à un bien couvert par le présent chapitre.\nSection 2 : Garantie légale de conformité pour les biens\nSous-section 1 : Droits du consommateur"", ""Article L221-5\nI.-Préalablement à la conclusion d'un contrat de vente de biens ou de fourniture de services, de contenu\nnumérique ou de services numériques, le professionnel fournit au consommateur, de manière lisible et\ncompréhensible, les informations suivantes :\n1° Les caractéristiques essentielles du bien, du service, du service numérique ou du contenu numérique ;\n2° Le prix du bien, du service, du service numérique ou du contenu numérique, en application des articles L.\n112-1 à L. 112-4 ;\n3° La date à laquelle ou le délai dans lequel le professionnel s'engage à livrer le bien ou à fournir le service,\nle service numérique ou le contenu numérique ;\n4° Les informations relatives à son identité, à ses coordonnées postales, téléphoniques et électroniques, aux\nmodalités de résiliation, aux modes de règlement des litiges, aux autres conditions contractuelles et, le cas\néchéant, aux coûts de l'utilisation de la technique de communication à distance, à l'existence de codes de\nbonne conduite et aux cautions et garanties financières ;\n5° S'il y a lieu, les informations relatives aux garanties légales, aux fonctionnalités, à la compatibilité\net à l'interopérabilité du contenu numérique, du service numérique ou du bien comportant des éléments\nnumériques, aux autres conditions contractuelles et, le cas échéant, à l'existence de toute restriction\nd'installation de logiciel ;\n\n6° La possibilité de recourir à un médiateur de la consommation dans les conditions prévues au titre Ier du\nlivre VI ;\n7° Lorsque le droit de rétractation existe, les conditions, le délai et les modalités d'exercice de ce droit ainsi\nque le formulaire type de rétractation, dont les conditions de présentation et les mentions qu'il contient sont\nfixées par décret en Conseil d'Etat ;\n8° Le cas échéant, le fait que le consommateur supporte les frais de renvoi du bien en cas de rétractation\net, pour les contrats à distance, le coût de renvoi du bien lorsque celui-ci, en raison de sa nature, ne peut\nnormalement être renvoyé par la poste ;\n9° L'information sur l'obligation du consommateur de payer des frais lorsqu'il exerce son droit de rétractation\nd'un contrat de prestation de services, de distribution d'eau, de fourniture de gaz ou d'électricité et\nd'abonnement à un réseau de chauffage urbain dont il a demandé expressément l'exécution avant la fin du\ndélai de rétractation ; ces frais sont calculés selon les modalités fixées à l'article L. 221-25 ;\n10° Lorsque le droit de rétractation ne peut être exercé en application de l'article L. 221-28, l'information\nselon laquelle le consommateur ne bénéficie pas de ce droit ou, le cas échéant, les circonstances dans\nlesquelles il le perd ;\n11° L'application d'un prix personnalisé sur la base d'une prise de décision automatisée, s'il y a lieu.\nLa liste et le contenu de ces informations sont précisés par décret en Conseil d'Etat.\nDans le cas d'une vente aux enchères publiques telle que définie par le premier alinéa de l'article L. 321-3\ndu code de commerce, les informations relatives à l'identité et aux coordonnées postales, téléphoniques et\nélectroniques du professionnel prévues au 4° du I du présent article peuvent être remplacées par celles du\nmandataire.\nII.-Outre les informations prévues au I, tout professionnel, avant la conclusion d'un contrat de fourniture\nde services et, lorsqu'il n'y a pas de contrat, avant l'exécution de la prestation de services, fournit les\ninformations complémentaires prévues par l'article L. 111-2."", ""Article L217-3\nLe vendeur délivre un bien conforme au contrat ainsi qu'aux critères énoncés à l'article L. 217-5.\nIl répond des défauts de conformité existant au moment de la délivrance du bien au sens de l'article L. 216-1,\nqui apparaissent dans un délai de deux ans à compter de celle-ci.\nDans le cas d'un contrat de vente d'un bien comportant des éléments numériques :\n1° Lorsque le contrat prévoit la fourniture continue d'un contenu numérique ou d'un service numérique\npendant une durée inférieure ou égale à deux ans, ou lorsque le contrat ne détermine pas la durée de\nfourniture, le vendeur répond des défauts de conformité de ce contenu numérique ou de ce service numérique\nqui apparaissent dans un délai de deux ans à compter de la délivrance du bien ;\n2° Lorsque le contrat prévoit la fourniture continue d'un contenu numérique ou d'un service numérique\npendant une durée supérieure à deux ans, le vendeur répond des défauts de conformité de ce contenu\nnumérique ou de ce service numérique qui apparaissent au cours de la période durant laquelle celui-ci est\nfourni en vertu du contrat.\nPour de tels biens, le délai applicable ne prive pas le consommateur de son droit aux mises à jour\nconformément aux dispositions de l'article L. 217-19.\nLe vendeur répond également, durant les mêmes délais, des défauts de conformité résultant de l'emballage,\ndes instructions de montage, ou de l'installation lorsque celle-ci a été mise à sa charge par le contrat ou a\nété réalisée sous sa responsabilité, ou encore lorsque l'installation incorrecte, effectuée par le consommateur\ncomme prévu au contrat, est due à des lacunes ou erreurs dans les instructions d'installation fournies par le\nvendeur.\nCe délai de garantie s'applique sans préjudice des articles 2224 et suivants du code civil. Le point de départ\nde la prescription de l'action du consommateur est le jour de la connaissance par ce dernier du défaut de\nconformité.""]","Selon l'article L221-5 du Code de la consommation, avant la conclusion d'un contrat de fourniture de services numériques, le professionnel doit fournir au consommateur, de manière lisible et compréhensible, les informations suivantes, notamment ""les caractéristiques essentielles du service numérique"" (point 1) et ""les informations relatives aux garanties légales, aux fonctionnalités, à la compatibilité et à l'interopérabilité du service numérique"" (point 5).

Si le vendeur ne vous a pas informé de la configuration informatique spécifique nécessaire pour utiliser le service numérique que vous avez acheté, il n'a pas respecté ses obligations légales d'information. Vous pouvez donc faire valoir vos droits en vertu de l'article L217-3 du Code de la consommation qui stipule que le vendeur est responsable des défauts de conformité du service numérique qui apparaissent dans un délai de deux ans à compter de la délivrance du bien.

En conséquence, vous pouvez contacter le vendeur pour lui signaler ce manquement à son obligation d'information et demander une solution (réparation, remplacement, remboursement) pour pallier à ce défaut de conformité.","Non, le vendeur a manqué à son obligation d'information sur les caractéristiques essentielles (compatibilité/interopérabilité) du service numérique.",0.625,,0.99999999998,1.0
Quand une pratique commerciale est-elle considérée comme trompeuse selon l'article L. 121-2 ?,"[""Article L212-1\nDans les contrats conclus entre professionnels et consommateurs, sont abusives les clauses qui ont pour\nobjet ou pour effet de créer, au détriment du consommateur, un déséquilibre significatif entre les droits et\nobligations des parties au contrat.\nSans préjudice des règles d'interprétation prévues aux articles 1188, 1189, 1191 et 1192 du code civil, le\ncaractère abusif d'une clause s'apprécie en se référant, au moment de la conclusion du contrat, à toutes les\ncirconstances qui entourent sa conclusion, de même qu'à toutes les autres clauses du contrat. Il s'apprécie\négalement au regard de celles contenues dans un autre contrat lorsque les deux contrats sont juridiquement\nliés dans leur conclusion ou leur exécution.\nL'appréciation du caractère abusif des clauses au sens du premier alinéa ne porte ni sur la définition de l'objet\nprincipal du contrat ni sur l'adéquation du prix ou de la rémunération au bien vendu ou au service offert pour\nautant que les clauses soient rédigées de façon claire et compréhensible.\nUn décret en Conseil d'Etat, pris après avis de la commission des clauses abusives, détermine des types de\nclauses qui, eu égard à la gravité des atteintes qu'elles portent à l'équilibre du contrat, doivent être regardées,\nde manière irréfragable, comme abusives au sens du premier alinéa.\nUn décret pris dans les mêmes conditions, détermine une liste de clauses présumées abusives ; en cas de\nlitige concernant un contrat comportant une telle clause, le professionnel doit apporter la preuve du caractère\nnon abusif de la clause litigieuse.\nCes dispositions sont applicables quels que soient la forme ou le support du contrat. Il en est ainsi notamment\ndes bons de commande, factures, bons de garantie, bordereaux ou bons de livraison, billets ou tickets,\ncontenant des stipulations négociées librement ou non ou des références à des conditions générales\npréétablies."", ""Article L221-10-1\n\nEst interdite toute visite non sollicitée d'un professionnel au domicile d'un consommateur en vue de vendre\ndes produits ou de fournir des services lorsque le consommateur a manifesté de manière claire et non\nambiguë ne pas vouloir faire l'objet d'une telle visite.\nSection 4 : Dispositions particulières applicables aux contrats conclus\nà distance"", ""Article L211-1\nLes clauses des contrats proposés par les professionnels aux consommateurs doivent être présentées et\nrédigées de façon claire et compréhensible.\nElles s'interprètent en cas de doute dans le sens le plus favorable au consommateur. Les dispositions du\nprésent alinéa ne sont toutefois pas applicables aux procédures engagées sur le fondement de l'article L.\n621-8.\nUn décret en Conseil d'Etat précise, en vue d'assurer l'information du consommateur, les modalités de\nprésentation des contrats mentionnés au premier alinéa."", 'Article L211-3\nLors de la conclusion de tout contrat écrit, le consommateur est informé par le professionnel de la possibilité\nde recourir, en cas de contestation, à la procédure de médiation de la consommation dans les conditions\nprévues au titre Ier du livre VI.', ""Article L212-2\nLes dispositions de l'article L. 212-1 sont également applicables aux contrats conclus entre des\nprofessionnels et des non-professionnels.\nChapitre III : Conservation des contrats conclus par voie électronique""]","L'article L121-2 n'est pas inclus parmi les articles juridiques fournis. Selon les articles disponibles, une pratique commerciale est considérée comme trompeuse lorsqu'elle contient des clauses abusives, créant un déséquilibre significatif entre les droits et obligations des parties au contrat (Article L212-1). De plus, il est interdit de faire des visites non sollicitées au domicile d'un consommateur en vue de vendre des produits ou services si le consommateur a clairement exprimé son refus (Article L221-10-1). Les clauses des contrats doivent être présentées de façon claire et compréhensible en faveur du consommateur (Article L211-1) et le consommateur doit être informé de la possibilité de recourir à la médiation de la consommation en cas de litige (Article L211-3). Les dispositions sur les clauses abusives s'appliquent également aux contrats entre professionnels et non-professionnels (Article L212-2).","Lorsqu'elle crée une confusion avec un concurrent ou repose sur des allégations fausses/trompeuses concernant les caractéristiques essentielles, le prix, ou la disponibilité du bien.",0.75,,0.0,0.0
"Est-ce légal pour une marque d'afficher un drapeau français sur un produit entièrement fabriqué en Chine pour faire croire au ""Made in France"" ?","[""Article L217-27\nLes dispositions de la présente section sont également applicables au producteur et aux professionnels, autres\nque le vendeur, lorsqu'ils proposent des prestations de services après-vente.\n\nSection 5 : Dispositions diverses"", ""Article L217-31\nUne action récursoire peut être exercée par le vendeur à l'encontre de toute personne en amont dans la chaîne\nde transactions commerciales, y compris le producteur, conformément aux dispositions du code civil."", ""Article L221-10-1\n\nEst interdite toute visite non sollicitée d'un professionnel au domicile d'un consommateur en vue de vendre\ndes produits ou de fournir des services lorsque le consommateur a manifesté de manière claire et non\nambiguë ne pas vouloir faire l'objet d'une telle visite.\nSection 4 : Dispositions particulières applicables aux contrats conclus\nà distance"", ""Article L217-21\nLa garantie commerciale s'entend de tout engagement contractuel d'un professionnel, qu'il s'agisse du\nvendeur ou du producteur, y compris par l'intermédiaire de toute autre personne agissant en leur nom ou\npour leur compte (ci-après dénommé “ garant ”), à l'égard du consommateur. Cet engagement a pour objet le\nremboursement du prix d'achat, le remplacement, la réparation du bien ou toute autre prestation de service en\nrelation avec le bien, ou encore toute exigence éventuelle non liée à la conformité et énoncée dans la garantie\ncommerciale, en sus des obligations légales du vendeur visant à garantir la conformité du bien.\nToute garantie commerciale lie le garant conformément aux conditions qu'elle prévoit ou aux conditions\nindiquées dans la publicité qui en a été faite antérieurement à la conclusion du contrat si les conditions\nde cette publicité sont plus favorables, sauf si le garant démontre que la publicité a été rectifiée avant la\nconclusion du contrat selon des modalités identiques ou comparables à la publicité initiale."", ""Article L217-5\nI.-En plus des critères de conformité au contrat, le bien est conforme s'il répond aux critères suivants :\n1° Il est propre à l'usage habituellement attendu d'un bien de même type, compte tenu, s'il y a lieu, de toute\ndisposition du droit de l'Union européenne et du droit national ainsi que de toutes les normes techniques ou,\nen l'absence de telles normes techniques, des codes de conduite spécifiques applicables au secteur concerné ;\n2° Le cas échéant, il possède les qualités que le vendeur a présentées au consommateur sous forme\nd'échantillon ou de modèle, avant la conclusion du contrat ;\n3° Le cas échéant, les éléments numériques qu'il comporte sont fournis selon la version la plus récente qui\nest disponible au moment de la conclusion du contrat, sauf si les parties en conviennent autrement ;\n4° Le cas échéant, il est délivré avec tous les accessoires, y compris l'emballage, et les instructions\nd'installation que le consommateur peut légitimement attendre ;\n5° Le cas échéant, il est fourni avec les mises à jour que le consommateur peut légitimement attendre,\nconformément aux dispositions de l'article L. 217-19 ;\n6° Il correspond à la quantité, à la qualité et aux autres caractéristiques, y compris en termes de durabilité,\nde fonctionnalité, de compatibilité et de sécurité, que le consommateur peut légitimement attendre pour des\nbiens de même type, eu égard à la nature du bien ainsi qu'aux déclarations publiques faites par le vendeur,\npar toute personne en amont dans la chaîne de transactions, ou par une personne agissant pour leur compte, y\ncompris dans la publicité ou sur l'étiquetage.\nII.-Toutefois, le vendeur n'est pas tenu par toutes déclarations publiques mentionnées à l'alinéa qui précède\ns'il démontre :\n1° Qu'il ne les connaissait pas et n'était légitimement pas en mesure de les connaître ;\n2° Qu'au moment de la conclusion du contrat, les déclarations publiques avaient été rectifiées dans des\nconditions comparables aux déclarations initiales ; ou\n3° Que les déclarations publiques n'ont pas pu avoir d'influence sur la décision d'achat.\nIII.-Le consommateur ne peut contester la conformité en invoquant un défaut concernant une ou plusieurs\ncaractéristiques particulières du bien, dont il a été spécifiquement informé qu'elles s'écartaient des critères\nde conformité énoncés au présent article, écart auquel il a expressément et séparément consenti lors de la\nconclusion du contrat.""]","Selon l'article L217-5 du Code de la consommation, un bien est conforme au contrat s'il correspond notamment à toutes les caractéristiques que le consommateur peut légitimement attendre pour un bien de même type, en tenant compte des déclarations publiques faites par le vendeur. De plus, le vendeur n'est pas tenu par ces déclarations s'il peut démontrer qu'il ne les connaissait pas ou qu'elles n'ont pas influencé la décision d'achat du consommateur.

Dans le cas d'un produit affichant un drapeau français alors qu'il est entièrement fabriqué en Chine, cela pourrait être considéré comme une pratique commerciale trompeuse, en violation de l'article L221-10-1 interdisant les pratiques commerciales déloyales. Le consommateur pourrait légitimement s'attendre à ce que le produit soit fabriqué en France en raison de la présence du drapeau français, ce qui pourrait influencer sa décision d'achat.

Par conséquent, il serait illégal pour une marque d'afficher un drapeau français sur un produit entièrement fabriqué en Chine dans le but de faire croire qu'il est ""Made in France"".","Non, c'est une pratique commerciale trompeuse sur l'origine et les qualités substantielles du produit.",0.7777777777777778,,0.19999999998,0.0
"Une publicité promettait une réparation ""gratuite"" de mon toit, mais une fois sur place, l'artisan me facture des frais de déplacement et de diagnostic obligatoires. Est-ce une pratique trompeuse ?","[""Article L217-21\nLa garantie commerciale s'entend de tout engagement contractuel d'un professionnel, qu'il s'agisse du\nvendeur ou du producteur, y compris par l'intermédiaire de toute autre personne agissant en leur nom ou\npour leur compte (ci-après dénommé “ garant ”), à l'égard du consommateur. Cet engagement a pour objet le\nremboursement du prix d'achat, le remplacement, la réparation du bien ou toute autre prestation de service en\nrelation avec le bien, ou encore toute exigence éventuelle non liée à la conformité et énoncée dans la garantie\ncommerciale, en sus des obligations légales du vendeur visant à garantir la conformité du bien.\nToute garantie commerciale lie le garant conformément aux conditions qu'elle prévoit ou aux conditions\nindiquées dans la publicité qui en a été faite antérieurement à la conclusion du contrat si les conditions\nde cette publicité sont plus favorables, sauf si le garant démontre que la publicité a été rectifiée avant la\nconclusion du contrat selon des modalités identiques ou comparables à la publicité initiale."", ""Article L217-11\n\nLa mise en conformité du bien a lieu sans aucun frais pour le consommateur.\nLe consommateur n'est pas tenu de payer pour l'utilisation normale qu'il a faite du bien remplacé pendant la\npériode antérieure à son remplacement."", ""Article L217-9\nLe consommateur est en droit d'exiger la mise en conformité du bien aux critères énoncés dans la sous-\nsection 1 de la présente section.\nLe consommateur sollicite auprès du vendeur la mise en conformité du bien, en choisissant entre la\nréparation et le remplacement. A cette fin, le consommateur met le bien à la disposition du vendeur."", ""Article L221-6\nSi le professionnel n'a pas respecté ses obligations d'information concernant les frais supplémentaires\nmentionnés à l'article L. 112-3 et au 8° de l'article L. 221-5, le consommateur n'est pas tenu au paiement de\nces frais."", ""Article L217-10\nLa mise en conformité du bien a lieu dans un délai raisonnable qui ne peut être supérieur à trente jours\nsuivant la demande du consommateur et sans inconvénient majeur pour lui, compte tenu de la nature du bien\net de l'usage recherché par le consommateur.\nLa réparation ou le remplacement du bien non conforme inclut, s'il y a lieu, l'enlèvement et la reprise de ce\nbien et l'installation du bien réparé ou du bien de remplacement par le vendeur.\nUn décret précise les modalités de la mise en conformité du bien.""]","Selon l'article L221-6 du Code de la consommation, si le professionnel n'a pas respecté ses obligations d'information concernant les frais supplémentaires mentionnés dans la publicité, le consommateur n'est pas tenu au paiement de ces frais. Dans votre cas, si la publicité promettait une réparation ""gratuite"" sans mentionner les frais de déplacement et de diagnostic obligatoires, il s'agit effectivement d'une pratique trompeuse. Vous n'êtes donc pas tenu de payer ces frais supplémentaires. Vous pouvez contester cette facturation auprès de l'artisan en vous appuyant sur cet article de loi.","Oui, présenter un service comme gratuit alors que le consommateur doit payer des frais (autres que ceux inévitables liés à la réponse) est une pratique trompeuse.",0.5,,0.9166666666361111,1.0
Que garantit l'article L. 612-1 au consommateur concernant le règlement des litiges ?,"[""Article L217-8\nEn cas de défaut de conformité, le consommateur a droit à la mise en conformité du bien par réparation ou\nremplacement ou, à défaut, à la réduction du prix ou à la résolution du contrat, dans les conditions énoncées\nà la présente sous-section.\nLe consommateur a, par ailleurs, le droit de suspendre le paiement de tout ou partie du prix ou la remise de\nl'avantage prévu au contrat jusqu'à ce que le vendeur ait satisfait aux obligations qui lui incombent au titre du\nprésent chapitre, dans les conditions des articles 1219 et 1220 du code civil.\nLes dispositions du présent chapitre sont sans préjudice de l'allocation de dommages et intérêts."", 'Article L211-3\nLors de la conclusion de tout contrat écrit, le consommateur est informé par le professionnel de la possibilité\nde recourir, en cas de contestation, à la procédure de médiation de la consommation dans les conditions\nprévues au titre Ier du livre VI.', ""Article L211-1\nLes clauses des contrats proposés par les professionnels aux consommateurs doivent être présentées et\nrédigées de façon claire et compréhensible.\nElles s'interprètent en cas de doute dans le sens le plus favorable au consommateur. Les dispositions du\nprésent alinéa ne sont toutefois pas applicables aux procédures engagées sur le fondement de l'article L.\n621-8.\nUn décret en Conseil d'Etat précise, en vue d'assurer l'information du consommateur, les modalités de\nprésentation des contrats mentionnés au premier alinéa."", ""Article L217-28\nLorsque le consommateur demande au garant, pendant le cours de la garantie légale ou de la garantie\ncommerciale qui lui a été consentie lors de l'acquisition ou de la réparation d'un bien, une remise en état\ncouverte par cette garantie, toute période d'immobilisation suspend la garantie qui restait à courir jusqu'à la\ndélivrance du bien remis en état.\nCette période court à compter de la demande d'intervention du consommateur ou de la mise à disposition\npour réparation ou remplacement du bien en cause, si ce point de départ s'avère plus favorable au\nconsommateur.\nLe délai de garantie est également suspendu lorsque le consommateur et le garant entrent en négociation en\nvue d'un règlement à l'amiable."", ""Article L216-5\nLe professionnel indique par écrit au consommateur lors de son achat, s'il y a lieu, le coût de la livraison\net de mise en service du bien. Un écrit est laissé au consommateur lors de l'entrée en possession du bien,\nmentionnant la possibilité pour le consommateur de formuler des réserves, notamment en cas de défaut du\nbien ou de défaut de remise de la notice d'emploi ou des instructions d'installation.\nL'absence de réserves formulées par le consommateur lors de la réception du bien n'exonère pas le\nprofessionnel de la garantie de conformité du bien qu'il doit au consommateur.""]",L'article L612-1 n'est pas inclus parmi les articles juridiques fournis.,Il garantit au consommateur le droit de recourir gratuitement à un médiateur de la consommation en vue de la résolution amiable du litige.,1.0,,0.49999999995,1.0
"En cas de conflit avec un commerçant, ai-je le droit de faire appel à un médiateur gratuitement ?","[""Article L221-5\nI.-Préalablement à la conclusion d'un contrat de vente de biens ou de fourniture de services, de contenu\nnumérique ou de services numériques, le professionnel fournit au consommateur, de manière lisible et\ncompréhensible, les informations suivantes :\n1° Les caractéristiques essentielles du bien, du service, du service numérique ou du contenu numérique ;\n2° Le prix du bien, du service, du service numérique ou du contenu numérique, en application des articles L.\n112-1 à L. 112-4 ;\n3° La date à laquelle ou le délai dans lequel le professionnel s'engage à livrer le bien ou à fournir le service,\nle service numérique ou le contenu numérique ;\n4° Les informations relatives à son identité, à ses coordonnées postales, téléphoniques et électroniques, aux\nmodalités de résiliation, aux modes de règlement des litiges, aux autres conditions contractuelles et, le cas\néchéant, aux coûts de l'utilisation de la technique de communication à distance, à l'existence de codes de\nbonne conduite et aux cautions et garanties financières ;\n5° S'il y a lieu, les informations relatives aux garanties légales, aux fonctionnalités, à la compatibilité\net à l'interopérabilité du contenu numérique, du service numérique ou du bien comportant des éléments\nnumériques, aux autres conditions contractuelles et, le cas échéant, à l'existence de toute restriction\nd'installation de logiciel ;\n\n6° La possibilité de recourir à un médiateur de la consommation dans les conditions prévues au titre Ier du\nlivre VI ;\n7° Lorsque le droit de rétractation existe, les conditions, le délai et les modalités d'exercice de ce droit ainsi\nque le formulaire type de rétractation, dont les conditions de présentation et les mentions qu'il contient sont\nfixées par décret en Conseil d'Etat ;\n8° Le cas échéant, le fait que le consommateur supporte les frais de renvoi du bien en cas de rétractation\net, pour les contrats à distance, le coût de renvoi du bien lorsque celui-ci, en raison de sa nature, ne peut\nnormalement être renvoyé par la poste ;\n9° L'information sur l'obligation du consommateur de payer des frais lorsqu'il exerce son droit de rétractation\nd'un contrat de prestation de services, de distribution d'eau, de fourniture de gaz ou d'électricité et\nd'abonnement à un réseau de chauffage urbain dont il a demandé expressément l'exécution avant la fin du\ndélai de rétractation ; ces frais sont calculés selon les modalités fixées à l'article L. 221-25 ;\n10° Lorsque le droit de rétractation ne peut être exercé en application de l'article L. 221-28, l'information\nselon laquelle le consommateur ne bénéficie pas de ce droit ou, le cas échéant, les circonstances dans\nlesquelles il le perd ;\n11° L'application d'un prix personnalisé sur la base d'une prise de décision automatisée, s'il y a lieu.\nLa liste et le contenu de ces informations sont précisés par décret en Conseil d'Etat.\nDans le cas d'une vente aux enchères publiques telle que définie par le premier alinéa de l'article L. 321-3\ndu code de commerce, les informations relatives à l'identité et aux coordonnées postales, téléphoniques et\nélectroniques du professionnel prévues au 4° du I du présent article peuvent être remplacées par celles du\nmandataire.\nII.-Outre les informations prévues au I, tout professionnel, avant la conclusion d'un contrat de fourniture\nde services et, lorsqu'il n'y a pas de contrat, avant l'exécution de la prestation de services, fournit les\ninformations complémentaires prévues par l'article L. 111-2."", 'Article L211-3\nLors de la conclusion de tout contrat écrit, le consommateur est informé par le professionnel de la possibilité\nde recourir, en cas de contestation, à la procédure de médiation de la consommation dans les conditions\nprévues au titre Ier du livre VI.', ""Article L221-15\nLe professionnel est responsable de plein droit à l'égard du consommateur de la bonne exécution des\nobligations résultant du contrat conclu à distance, que ces obligations soient exécutées par le professionnel\nqui a conclu ce contrat ou par d'autres prestataires de services, sans préjudice de son droit de recours contre\nceux-ci.\nToutefois, il peut s'exonérer de tout ou partie de sa responsabilité en apportant la preuve que l'inexécution\nou la mauvaise exécution du contrat est imputable soit au consommateur, soit au fait, imprévisible et\ninsurmontable, d'un tiers au contrat, soit à un cas de force majeure.\nSection 5 : Démarchage téléphonique et prospection commerciale"", ""Article L221-10-1\n\nEst interdite toute visite non sollicitée d'un professionnel au domicile d'un consommateur en vue de vendre\ndes produits ou de fournir des services lorsque le consommateur a manifesté de manière claire et non\nambiguë ne pas vouloir faire l'objet d'une telle visite.\nSection 4 : Dispositions particulières applicables aux contrats conclus\nà distance"", ""Article L217-31\nUne action récursoire peut être exercée par le vendeur à l'encontre de toute personne en amont dans la chaîne\nde transactions commerciales, y compris le producteur, conformément aux dispositions du code civil.""]","Oui, en cas de conflit avec un commerçant, vous avez le droit de faire appel à un médiateur gratuitement. Selon l'article L211-3, lors de la conclusion de tout contrat écrit, le consommateur doit être informé par le professionnel de la possibilité de recourir, en cas de contestation, à la procédure de médiation de la consommation dans les conditions prévues au titre Ier du livre VI. Cette médiation est donc gratuite pour le consommateur.","Oui, tout consommateur a le droit d'accéder gratuitement à un dispositif de médiation de la consommation.",0.5,,0.99999999995,1.0
Je suis en litige avec mon opérateur téléphonique qui refuse de me rembourser. J'ai envoyé une réclamation écrite sans succès. Puis-je saisir un médiateur et est-ce que cela va me coûter quelque chose ?,"[""Article L221-5\nI.-Préalablement à la conclusion d'un contrat de vente de biens ou de fourniture de services, de contenu\nnumérique ou de services numériques, le professionnel fournit au consommateur, de manière lisible et\ncompréhensible, les informations suivantes :\n1° Les caractéristiques essentielles du bien, du service, du service numérique ou du contenu numérique ;\n2° Le prix du bien, du service, du service numérique ou du contenu numérique, en application des articles L.\n112-1 à L. 112-4 ;\n3° La date à laquelle ou le délai dans lequel le professionnel s'engage à livrer le bien ou à fournir le service,\nle service numérique ou le contenu numérique ;\n4° Les informations relatives à son identité, à ses coordonnées postales, téléphoniques et électroniques, aux\nmodalités de résiliation, aux modes de règlement des litiges, aux autres conditions contractuelles et, le cas\néchéant, aux coûts de l'utilisation de la technique de communication à distance, à l'existence de codes de\nbonne conduite et aux cautions et garanties financières ;\n5° S'il y a lieu, les informations relatives aux garanties légales, aux fonctionnalités, à la compatibilité\net à l'interopérabilité du contenu numérique, du service numérique ou du bien comportant des éléments\nnumériques, aux autres conditions contractuelles et, le cas échéant, à l'existence de toute restriction\nd'installation de logiciel ;\n\n6° La possibilité de recourir à un médiateur de la consommation dans les conditions prévues au titre Ier du\nlivre VI ;\n7° Lorsque le droit de rétractation existe, les conditions, le délai et les modalités d'exercice de ce droit ainsi\nque le formulaire type de rétractation, dont les conditions de présentation et les mentions qu'il contient sont\nfixées par décret en Conseil d'Etat ;\n8° Le cas échéant, le fait que le consommateur supporte les frais de renvoi du bien en cas de rétractation\net, pour les contrats à distance, le coût de renvoi du bien lorsque celui-ci, en raison de sa nature, ne peut\nnormalement être renvoyé par la poste ;\n9° L'information sur l'obligation du consommateur de payer des frais lorsqu'il exerce son droit de rétractation\nd'un contrat de prestation de services, de distribution d'eau, de fourniture de gaz ou d'électricité et\nd'abonnement à un réseau de chauffage urbain dont il a demandé expressément l'exécution avant la fin du\ndélai de rétractation ; ces frais sont calculés selon les modalités fixées à l'article L. 221-25 ;\n10° Lorsque le droit de rétractation ne peut être exercé en application de l'article L. 221-28, l'information\nselon laquelle le consommateur ne bénéficie pas de ce droit ou, le cas échéant, les circonstances dans\nlesquelles il le perd ;\n11° L'application d'un prix personnalisé sur la base d'une prise de décision automatisée, s'il y a lieu.\nLa liste et le contenu de ces informations sont précisés par décret en Conseil d'Etat.\nDans le cas d'une vente aux enchères publiques telle que définie par le premier alinéa de l'article L. 321-3\ndu code de commerce, les informations relatives à l'identité et aux coordonnées postales, téléphoniques et\nélectroniques du professionnel prévues au 4° du I du présent article peuvent être remplacées par celles du\nmandataire.\nII.-Outre les informations prévues au I, tout professionnel, avant la conclusion d'un contrat de fourniture\nde services et, lorsqu'il n'y a pas de contrat, avant l'exécution de la prestation de services, fournit les\ninformations complémentaires prévues par l'article L. 111-2."", ""Article L222-15\nLe fournisseur rembourse au consommateur dans les meilleurs délais et au plus tard dans les trente jours\ntoutes les sommes qu'il a perçues de celui-ci en application du contrat, à l'exception du montant mentionné\nau premier alinéa de l'article L. 222-13. Ce délai commence à courir le jour où le fournisseur reçoit\nnotification par le consommateur de sa volonté de se rétracter.\nLe consommateur restitue au fournisseur dans les meilleurs délais et au plus tard dans les trente jours\ntoute somme et tout bien qu'il a reçus de ce dernier. Ce délai commence à courir à compter du jour où le\nconsommateur communique au fournisseur sa volonté de se rétracter.\nSection 5 : Dispositions particulières"", ""Article L216-7\nLorsque le contrat est résolu dans les conditions prévues à l'article L. 216-6, le professionnel rembourse\nle consommateur de la totalité des sommes versées, au plus tard dans les quatorze jours suivant la date à\nlaquelle le contrat a été dénoncé."", 'Article L217-17\nLe remboursement au consommateur des sommes dues par le vendeur au titre de la présente sous-section\nest effectué dès réception du bien ou de la preuve de son renvoi par le consommateur et au plus tard dans les\nquatorze jours suivants.\nLe vendeur rembourse ces sommes en recourant au même moyen de paiement que celui utilisé par le\nconsommateur lors de la conclusion du contrat, sauf accord exprès de ce dernier et en tout état de cause sans\nfrais supplémentaire.\nSous-section 3 : Mises à jour', ""Article L221-24\nLorsque le droit de rétractation est exercé, le professionnel rembourse le consommateur de la totalité des\nsommes versées, y compris les frais de livraison, sans retard injustifié et au plus tard dans les quatorze jours\nà compter de la date à laquelle il est informé de la décision du consommateur de se rétracter.\nPour les contrats de vente de biens, à moins qu'il ne propose de récupérer lui-même les biens, le\nprofessionnel peut différer le remboursement jusqu'à récupération des biens ou jusqu'à ce que le\nconsommateur ait fourni une preuve de l'expédition de ces biens, la date retenue étant celle du premier de ces\nfaits.\nLe professionnel effectue ce remboursement en utilisant le même moyen de paiement que celui utilisé par\nle consommateur pour la transaction initiale, sauf accord exprès du consommateur pour qu'il utilise un autre\nmoyen de paiement et dans la mesure où le remboursement n'occasionne pas de frais pour le consommateur.\nLe professionnel n'est pas tenu de rembourser les frais supplémentaires si le consommateur a expressément\nchoisi un mode de livraison plus coûteux que le mode de livraison standard proposé par le professionnel.""]","Selon l'article L221-5 du Code de la consommation, le professionnel doit informer le consommateur de la possibilité de recourir à un médiateur de la consommation. Ainsi, dans votre litige avec votre opérateur téléphonique, vous avez le droit de saisir un médiateur de la consommation pour tenter de résoudre le litige à l'amiable.

Concernant les frais liés à la médiation, l'article L221-5 ne mentionne pas de frais spécifiques pour le consommateur qui souhaite recourir à un médiateur. En général, la médiation de la consommation est gratuite pour le consommateur. Cependant, il est recommandé de vérifier les conditions spécifiques de médiation applicables dans votre situation.

N'hésitez pas à contacter un médiateur de la consommation pour obtenir de l'aide dans la résolution de votre litige avec votre opérateur téléphonique.","Oui, vous pouvez saisir le médiateur compétent après échec de la réclamation écrite, et cette procédure est gratuite pour vous.",0.3333333333333333,,0.8874999999778125,0.5
Quelle est la durée de la garantie de conformité pour un bien comportant des éléments numériques selon l'article L. 217-3 ?,"[""Article L217-3\nLe vendeur délivre un bien conforme au contrat ainsi qu'aux critères énoncés à l'article L. 217-5.\nIl répond des défauts de conformité existant au moment de la délivrance du bien au sens de l'article L. 216-1,\nqui apparaissent dans un délai de deux ans à compter de celle-ci.\nDans le cas d'un contrat de vente d'un bien comportant des éléments numériques :\n1° Lorsque le contrat prévoit la fourniture continue d'un contenu numérique ou d'un service numérique\npendant une durée inférieure ou égale à deux ans, ou lorsque le contrat ne détermine pas la durée de\nfourniture, le vendeur répond des défauts de conformité de ce contenu numérique ou de ce service numérique\nqui apparaissent dans un délai de deux ans à compter de la délivrance du bien ;\n2° Lorsque le contrat prévoit la fourniture continue d'un contenu numérique ou d'un service numérique\npendant une durée supérieure à deux ans, le vendeur répond des défauts de conformité de ce contenu\nnumérique ou de ce service numérique qui apparaissent au cours de la période durant laquelle celui-ci est\nfourni en vertu du contrat.\nPour de tels biens, le délai applicable ne prive pas le consommateur de son droit aux mises à jour\nconformément aux dispositions de l'article L. 217-19.\nLe vendeur répond également, durant les mêmes délais, des défauts de conformité résultant de l'emballage,\ndes instructions de montage, ou de l'installation lorsque celle-ci a été mise à sa charge par le contrat ou a\nété réalisée sous sa responsabilité, ou encore lorsque l'installation incorrecte, effectuée par le consommateur\ncomme prévu au contrat, est due à des lacunes ou erreurs dans les instructions d'installation fournies par le\nvendeur.\nCe délai de garantie s'applique sans préjudice des articles 2224 et suivants du code civil. Le point de départ\nde la prescription de l'action du consommateur est le jour de la connaissance par ce dernier du défaut de\nconformité."", ""Article L217-7\nLes défauts de conformité qui apparaissent dans un délai de vingt-quatre mois à compter de la délivrance du\nbien, y compris du bien comportant des éléments numériques, sont, sauf preuve contraire, présumés exister\n\nau moment de la délivrance, à moins que cette présomption ne soit incompatible avec la nature du bien ou du\ndéfaut invoqué.\nPour les biens d'occasion, ce délai est fixé à douze mois.\nLorsque le contrat de vente d'un bien comportant des éléments numériques prévoit la fourniture continue\nd'un contenu numérique ou d'un service numérique, sont présumés exister au moment de la délivrance du\nbien les défauts de conformité qui apparaissent :\n1° Durant un délai de deux ans à compter de la délivrance du bien, lorsque le contrat prévoit cette fourniture\npendant une durée inférieure ou égale à deux ans ou lorsque le contrat ne détermine pas la durée de\nfourniture ;\n2° Durant la période durant laquelle le contenu numérique ou le service numérique est fourni en vertu du\ncontrat, lorsque celui-ci prévoit cette fourniture pendant une durée supérieure à deux ans.\nSous-section 2 : Mise en œuvre de la garantie légale de conformité"", ""Article L217-13\nTout bien réparé dans le cadre de la garantie légale de conformité bénéficie d'une extension de cette garantie\nde six mois.\nDès lors que le consommateur fait le choix de la réparation mais que celle-ci n'est pas mise en œuvre par\nle vendeur, la mise en conformité par le remplacement du bien fait courir, au bénéfice du consommateur,\nun nouveau délai de garantie légale de conformité attaché au bien remplacé. Cette disposition s'applique à\ncompter du jour où le bien de remplacement est délivré au consommateur."", ""Article L217-19\nI.-Le vendeur veille à ce que le consommateur soit informé et reçoive les mises à jour nécessaires au\nmaintien de la conformité des biens :\n1° Durant une période à laquelle le consommateur peut légitimement s'attendre, eu égard au type et à la\nfinalité des biens et éléments numériques et compte tenu des circonstances et de la nature du contrat, dans le\ncas d'une opération de fourniture unique du contenu numérique ou du service numérique ;\n2° Durant une période de deux ans à compter du moment où les biens comportant des éléments numériques\nont été délivrés, lorsque le contrat de vente prévoit la fourniture continue du contenu numérique ou du\nservice numérique pendant une certaine période ;\n3° Durant la période pendant laquelle le contenu numérique ou le service numérique est fourni en vertu du\ncontrat lorsque celui-ci en prévoit la fourniture continue pendant une durée supérieure à deux ans.\nII.-Lorsque le consommateur n'installe pas, dans un délai raisonnable, les mises à jour mentionnées au I,\nle vendeur n'est pas responsable des défauts de conformité résultant uniquement de la non-installation des\nmises à jour concernées, à condition que :\n1° Le vendeur ait informé le consommateur de la disponibilité des mises à jour et des conséquences de leur\nnon-installation par le consommateur ; et\n2° La non-installation ou l'installation incorrecte par le consommateur des mises à jour ne soit pas due à des\nlacunes dans les instructions d'installation fournies au consommateur."", ""Article L217-20\nS'agissant des mises à jour qui ne sont pas nécessaires au maintien de la conformité du bien, le vendeur\nrespecte les conditions suivantes :\n1° Le contrat autorise le principe de telles mises à jour et en fournit une raison valable ;\n2° Le vendeur informe le consommateur, de manière claire et compréhensible, raisonnablement en avance et\nsur un support durable, de la mise à jour envisagée en lui précisant la date à laquelle elle intervient ;\n3° La mise à jour est effectuée sans coût supplémentaire pour le consommateur ;\n4° Le vendeur informe le consommateur que celui-ci est en droit de refuser la mise à jour ou, le cas échéant,\nde la désinstaller, si la mise à jour a une incidence négative sur son accès au contenu numérique ou au\nservice numérique ou à son utilisation de ceux-ci.\nDans ce dernier cas, la résolution du contrat est de droit et sans frais pour le consommateur, dans un\ndélai maximal de trente jours, à moins que la mise à jour n'ait qu'une incidence mineure pour lui. Le\nconsommateur ne peut toutefois résoudre le contrat si le vendeur lui a proposé de conserver le contenu\nnumérique ou le service numérique sans modification, y compris au moyen d'une désinstallation de la mise à\njour, et si ce dernier demeure en conformité dans les conditions prévues à la présente section.\nLorsque le consommateur exerce son droit à la résolution du contrat, les dispositions des articles L. 217-16 et\nL. 217-17 s'appliquent.\nLe présent article n'est pas applicable en cas d'offre groupée au sens de l'article L. 224-42-2.\n\nSection 3 : Garantie commerciale""]","Selon l'article L217-3 du Code de la consommation, pour un bien comportant des éléments numériques, la durée de la garantie de conformité est de deux ans à compter de la délivrance du bien. Le vendeur est responsable des défauts de conformité de ce contenu numérique ou de ce service numérique qui apparaissent dans ce délai.","Le vendeur répond des défauts de conformité apparaissant dans un délai de deux ans, ou durant la période de fourniture du contenu numérique si celle-ci est supérieure à deux ans.",1.0,,0.9166666666361111,1.0
"Si j'achète un jeu vidéo en téléchargement ou un objet connecté, combien de temps suis-je couvert contre les défauts de conformité ?","[""Article L217-7\nLes défauts de conformité qui apparaissent dans un délai de vingt-quatre mois à compter de la délivrance du\nbien, y compris du bien comportant des éléments numériques, sont, sauf preuve contraire, présumés exister\n\nau moment de la délivrance, à moins que cette présomption ne soit incompatible avec la nature du bien ou du\ndéfaut invoqué.\nPour les biens d'occasion, ce délai est fixé à douze mois.\nLorsque le contrat de vente d'un bien comportant des éléments numériques prévoit la fourniture continue\nd'un contenu numérique ou d'un service numérique, sont présumés exister au moment de la délivrance du\nbien les défauts de conformité qui apparaissent :\n1° Durant un délai de deux ans à compter de la délivrance du bien, lorsque le contrat prévoit cette fourniture\npendant une durée inférieure ou égale à deux ans ou lorsque le contrat ne détermine pas la durée de\nfourniture ;\n2° Durant la période durant laquelle le contenu numérique ou le service numérique est fourni en vertu du\ncontrat, lorsque celui-ci prévoit cette fourniture pendant une durée supérieure à deux ans.\nSous-section 2 : Mise en œuvre de la garantie légale de conformité"", ""Article L217-13\nTout bien réparé dans le cadre de la garantie légale de conformité bénéficie d'une extension de cette garantie\nde six mois.\nDès lors que le consommateur fait le choix de la réparation mais que celle-ci n'est pas mise en œuvre par\nle vendeur, la mise en conformité par le remplacement du bien fait courir, au bénéfice du consommateur,\nun nouveau délai de garantie légale de conformité attaché au bien remplacé. Cette disposition s'applique à\ncompter du jour où le bien de remplacement est délivré au consommateur."", ""Article L217-3\nLe vendeur délivre un bien conforme au contrat ainsi qu'aux critères énoncés à l'article L. 217-5.\nIl répond des défauts de conformité existant au moment de la délivrance du bien au sens de l'article L. 216-1,\nqui apparaissent dans un délai de deux ans à compter de celle-ci.\nDans le cas d'un contrat de vente d'un bien comportant des éléments numériques :\n1° Lorsque le contrat prévoit la fourniture continue d'un contenu numérique ou d'un service numérique\npendant une durée inférieure ou égale à deux ans, ou lorsque le contrat ne détermine pas la durée de\nfourniture, le vendeur répond des défauts de conformité de ce contenu numérique ou de ce service numérique\nqui apparaissent dans un délai de deux ans à compter de la délivrance du bien ;\n2° Lorsque le contrat prévoit la fourniture continue d'un contenu numérique ou d'un service numérique\npendant une durée supérieure à deux ans, le vendeur répond des défauts de conformité de ce contenu\nnumérique ou de ce service numérique qui apparaissent au cours de la période durant laquelle celui-ci est\nfourni en vertu du contrat.\nPour de tels biens, le délai applicable ne prive pas le consommateur de son droit aux mises à jour\nconformément aux dispositions de l'article L. 217-19.\nLe vendeur répond également, durant les mêmes délais, des défauts de conformité résultant de l'emballage,\ndes instructions de montage, ou de l'installation lorsque celle-ci a été mise à sa charge par le contrat ou a\nété réalisée sous sa responsabilité, ou encore lorsque l'installation incorrecte, effectuée par le consommateur\ncomme prévu au contrat, est due à des lacunes ou erreurs dans les instructions d'installation fournies par le\nvendeur.\nCe délai de garantie s'applique sans préjudice des articles 2224 et suivants du code civil. Le point de départ\nde la prescription de l'action du consommateur est le jour de la connaissance par ce dernier du défaut de\nconformité."", ""Article L217-11\n\nLa mise en conformité du bien a lieu sans aucun frais pour le consommateur.\nLe consommateur n'est pas tenu de payer pour l'utilisation normale qu'il a faite du bien remplacé pendant la\npériode antérieure à son remplacement."", ""Article L217-10\nLa mise en conformité du bien a lieu dans un délai raisonnable qui ne peut être supérieur à trente jours\nsuivant la demande du consommateur et sans inconvénient majeur pour lui, compte tenu de la nature du bien\net de l'usage recherché par le consommateur.\nLa réparation ou le remplacement du bien non conforme inclut, s'il y a lieu, l'enlèvement et la reprise de ce\nbien et l'installation du bien réparé ou du bien de remplacement par le vendeur.\nUn décret précise les modalités de la mise en conformité du bien.""]","Selon l'article L217-7 du Code de la consommation, pour les biens comportant des éléments numériques comme un jeu vidéo en téléchargement ou un objet connecté, le vendeur est responsable des défauts de conformité existant au moment de la délivrance du bien et qui apparaissent dans un délai de deux ans à compter de celle-ci. 

Ainsi, vous êtes couvert contre les défauts de conformité pour une période de deux ans à partir de la délivrance du bien. Si un défaut de conformité survient pendant cette période, le vendeur est tenu de mettre en œuvre la garantie légale de conformité dans un délai raisonnable et sans frais pour vous, comme le prévoit l'article L217-10.","Vous êtes couvert pendant 2 ans minimum, ou pendant toute la durée de l'abonnement si le service numérique est fourni en continu sur une longue période.",1.0,,0.8333333332916666,1.0
"J'ai acheté un logiciel avec un abonnement de 3 ans. Au bout de 2 ans et demi, il ne fonctionne plus. Le vendeur est-il encore responsable ?","[""Article L217-19\nI.-Le vendeur veille à ce que le consommateur soit informé et reçoive les mises à jour nécessaires au\nmaintien de la conformité des biens :\n1° Durant une période à laquelle le consommateur peut légitimement s'attendre, eu égard au type et à la\nfinalité des biens et éléments numériques et compte tenu des circonstances et de la nature du contrat, dans le\ncas d'une opération de fourniture unique du contenu numérique ou du service numérique ;\n2° Durant une période de deux ans à compter du moment où les biens comportant des éléments numériques\nont été délivrés, lorsque le contrat de vente prévoit la fourniture continue du contenu numérique ou du\nservice numérique pendant une certaine période ;\n3° Durant la période pendant laquelle le contenu numérique ou le service numérique est fourni en vertu du\ncontrat lorsque celui-ci en prévoit la fourniture continue pendant une durée supérieure à deux ans.\nII.-Lorsque le consommateur n'installe pas, dans un délai raisonnable, les mises à jour mentionnées au I,\nle vendeur n'est pas responsable des défauts de conformité résultant uniquement de la non-installation des\nmises à jour concernées, à condition que :\n1° Le vendeur ait informé le consommateur de la disponibilité des mises à jour et des conséquences de leur\nnon-installation par le consommateur ; et\n2° La non-installation ou l'installation incorrecte par le consommateur des mises à jour ne soit pas due à des\nlacunes dans les instructions d'installation fournies au consommateur."", ""Article L217-3\nLe vendeur délivre un bien conforme au contrat ainsi qu'aux critères énoncés à l'article L. 217-5.\nIl répond des défauts de conformité existant au moment de la délivrance du bien au sens de l'article L. 216-1,\nqui apparaissent dans un délai de deux ans à compter de celle-ci.\nDans le cas d'un contrat de vente d'un bien comportant des éléments numériques :\n1° Lorsque le contrat prévoit la fourniture continue d'un contenu numérique ou d'un service numérique\npendant une durée inférieure ou égale à deux ans, ou lorsque le contrat ne détermine pas la durée de\nfourniture, le vendeur répond des défauts de conformité de ce contenu numérique ou de ce service numérique\nqui apparaissent dans un délai de deux ans à compter de la délivrance du bien ;\n2° Lorsque le contrat prévoit la fourniture continue d'un contenu numérique ou d'un service numérique\npendant une durée supérieure à deux ans, le vendeur répond des défauts de conformité de ce contenu\nnumérique ou de ce service numérique qui apparaissent au cours de la période durant laquelle celui-ci est\nfourni en vertu du contrat.\nPour de tels biens, le délai applicable ne prive pas le consommateur de son droit aux mises à jour\nconformément aux dispositions de l'article L. 217-19.\nLe vendeur répond également, durant les mêmes délais, des défauts de conformité résultant de l'emballage,\ndes instructions de montage, ou de l'installation lorsque celle-ci a été mise à sa charge par le contrat ou a\nété réalisée sous sa responsabilité, ou encore lorsque l'installation incorrecte, effectuée par le consommateur\ncomme prévu au contrat, est due à des lacunes ou erreurs dans les instructions d'installation fournies par le\nvendeur.\nCe délai de garantie s'applique sans préjudice des articles 2224 et suivants du code civil. Le point de départ\nde la prescription de l'action du consommateur est le jour de la connaissance par ce dernier du défaut de\nconformité."", ""Article L217-20\nS'agissant des mises à jour qui ne sont pas nécessaires au maintien de la conformité du bien, le vendeur\nrespecte les conditions suivantes :\n1° Le contrat autorise le principe de telles mises à jour et en fournit une raison valable ;\n2° Le vendeur informe le consommateur, de manière claire et compréhensible, raisonnablement en avance et\nsur un support durable, de la mise à jour envisagée en lui précisant la date à laquelle elle intervient ;\n3° La mise à jour est effectuée sans coût supplémentaire pour le consommateur ;\n4° Le vendeur informe le consommateur que celui-ci est en droit de refuser la mise à jour ou, le cas échéant,\nde la désinstaller, si la mise à jour a une incidence négative sur son accès au contenu numérique ou au\nservice numérique ou à son utilisation de ceux-ci.\nDans ce dernier cas, la résolution du contrat est de droit et sans frais pour le consommateur, dans un\ndélai maximal de trente jours, à moins que la mise à jour n'ait qu'une incidence mineure pour lui. Le\nconsommateur ne peut toutefois résoudre le contrat si le vendeur lui a proposé de conserver le contenu\nnumérique ou le service numérique sans modification, y compris au moyen d'une désinstallation de la mise à\njour, et si ce dernier demeure en conformité dans les conditions prévues à la présente section.\nLorsque le consommateur exerce son droit à la résolution du contrat, les dispositions des articles L. 217-16 et\nL. 217-17 s'appliquent.\nLe présent article n'est pas applicable en cas d'offre groupée au sens de l'article L. 224-42-2.\n\nSection 3 : Garantie commerciale"", 'Article L217-17\nLe remboursement au consommateur des sommes dues par le vendeur au titre de la présente sous-section\nest effectué dès réception du bien ou de la preuve de son renvoi par le consommateur et au plus tard dans les\nquatorze jours suivants.\nLe vendeur rembourse ces sommes en recourant au même moyen de paiement que celui utilisé par le\nconsommateur lors de la conclusion du contrat, sauf accord exprès de ce dernier et en tout état de cause sans\nfrais supplémentaire.\nSous-section 3 : Mises à jour', ""Article L221-15\nLe professionnel est responsable de plein droit à l'égard du consommateur de la bonne exécution des\nobligations résultant du contrat conclu à distance, que ces obligations soient exécutées par le professionnel\nqui a conclu ce contrat ou par d'autres prestataires de services, sans préjudice de son droit de recours contre\nceux-ci.\nToutefois, il peut s'exonérer de tout ou partie de sa responsabilité en apportant la preuve que l'inexécution\nou la mauvaise exécution du contrat est imputable soit au consommateur, soit au fait, imprévisible et\ninsurmontable, d'un tiers au contrat, soit à un cas de force majeure.\nSection 5 : Démarchage téléphonique et prospection commerciale""]","Oui, le vendeur est toujours responsable en vertu de l'article L217-3 du Code de la consommation. Selon cet article, le vendeur est tenu de délivrer un bien conforme au contrat et répond des défauts de conformité existant au moment de la délivrance du bien et apparaissant dans un délai de deux ans à compter de celle-ci. Dans le cas d'un contrat de vente comportant des éléments numériques, le vendeur est responsable des défauts de conformité qui apparaissent pendant la période durant laquelle le contenu numérique est fourni en vertu du contrat.

Ainsi, même si le problème est survenu après 2 ans et demi, le vendeur reste responsable des défauts de conformité du logiciel. Vous pouvez donc demander au vendeur de prendre en charge la réparation ou le remplacement du logiciel défectueux, conformément à la législation en vigueur.","Oui, car pour une fourniture continue supérieure à deux ans, la garantie s'applique durant toute la période de fourniture (ici 3 ans).",0.4444444444444444,,0.99999999998,1.0
Quelles informations spécifiques au droit de rétractation l'article L. 221-5 impose-t-il de fournir ?,"[""Article L221-5\nI.-Préalablement à la conclusion d'un contrat de vente de biens ou de fourniture de services, de contenu\nnumérique ou de services numériques, le professionnel fournit au consommateur, de manière lisible et\ncompréhensible, les informations suivantes :\n1° Les caractéristiques essentielles du bien, du service, du service numérique ou du contenu numérique ;\n2° Le prix du bien, du service, du service numérique ou du contenu numérique, en application des articles L.\n112-1 à L. 112-4 ;\n3° La date à laquelle ou le délai dans lequel le professionnel s'engage à livrer le bien ou à fournir le service,\nle service numérique ou le contenu numérique ;\n4° Les informations relatives à son identité, à ses coordonnées postales, téléphoniques et électroniques, aux\nmodalités de résiliation, aux modes de règlement des litiges, aux autres conditions contractuelles et, le cas\néchéant, aux coûts de l'utilisation de la technique de communication à distance, à l'existence de codes de\nbonne conduite et aux cautions et garanties financières ;\n5° S'il y a lieu, les informations relatives aux garanties légales, aux fonctionnalités, à la compatibilité\net à l'interopérabilité du contenu numérique, du service numérique ou du bien comportant des éléments\nnumériques, aux autres conditions contractuelles et, le cas échéant, à l'existence de toute restriction\nd'installation de logiciel ;\n\n6° La possibilité de recourir à un médiateur de la consommation dans les conditions prévues au titre Ier du\nlivre VI ;\n7° Lorsque le droit de rétractation existe, les conditions, le délai et les modalités d'exercice de ce droit ainsi\nque le formulaire type de rétractation, dont les conditions de présentation et les mentions qu'il contient sont\nfixées par décret en Conseil d'Etat ;\n8° Le cas échéant, le fait que le consommateur supporte les frais de renvoi du bien en cas de rétractation\net, pour les contrats à distance, le coût de renvoi du bien lorsque celui-ci, en raison de sa nature, ne peut\nnormalement être renvoyé par la poste ;\n9° L'information sur l'obligation du consommateur de payer des frais lorsqu'il exerce son droit de rétractation\nd'un contrat de prestation de services, de distribution d'eau, de fourniture de gaz ou d'électricité et\nd'abonnement à un réseau de chauffage urbain dont il a demandé expressément l'exécution avant la fin du\ndélai de rétractation ; ces frais sont calculés selon les modalités fixées à l'article L. 221-25 ;\n10° Lorsque le droit de rétractation ne peut être exercé en application de l'article L. 221-28, l'information\nselon laquelle le consommateur ne bénéficie pas de ce droit ou, le cas échéant, les circonstances dans\nlesquelles il le perd ;\n11° L'application d'un prix personnalisé sur la base d'une prise de décision automatisée, s'il y a lieu.\nLa liste et le contenu de ces informations sont précisés par décret en Conseil d'Etat.\nDans le cas d'une vente aux enchères publiques telle que définie par le premier alinéa de l'article L. 321-3\ndu code de commerce, les informations relatives à l'identité et aux coordonnées postales, téléphoniques et\nélectroniques du professionnel prévues au 4° du I du présent article peuvent être remplacées par celles du\nmandataire.\nII.-Outre les informations prévues au I, tout professionnel, avant la conclusion d'un contrat de fourniture\nde services et, lorsqu'il n'y a pas de contrat, avant l'exécution de la prestation de services, fournit les\ninformations complémentaires prévues par l'article L. 111-2."", ""Article L221-12\nLorsque la technique de communication à distance utilisée impose des limites d'espace ou de temps pour la\nprésentation des informations, le professionnel fournit au consommateur par le moyen de communication\nutilisé par celui-ci, avant la conclusion du contrat et dans les conditions prévues à l'article L. 221-5, au\nmoins les informations relatives aux caractéristiques essentielles des biens ou des services, à leur prix, à son\nidentité, à la durée du contrat et au droit de rétractation.\nLe professionnel transmet au consommateur les autres informations prévues au même article par tout autre\nmoyen adapté à la technique de communication à distance utilisée."", ""Article L221-9\nLe professionnel fournit au consommateur un exemplaire daté du contrat conclu hors établissement, sur\npapier signé par les parties ou, avec l'accord du consommateur, sur un autre support durable, confirmant\nl'engagement exprès des parties.\nCe contrat comprend toutes les informations prévues à l'article L. 221-5.\nLe contrat mentionne, le cas échéant, l'accord exprès du consommateur pour la fourniture d'un contenu\nnumérique sans support matériel avant l'expiration du délai de rétractation et, dans cette hypothèse, le\nrenoncement de ce dernier à l'exercice de son droit de rétractation.\nLe contrat est accompagné du formulaire type de rétractation mentionné au 7° de l'article L. 221-5."", ""Article L221-11\nLorsque le contrat est conclu à distance, le professionnel fournit au consommateur, de manière lisible et\ncompréhensible, les informations prévues à l'article L. 221-5 ou les met à sa disposition par tout moyen\nadapté à la technique de communication à distance utilisée."", ""Article L221-20\nLorsque les informations relatives au droit de rétractation n'ont pas été fournies au consommateur dans les\nconditions prévues au 7° de l'article L. 221-5, le délai de rétractation est prolongé de douze mois à compter\nde l'expiration du délai de rétractation initial, déterminé conformément à l'article L. 221-18.\nToutefois, lorsque la fourniture de ces informations intervient pendant cette prolongation, le délai de\nrétractation expire au terme d'une période de quatorze jours à compter du jour où le consommateur a reçu ces\ninformations.""]","L'article L221-5 du Code de la consommation impose de fournir les informations suivantes spécifiques au droit de rétractation :
- Les conditions, le délai et les modalités d'exercice du droit de rétractation (7°) ;
- Le formulaire type de rétractation, dont les conditions de présentation et les mentions qu'il contient sont fixées par décret en Conseil d'Etat (7°) ;
- Le fait que le consommateur supporte les frais de renvoi du bien en cas de rétractation et, pour les contrats à distance, le coût de renvoi du bien lorsque celui-ci, en raison de sa nature, ne peut normalement être renvoyé par la poste (8°) ;
- L'information sur l'obligation du consommateur de payer des frais lorsqu'il exerce son droit de rétractation d'un contrat de prestation de services, de distribution d'eau, de fourniture de gaz ou d'électricité et d'abonnement à un réseau de chauffage urbain dont il a demandé expressément l'exécution avant la fin du délai de rétractation (9°) ;
- Lorsque le droit de rétractation ne peut être exercé en application de l'article L. 221-28, l'information selon laquelle le consommateur ne bénéficie pas de ce droit ou, le cas échéant, les circonstances dans lesquelles il le perd (10°).

Ces informations doivent être fournies de manière lisible et compréhensible avant la conclusion du contrat ou mises à disposition par tout moyen adapté à la technique de communication à distance utilisée (L221-11).","Le professionnel doit fournir les conditions, le délai, les modalités d'exercice du droit de rétractation, le formulaire type, et préciser qui supporte les frais de retour.",1.0,,0.999999999975,1.0
"Sur un site de vente en ligne, le vendeur doit-il obligatoirement m'indiquer qui paie les frais de retour en cas de rétractation ?","[""Article L221-24\nLorsque le droit de rétractation est exercé, le professionnel rembourse le consommateur de la totalité des\nsommes versées, y compris les frais de livraison, sans retard injustifié et au plus tard dans les quatorze jours\nà compter de la date à laquelle il est informé de la décision du consommateur de se rétracter.\nPour les contrats de vente de biens, à moins qu'il ne propose de récupérer lui-même les biens, le\nprofessionnel peut différer le remboursement jusqu'à récupération des biens ou jusqu'à ce que le\nconsommateur ait fourni une preuve de l'expédition de ces biens, la date retenue étant celle du premier de ces\nfaits.\nLe professionnel effectue ce remboursement en utilisant le même moyen de paiement que celui utilisé par\nle consommateur pour la transaction initiale, sauf accord exprès du consommateur pour qu'il utilise un autre\nmoyen de paiement et dans la mesure où le remboursement n'occasionne pas de frais pour le consommateur.\nLe professionnel n'est pas tenu de rembourser les frais supplémentaires si le consommateur a expressément\nchoisi un mode de livraison plus coûteux que le mode de livraison standard proposé par le professionnel."", ""Article L221-23\nLe consommateur renvoie ou restitue les biens au professionnel ou à une personne désignée par ce dernier,\nsans retard excessif et, au plus tard, dans les quatorze jours suivant la communication de sa décision de se\nrétracter conformément à l'article L. 221-21, à moins que le professionnel ne propose de récupérer lui-même\nces biens.\nLe consommateur ne supporte que les coûts directs de renvoi des biens, sauf si le professionnel accepte de\nles prendre à sa charge ou s'il a omis d'informer le consommateur que ces coûts sont à sa charge. Néanmoins,\npour les contrats conclus hors établissement, lorsque les biens sont livrés au domicile du consommateur au\nmoment de la conclusion du contrat, le professionnel récupère les biens à ses frais s'ils ne peuvent pas être\nrenvoyés normalement par voie postale en raison de leur nature.\nLa responsabilité du consommateur ne peut être engagée qu'en cas de dépréciation des biens résultant\nde manipulations autres que celles nécessaires pour établir la nature, les caractéristiques et le bon\nfonctionnement de ces biens, sous réserve que le professionnel ait informé le consommateur de son droit de\nrétractation, conformément au 7° de l'article L. 221-5."", 'Article L217-17\nLe remboursement au consommateur des sommes dues par le vendeur au titre de la présente sous-section\nest effectué dès réception du bien ou de la preuve de son renvoi par le consommateur et au plus tard dans les\nquatorze jours suivants.\nLe vendeur rembourse ces sommes en recourant au même moyen de paiement que celui utilisé par le\nconsommateur lors de la conclusion du contrat, sauf accord exprès de ce dernier et en tout état de cause sans\nfrais supplémentaire.\nSous-section 3 : Mises à jour', ""Article L222-15\nLe fournisseur rembourse au consommateur dans les meilleurs délais et au plus tard dans les trente jours\ntoutes les sommes qu'il a perçues de celui-ci en application du contrat, à l'exception du montant mentionné\nau premier alinéa de l'article L. 222-13. Ce délai commence à courir le jour où le fournisseur reçoit\nnotification par le consommateur de sa volonté de se rétracter.\nLe consommateur restitue au fournisseur dans les meilleurs délais et au plus tard dans les trente jours\ntoute somme et tout bien qu'il a reçus de ce dernier. Ce délai commence à courir à compter du jour où le\nconsommateur communique au fournisseur sa volonté de se rétracter.\nSection 5 : Dispositions particulières"", ""Article L222-12\nL'exercice du droit de rétractation emporte résolution de plein droit du contrat de vente ou de prestation de\nservices.\nSi le bien ou la prestation de services à financer ne sont pas vendus à distance et que le consommateur, par\nune demande expresse, sollicite la livraison ou la fourniture immédiate du bien ou du service, l'exercice du\ndroit de rétractation n'emporte résolution de plein droit du contrat de vente ou de prestation de services que\ns'il intervient dans un délai de trois jours à compter de la conclusion du contrat de crédit.\nToute livraison ou fourniture anticipée est à la charge du vendeur, qui en supporte tous les risques.""]","Oui, sur un site de vente en ligne, le vendeur doit obligatoirement vous indiquer qui paie les frais de retour en cas de rétractation. Selon l'article L221-23 du Code de la consommation, le consommateur ne supporte que les coûts directs de renvoi des biens, sauf si le professionnel accepte de les prendre à sa charge ou s'il a omis d'informer le consommateur que ces coûts sont à sa charge. Ainsi, le vendeur doit vous informer clairement de qui supporte les frais de retour en cas de rétractation.","Oui, c'est une information précontractuelle obligatoire.",0.6,,0.99999999998,0.0
J'ai renvoyé un colis volumineux (50kg) en utilisant mon droit de rétractation. Le vendeur me facture 100€ de frais de retour. Il n'avait mentionné nulle part que ces frais seraient à ma charge. Dois-je payer ?,"['Article L217-17\nLe remboursement au consommateur des sommes dues par le vendeur au titre de la présente sous-section\nest effectué dès réception du bien ou de la preuve de son renvoi par le consommateur et au plus tard dans les\nquatorze jours suivants.\nLe vendeur rembourse ces sommes en recourant au même moyen de paiement que celui utilisé par le\nconsommateur lors de la conclusion du contrat, sauf accord exprès de ce dernier et en tout état de cause sans\nfrais supplémentaire.\nSous-section 3 : Mises à jour', ""Article L221-24\nLorsque le droit de rétractation est exercé, le professionnel rembourse le consommateur de la totalité des\nsommes versées, y compris les frais de livraison, sans retard injustifié et au plus tard dans les quatorze jours\nà compter de la date à laquelle il est informé de la décision du consommateur de se rétracter.\nPour les contrats de vente de biens, à moins qu'il ne propose de récupérer lui-même les biens, le\nprofessionnel peut différer le remboursement jusqu'à récupération des biens ou jusqu'à ce que le\nconsommateur ait fourni une preuve de l'expédition de ces biens, la date retenue étant celle du premier de ces\nfaits.\nLe professionnel effectue ce remboursement en utilisant le même moyen de paiement que celui utilisé par\nle consommateur pour la transaction initiale, sauf accord exprès du consommateur pour qu'il utilise un autre\nmoyen de paiement et dans la mesure où le remboursement n'occasionne pas de frais pour le consommateur.\nLe professionnel n'est pas tenu de rembourser les frais supplémentaires si le consommateur a expressément\nchoisi un mode de livraison plus coûteux que le mode de livraison standard proposé par le professionnel."", ""Article L222-12\nL'exercice du droit de rétractation emporte résolution de plein droit du contrat de vente ou de prestation de\nservices.\nSi le bien ou la prestation de services à financer ne sont pas vendus à distance et que le consommateur, par\nune demande expresse, sollicite la livraison ou la fourniture immédiate du bien ou du service, l'exercice du\ndroit de rétractation n'emporte résolution de plein droit du contrat de vente ou de prestation de services que\ns'il intervient dans un délai de trois jours à compter de la conclusion du contrat de crédit.\nToute livraison ou fourniture anticipée est à la charge du vendeur, qui en supporte tous les risques."", ""Article L221-5\nI.-Préalablement à la conclusion d'un contrat de vente de biens ou de fourniture de services, de contenu\nnumérique ou de services numériques, le professionnel fournit au consommateur, de manière lisible et\ncompréhensible, les informations suivantes :\n1° Les caractéristiques essentielles du bien, du service, du service numérique ou du contenu numérique ;\n2° Le prix du bien, du service, du service numérique ou du contenu numérique, en application des articles L.\n112-1 à L. 112-4 ;\n3° La date à laquelle ou le délai dans lequel le professionnel s'engage à livrer le bien ou à fournir le service,\nle service numérique ou le contenu numérique ;\n4° Les informations relatives à son identité, à ses coordonnées postales, téléphoniques et électroniques, aux\nmodalités de résiliation, aux modes de règlement des litiges, aux autres conditions contractuelles et, le cas\néchéant, aux coûts de l'utilisation de la technique de communication à distance, à l'existence de codes de\nbonne conduite et aux cautions et garanties financières ;\n5° S'il y a lieu, les informations relatives aux garanties légales, aux fonctionnalités, à la compatibilité\net à l'interopérabilité du contenu numérique, du service numérique ou du bien comportant des éléments\nnumériques, aux autres conditions contractuelles et, le cas échéant, à l'existence de toute restriction\nd'installation de logiciel ;\n\n6° La possibilité de recourir à un médiateur de la consommation dans les conditions prévues au titre Ier du\nlivre VI ;\n7° Lorsque le droit de rétractation existe, les conditions, le délai et les modalités d'exercice de ce droit ainsi\nque le formulaire type de rétractation, dont les conditions de présentation et les mentions qu'il contient sont\nfixées par décret en Conseil d'Etat ;\n8° Le cas échéant, le fait que le consommateur supporte les frais de renvoi du bien en cas de rétractation\net, pour les contrats à distance, le coût de renvoi du bien lorsque celui-ci, en raison de sa nature, ne peut\nnormalement être renvoyé par la poste ;\n9° L'information sur l'obligation du consommateur de payer des frais lorsqu'il exerce son droit de rétractation\nd'un contrat de prestation de services, de distribution d'eau, de fourniture de gaz ou d'électricité et\nd'abonnement à un réseau de chauffage urbain dont il a demandé expressément l'exécution avant la fin du\ndélai de rétractation ; ces frais sont calculés selon les modalités fixées à l'article L. 221-25 ;\n10° Lorsque le droit de rétractation ne peut être exercé en application de l'article L. 221-28, l'information\nselon laquelle le consommateur ne bénéficie pas de ce droit ou, le cas échéant, les circonstances dans\nlesquelles il le perd ;\n11° L'application d'un prix personnalisé sur la base d'une prise de décision automatisée, s'il y a lieu.\nLa liste et le contenu de ces informations sont précisés par décret en Conseil d'Etat.\nDans le cas d'une vente aux enchères publiques telle que définie par le premier alinéa de l'article L. 321-3\ndu code de commerce, les informations relatives à l'identité et aux coordonnées postales, téléphoniques et\nélectroniques du professionnel prévues au 4° du I du présent article peuvent être remplacées par celles du\nmandataire.\nII.-Outre les informations prévues au I, tout professionnel, avant la conclusion d'un contrat de fourniture\nde services et, lorsqu'il n'y a pas de contrat, avant l'exécution de la prestation de services, fournit les\ninformations complémentaires prévues par l'article L. 111-2."", ""Article L221-6\nSi le professionnel n'a pas respecté ses obligations d'information concernant les frais supplémentaires\nmentionnés à l'article L. 112-3 et au 8° de l'article L. 221-5, le consommateur n'est pas tenu au paiement de\nces frais.""]","Selon l'article L221-6 du Code de la consommation, si le professionnel n'a pas informé le consommateur des frais supplémentaires de retour, le consommateur n'est pas tenu de les payer. Dans votre cas, le vendeur ne vous a pas informé que les frais de retour de votre colis volumineux seraient à votre charge. Par conséquent, vous n'êtes pas tenu de payer les 100€ de frais de retour demandés par le vendeur.","Non, si le vendeur n'a pas informé le consommateur que les frais de retour étaient à sa charge, ces frais sont supportés par le vendeur.",0.3333333333333333,,0.99999999998,1.0
Que dit l'article L. 221-10-1 concernant les visites non sollicitées d'un professionnel à domicile ?,"[""Article L221-10\nLe professionnel ne peut recevoir aucun paiement ou aucune contrepartie, sous quelque forme que ce soit, de\nla part du consommateur avant l'expiration d'un délai de sept jours à compter de la conclusion du contrat hors\nétablissement.\nToutefois, ne sont pas soumis aux dispositions du premier alinéa :\n1° La souscription à domicile d'un abonnement à une publication quotidienne et assimilée, au sens de l'article\n39 bis du code général des impôts ;\n2° Les contrats à exécution successive, conclus dans les conditions prévues au présent chapitre et proposés\npar un organisme agréé ou relevant d'une décision de l'autorité administrative, ayant pour objet la fourniture\nde services mentionnés à l'article L. 7231-1 du code du travail ;\n3° Les contrats conclus au cours de réunions organisées par le vendeur à son domicile ou au domicile d'un\nconsommateur ayant préalablement et expressément accepté que cette opération se déroule à son domicile ;\n4° Les contrats ayant pour objet des travaux d'entretien ou de réparation à réaliser en urgence au domicile du\nconsommateur et expressément sollicités par lui, dans la limite des pièces de rechange et travaux strictement\nnécessaires pour répondre à l'urgence.\nPour les contrats mentionnés aux 1° et 2°, le consommateur dispose d'un droit de résiliation du contrat à tout\nmoment et sans préavis, frais ou indemnité et d'un droit au remboursement, dans un délai de quinze jours,\ndes sommes versées au prorata de la durée du contrat restant à courir."", ""Article L221-10-1\n\nEst interdite toute visite non sollicitée d'un professionnel au domicile d'un consommateur en vue de vendre\ndes produits ou de fournir des services lorsque le consommateur a manifesté de manière claire et non\nambiguë ne pas vouloir faire l'objet d'une telle visite.\nSection 4 : Dispositions particulières applicables aux contrats conclus\nà distance"", ""Article L221-1\nI. - Pour l'application du présent titre, sont considérés comme :\n1° Contrat à distance : tout contrat conclu entre un professionnel et un consommateur, dans le cadre d'un\nsystème organisé de vente ou de prestation de services à distance, sans la présence physique simultanée du\nprofessionnel et du consommateur, par le recours exclusif à une ou plusieurs techniques de communication à\ndistance jusqu'à la conclusion du contrat ;\n2° Contrat hors établissement : tout contrat conclu entre un professionnel et un consommateur :\na) Dans un lieu qui n'est pas celui où le professionnel exerce son activité en permanence ou de manière\nhabituelle, en la présence physique simultanée des parties, y compris à la suite d'une sollicitation ou d'une\noffre faite par le consommateur ;\nb) Ou dans le lieu où le professionnel exerce son activité en permanence ou de manière habituelle ou au\nmoyen d'une technique de communication à distance, immédiatement après que le consommateur a été\nsollicité personnellement et individuellement dans un lieu différent de celui où le professionnel exerce en\n\npermanence ou de manière habituelle son activité et où les parties étaient, physiquement et simultanément,\nprésentes ;\nc) Ou pendant une excursion organisée par le professionnel ayant pour but ou pour effet de promouvoir et de\nvendre des biens ou des services au consommateur.\nII. - Les dispositions du présent titre s'appliquent aux contrats portant sur la vente d'un ou plusieurs biens, au\nsens de l'article 528 du code civil, et au contrat en vertu duquel le professionnel fournit ou s'engage à fournir\nun service au consommateur en contrepartie duquel le consommateur en paie ou s'engage à en payer le prix.\nLe contrat ayant pour objet à la fois le transfert de propriété d'un bien et la fourniture d'une prestation de\nservices, y compris la prestation de livraison de biens, est assimilée à un contrat de vente.\nIII. - Les dispositions du présent titre s'appliquent également aux contrats par lesquels le professionnel\nfournit ou s'engage à fournir au consommateur un contenu numérique sans support matériel ou un service\nnumérique et pour lesquels le consommateur lui fournit ou s'engage à lui fournir des données à caractère\npersonnel, sauf lorsque ces données sont exclusivement traitées par lui pour fournir le contenu numérique\nsans support matériel ou le service numérique, ou lui permettre de remplir les obligations légales qui lui\nincombent."", ""Article L221-2\nSont exclus du champ d'application du présent chapitre :\n1° Les contrats portant sur les services sociaux, y compris le logement social, l'aide à l'enfance et aux\nfamilles, à l'exception des services à la personne mentionnés à l'article L. 7231-1 du code du travail ;\n2° Les contrats portant sur les services de santé fournis par des professionnels de la santé aux patients pour\névaluer, maintenir ou rétablir leur état de santé, y compris la prescription, la délivrance et la fourniture de\nmédicaments et de dispositifs médicaux ;\n3° Les contrats portant sur les jeux d'argent et hasard mentionnés à l'article L. 320-6 du code de la sécurité\nintérieure et les transactions portant sur des paris ;\n4° Les contrats portant sur les services financiers ;\n5° Les contrats portant sur un forfait touristique, au sens de l'article L. 211-2 du code du tourisme ;\n6° Les contrats portant sur les contrats d'utilisation de biens à temps partagé, les contrats de produits de\nvacances à long terme et les contrats de revente et d'échange mentionnés aux articles L. 224-69 et L. 224-70 ;\n7° Les contrats rédigés par un officier public ;\n8° Les contrats portant sur la fourniture de denrées alimentaires, de boissons ou d'autres biens ménagers de\nconsommation courante, qui sont livrés physiquement par un professionnel lors de tournées fréquentes et\nrégulières au domicile ou au lieu de résidence ou de travail du consommateur ;\n9° Les contrats portant sur les services de transport de passagers, à l'exception des dispositions prévues à\nl'article L. 221-14 ;\n10° Les contrats conclus au moyen de distributeurs automatiques ou de sites commerciaux automatisés ;\n11° Les contrats conclus avec des opérateurs de télécommunications pour l'utilisation des cabines\ntéléphoniques publiques ou conclus aux fins d'une connexion unique par téléphone, internet ou télécopie,\nnotamment les services et produits à valeur ajoutée accessibles par voie téléphonique ou par message\ntextuel ;\n\n12° Les contrats portant sur la création, l'acquisition ou le transfert de biens immobiliers ou de droits sur des\nbiens immobiliers, la construction d'immeubles neufs, la transformation importante d'immeubles existants ou\nla location d'un logement à des fins résidentielles ;\n13° Les contrats portant sur des biens vendus sur saisie ou de quelque autre manière par autorité de justice."", 'Article L215-3\nLes dispositions du présent chapitre sont également applicables aux contrats conclus entre des professionnels\net des non-professionnels.']",L'article L221-10-1 interdit toute visite non sollicitée d'un professionnel au domicile d'un consommateur en vue de vendre des produits ou de fournir des services lorsque le consommateur a manifesté de manière claire et non ambiguë ne pas vouloir faire l'objet d'une telle visite.,Est interdite toute visite non sollicitée au domicile d'un consommateur lorsque celui-ci a manifesté de manière claire et non ambiguë ne pas vouloir en faire l'objet.,1.0,,0.49999999995,1.0
Un vendeur a-t-il le droit de venir sonner chez moi pour me vendre des fenêtres si j'ai clairement affiché ou dit que je ne voulais pas de démarchage ?,"[""Article L221-10-1\n\nEst interdite toute visite non sollicitée d'un professionnel au domicile d'un consommateur en vue de vendre\ndes produits ou de fournir des services lorsque le consommateur a manifesté de manière claire et non\nambiguë ne pas vouloir faire l'objet d'une telle visite.\nSection 4 : Dispositions particulières applicables aux contrats conclus\nà distance"", ""Article L217-27\nLes dispositions de la présente section sont également applicables au producteur et aux professionnels, autres\nque le vendeur, lorsqu'ils proposent des prestations de services après-vente.\n\nSection 5 : Dispositions diverses"", ""Article L217-14\nLe consommateur a droit à une réduction du prix du bien ou à la résolution du contrat dans les cas suivants :\n1° Lorsque le professionnel refuse toute mise en conformité ;\n2° Lorsque la mise en conformité intervient au-delà d'un délai de trente jours suivant la demande du\nconsommateur ou si elle lui occasionne un inconvénient majeur ;\n3° Si le consommateur supporte définitivement les frais de reprise ou d'enlèvement du bien non conforme, ou\ns'il supporte l'installation du bien réparé ou de remplacement ou les frais y afférents ;\n4° Lorsque la non-conformité du bien persiste en dépit de la tentative de mise en conformité du vendeur\nrestée infructueuse.\nLe consommateur a également droit à une réduction du prix du bien ou à la résolution du contrat lorsque\nle défaut de conformité est si grave qu'il justifie que la réduction du prix ou la résolution du contrat soit\nimmédiate. Le consommateur n'est alors pas tenu de demander la réparation ou le remplacement du bien au\npréalable.\n\nLe consommateur n'a pas droit à la résolution de la vente si le défaut de conformité est mineur, ce qu'il\nincombe au vendeur de démontrer. Le présent alinéa n'est pas applicable aux contrats dans lesquels le\nconsommateur ne procède pas au paiement d'un prix."", ""Article L217-31\nUne action récursoire peut être exercée par le vendeur à l'encontre de toute personne en amont dans la chaîne\nde transactions commerciales, y compris le producteur, conformément aux dispositions du code civil."", ""Article L221-16\nSans préjudice des dispositions de l'article L. 221-12, le professionnel qui contacte un consommateur par\ntéléphone en vue de conclure un contrat portant sur la vente d'un bien ou sur la fourniture d'un service\nindique au début de la conversation, de manière claire, précise et compréhensible, son identité, le cas\néchéant l'identité de la personne pour le compte de laquelle il effectue cet appel et la nature commerciale\nde celui-ci. Le professionnel indique également au consommateur qu'il peut s'inscrire gratuitement sur la\nliste d'opposition au démarchage téléphonique prévue à l'article L. 223-1 s'il ne souhaite pas faire l'objet de\nprospection commerciale par cette voie.\nA la suite d'un démarchage par téléphone, le professionnel adresse au consommateur, sur papier ou sur\nsupport durable, une confirmation de l'offre qu'il a faite et reprenant toutes les informations prévues à l'article\nL. 221-5.\nLe consommateur n'est engagé par cette offre qu'après l'avoir signée et acceptée sur support durable.""]","Selon l'article L221-10-1, toute visite non sollicitée d'un professionnel au domicile d'un consommateur en vue de vendre des produits ou de fournir des services est interdite lorsque le consommateur a manifesté de manière claire et non ambiguë ne pas vouloir faire l'objet d'une telle visite. Ainsi, si vous avez clairement affiché ou dit que vous ne souhaitez pas de démarchage, le vendeur n'a pas le droit de venir sonner chez vous pour vous vendre des fenêtres.","Non, c'est illégal si vous avez manifesté votre opposition.",0.75,,0.699999999965,1.0
"Un commercial s'est présenté à ma porte pour me vendre une assurance alors que j'avais un autocollant ""Stop Démarchage"" bien visible. Il a insisté pour entrer. Cette pratique est-elle légale ?","[""Article L217-28\nLorsque le consommateur demande au garant, pendant le cours de la garantie légale ou de la garantie\ncommerciale qui lui a été consentie lors de l'acquisition ou de la réparation d'un bien, une remise en état\ncouverte par cette garantie, toute période d'immobilisation suspend la garantie qui restait à courir jusqu'à la\ndélivrance du bien remis en état.\nCette période court à compter de la demande d'intervention du consommateur ou de la mise à disposition\npour réparation ou remplacement du bien en cause, si ce point de départ s'avère plus favorable au\nconsommateur.\nLe délai de garantie est également suspendu lorsque le consommateur et le garant entrent en négociation en\nvue d'un règlement à l'amiable."", ""Article L216-5\nLe professionnel indique par écrit au consommateur lors de son achat, s'il y a lieu, le coût de la livraison\net de mise en service du bien. Un écrit est laissé au consommateur lors de l'entrée en possession du bien,\nmentionnant la possibilité pour le consommateur de formuler des réserves, notamment en cas de défaut du\nbien ou de défaut de remise de la notice d'emploi ou des instructions d'installation.\nL'absence de réserves formulées par le consommateur lors de la réception du bien n'exonère pas le\nprofessionnel de la garantie de conformité du bien qu'il doit au consommateur."", ""Article L221-10-1\n\nEst interdite toute visite non sollicitée d'un professionnel au domicile d'un consommateur en vue de vendre\ndes produits ou de fournir des services lorsque le consommateur a manifesté de manière claire et non\nambiguë ne pas vouloir faire l'objet d'une telle visite.\nSection 4 : Dispositions particulières applicables aux contrats conclus\nà distance"", ""Article L217-25\nLa prestation de service après-vente au sens du présent chapitre s'entend de tout service afférent au bien\nvendu exécuté par le vendeur ne relevant pas de la garantie légale et n'étant pas prévu par une garantie\ncommerciale. Elle fait l'objet d'un contrat dont un exemplaire est remis au consommateur."", ""Article L217-31\nUne action récursoire peut être exercée par le vendeur à l'encontre de toute personne en amont dans la chaîne\nde transactions commerciales, y compris le producteur, conformément aux dispositions du code civil.""]","Selon l'article L221-10-1 du Code de la consommation, toute visite non sollicitée d'un professionnel au domicile d'un consommateur en vue de vendre des produits ou de fournir des services est interdite lorsque le consommateur a manifesté de manière claire et non ambiguë ne pas vouloir faire l'objet d'une telle visite. Dans votre cas, en ayant un autocollant ""Stop Démarchage"" bien visible, vous avez clairement indiqué votre refus de ce type de visite. Par conséquent, la pratique du commercial qui s'est présenté à votre porte pour vous vendre une assurance alors que vous aviez clairement indiqué votre refus est illégale.","Non, cette pratique est interdite car vous avez manifesté votre refus de manière claire via l'autocollant.",0.5,,0.3333333333,1.0
Comment l'article L. 121-6 définit-il une pratique commerciale agressive ?,"[""Article L221-10-1\n\nEst interdite toute visite non sollicitée d'un professionnel au domicile d'un consommateur en vue de vendre\ndes produits ou de fournir des services lorsque le consommateur a manifesté de manière claire et non\nambiguë ne pas vouloir faire l'objet d'une telle visite.\nSection 4 : Dispositions particulières applicables aux contrats conclus\nà distance"", ""Article L221-3\nLes dispositions des sections 2, 3, 6 du présent chapitre applicables aux relations entre consommateurs et\nprofessionnels, sont étendues aux contrats conclus hors établissement entre deux professionnels dès lors que\nl'objet de ces contrats n'entre pas dans le champ de l'activité principale du professionnel sollicité et que le\nnombre de salariés employés par celui-ci est inférieur ou égal à cinq."", ""Article L211-1\nLes clauses des contrats proposés par les professionnels aux consommateurs doivent être présentées et\nrédigées de façon claire et compréhensible.\nElles s'interprètent en cas de doute dans le sens le plus favorable au consommateur. Les dispositions du\nprésent alinéa ne sont toutefois pas applicables aux procédures engagées sur le fondement de l'article L.\n621-8.\nUn décret en Conseil d'Etat précise, en vue d'assurer l'information du consommateur, les modalités de\nprésentation des contrats mentionnés au premier alinéa."", 'Article L211-3\nLors de la conclusion de tout contrat écrit, le consommateur est informé par le professionnel de la possibilité\nde recourir, en cas de contestation, à la procédure de médiation de la consommation dans les conditions\nprévues au titre Ier du livre VI.', ""Article L217-31\nUne action récursoire peut être exercée par le vendeur à l'encontre de toute personne en amont dans la chaîne\nde transactions commerciales, y compris le producteur, conformément aux dispositions du code civil.""]","L'article L221-10-1 ne définit pas directement une pratique commerciale agressive. Cependant, une pratique commerciale agressive peut être définie comme toute action d'un professionnel vis-à-vis d'un consommateur qui, selon l'article L221-3, est interdite si le consommateur a clairement exprimé son refus de recevoir une telle visite non sollicitée à domicile en vue de vendre des produits ou fournir des services. Une telle pratique est contraire à la protection du consommateur telle que prévue par la loi.",Une pratique est agressive si elle altère la liberté de choix du consommateur par des sollicitations répétées et insistantes ou l'usage d'une contrainte physique ou morale.,0.8,,0.0,0.0
"Si un vendeur me met la pression, me menace ou refuse de quitter ma maison tant que je n'ai pas signé, est-ce une pratique agressive ?","[""Article L217-31\nUne action récursoire peut être exercée par le vendeur à l'encontre de toute personne en amont dans la chaîne\nde transactions commerciales, y compris le producteur, conformément aux dispositions du code civil."", ""Article L217-12\nLe vendeur peut ne pas procéder selon le choix opéré par le consommateur si la mise en conformité sollicitée\nest impossible ou entraîne des coûts disproportionnés au regard notamment :\n1° De la valeur qu'aurait le bien en l'absence de défaut de conformité ;\n2° De l'importance du défaut de conformité ; et\n3° De la possibilité éventuelle d'opter pour l'autre choix sans inconvénient majeur pour le consommateur.\nLe vendeur peut refuser la mise en conformité du bien si celle-ci est impossible ou entraîne des coûts\ndisproportionnés notamment au regard des 1° et 2°.\nLorsque ces conditions ne sont pas respectées, le consommateur peut, après mise en demeure, poursuivre\nl'exécution forcée en nature de la solution initialement sollicitée, conformément aux articles 1221 et suivants\ndu code civil.\nTout refus par le vendeur de procéder selon le choix du consommateur ou de mettre le bien en conformité,\nest motivé par écrit ou sur support durable."", ""Article L221-10-1\n\nEst interdite toute visite non sollicitée d'un professionnel au domicile d'un consommateur en vue de vendre\ndes produits ou de fournir des services lorsque le consommateur a manifesté de manière claire et non\nambiguë ne pas vouloir faire l'objet d'une telle visite.\nSection 4 : Dispositions particulières applicables aux contrats conclus\nà distance"", ""Article L217-14\nLe consommateur a droit à une réduction du prix du bien ou à la résolution du contrat dans les cas suivants :\n1° Lorsque le professionnel refuse toute mise en conformité ;\n2° Lorsque la mise en conformité intervient au-delà d'un délai de trente jours suivant la demande du\nconsommateur ou si elle lui occasionne un inconvénient majeur ;\n3° Si le consommateur supporte définitivement les frais de reprise ou d'enlèvement du bien non conforme, ou\ns'il supporte l'installation du bien réparé ou de remplacement ou les frais y afférents ;\n4° Lorsque la non-conformité du bien persiste en dépit de la tentative de mise en conformité du vendeur\nrestée infructueuse.\nLe consommateur a également droit à une réduction du prix du bien ou à la résolution du contrat lorsque\nle défaut de conformité est si grave qu'il justifie que la réduction du prix ou la résolution du contrat soit\nimmédiate. Le consommateur n'est alors pas tenu de demander la réparation ou le remplacement du bien au\npréalable.\n\nLe consommateur n'a pas droit à la résolution de la vente si le défaut de conformité est mineur, ce qu'il\nincombe au vendeur de démontrer. Le présent alinéa n'est pas applicable aux contrats dans lesquels le\nconsommateur ne procède pas au paiement d'un prix."", ""Article L217-27\nLes dispositions de la présente section sont également applicables au producteur et aux professionnels, autres\nque le vendeur, lorsqu'ils proposent des prestations de services après-vente.\n\nSection 5 : Dispositions diverses""]","Selon l'article L221-10-1 du Code de la consommation, il est interdit à un professionnel de faire une visite non sollicitée au domicile d'un consommateur en vue de vendre des produits ou de fournir des services lorsque le consommateur a clairement exprimé son refus. Ainsi, si un vendeur vous met la pression, vous menace ou refuse de quitter votre maison tant que vous n'avez pas signé, cela constitue une pratique agressive et est interdit par la loi. Vous avez le droit de refuser et de demander au vendeur de quitter votre domicile. Si le vendeur persiste dans cette attitude, vous pouvez signaler cette pratique aux autorités compétentes.","Oui, l'usage de la contrainte ou le harcèlement pour forcer la signature constitue une pratique commerciale agressive.",0.42857142857142855,,0.4166666666458333,0.0
Une personne âgée a signé pour 5000€ de travaux après qu'un vendeur soit resté chez elle pendant 4 heures en insistant lourdement et en refusant de partir. Peut-on faire annuler le contrat pour pratique agressive ?,"[""Article L221-10\nLe professionnel ne peut recevoir aucun paiement ou aucune contrepartie, sous quelque forme que ce soit, de\nla part du consommateur avant l'expiration d'un délai de sept jours à compter de la conclusion du contrat hors\nétablissement.\nToutefois, ne sont pas soumis aux dispositions du premier alinéa :\n1° La souscription à domicile d'un abonnement à une publication quotidienne et assimilée, au sens de l'article\n39 bis du code général des impôts ;\n2° Les contrats à exécution successive, conclus dans les conditions prévues au présent chapitre et proposés\npar un organisme agréé ou relevant d'une décision de l'autorité administrative, ayant pour objet la fourniture\nde services mentionnés à l'article L. 7231-1 du code du travail ;\n3° Les contrats conclus au cours de réunions organisées par le vendeur à son domicile ou au domicile d'un\nconsommateur ayant préalablement et expressément accepté que cette opération se déroule à son domicile ;\n4° Les contrats ayant pour objet des travaux d'entretien ou de réparation à réaliser en urgence au domicile du\nconsommateur et expressément sollicités par lui, dans la limite des pièces de rechange et travaux strictement\nnécessaires pour répondre à l'urgence.\nPour les contrats mentionnés aux 1° et 2°, le consommateur dispose d'un droit de résiliation du contrat à tout\nmoment et sans préavis, frais ou indemnité et d'un droit au remboursement, dans un délai de quinze jours,\ndes sommes versées au prorata de la durée du contrat restant à courir."", 'Article L217-32\nLes dispositions du présent chapitre sont également applicables aux contrats conclus entre un vendeur\nprofessionnel et un acheteur non-professionnel.\nChapitre VIII : Prescription', ""Article L217-20\nS'agissant des mises à jour qui ne sont pas nécessaires au maintien de la conformité du bien, le vendeur\nrespecte les conditions suivantes :\n1° Le contrat autorise le principe de telles mises à jour et en fournit une raison valable ;\n2° Le vendeur informe le consommateur, de manière claire et compréhensible, raisonnablement en avance et\nsur un support durable, de la mise à jour envisagée en lui précisant la date à laquelle elle intervient ;\n3° La mise à jour est effectuée sans coût supplémentaire pour le consommateur ;\n4° Le vendeur informe le consommateur que celui-ci est en droit de refuser la mise à jour ou, le cas échéant,\nde la désinstaller, si la mise à jour a une incidence négative sur son accès au contenu numérique ou au\nservice numérique ou à son utilisation de ceux-ci.\nDans ce dernier cas, la résolution du contrat est de droit et sans frais pour le consommateur, dans un\ndélai maximal de trente jours, à moins que la mise à jour n'ait qu'une incidence mineure pour lui. Le\nconsommateur ne peut toutefois résoudre le contrat si le vendeur lui a proposé de conserver le contenu\nnumérique ou le service numérique sans modification, y compris au moyen d'une désinstallation de la mise à\njour, et si ce dernier demeure en conformité dans les conditions prévues à la présente section.\nLorsque le consommateur exerce son droit à la résolution du contrat, les dispositions des articles L. 217-16 et\nL. 217-17 s'appliquent.\nLe présent article n'est pas applicable en cas d'offre groupée au sens de l'article L. 224-42-2.\n\nSection 3 : Garantie commerciale"", ""Article L221-10-1\n\nEst interdite toute visite non sollicitée d'un professionnel au domicile d'un consommateur en vue de vendre\ndes produits ou de fournir des services lorsque le consommateur a manifesté de manière claire et non\nambiguë ne pas vouloir faire l'objet d'une telle visite.\nSection 4 : Dispositions particulières applicables aux contrats conclus\nà distance"", ""Article L216-6\nI.-En cas de manquement du professionnel à son obligation de délivrance du bien ou de fourniture du service\ndans les conditions prévues à l'article L. 216-1, le consommateur peut :\n1° Notifier au professionnel la suspension du paiement de tout ou partie du prix jusqu'à ce que le\nprofessionnel s'exécute, dans les conditions des articles 1219 et 1220 du code civil ;\n2° Résoudre le contrat si, après avoir mis en demeure le professionnel d'effectuer la délivrance ou de fournir\nle service dans un délai supplémentaire raisonnable, ce dernier ne s'est pas exécuté dans ce délai.\nLe contrat est considéré comme résolu à la réception par le professionnel de la lettre ou de l'écrit l'informant\nde cette résolution, à moins que le professionnel ne se soit exécuté entre-temps.\nII.-Le consommateur peut toutefois immédiatement résoudre le contrat :\n1° Lorsque le professionnel refuse de délivrer le bien ou de fournir le service ou lorsqu'il est manifeste qu'il\nne livrera pas le bien ou ne fournira pas le service ;\n2° Lorsque le professionnel n'exécute pas son obligation de délivrance du bien ou de fourniture du service\nà la date ou à l'expiration du délai prévu à l'article L. 216-1 et que cette date ou ce délai constitue pour le\nconsommateur une condition essentielle du contrat. Cette condition essentielle résulte des circonstances\nqui entourent la conclusion du contrat ou d'une demande expresse du consommateur avant la conclusion du\ncontrat.\nLes dispositions du présent article sont sans préjudice de l'allocation de dommages et intérêts.""]","Selon les articles fournis, il est interdit de faire une visite non sollicitée au domicile d'un consommateur en vue de vendre des produits ou de fournir des services lorsque le consommateur a clairement exprimé son refus (Article L221-10-1). Dans le cas où un vendeur reste chez une personne âgée pendant 4 heures en insistant lourdement et en refusant de partir, cela peut être considéré comme une pratique agressive.

En vertu de l'article L216-6, le consommateur peut résoudre le contrat immédiatement lorsque le professionnel refuse de délivrer le bien ou de fournir le service, ou lorsqu'il est manifeste qu'il ne le fera pas. De plus, le consommateur peut résoudre le contrat immédiatement si le professionnel n'exécute pas son obligation de délivrance du bien ou de fourniture du service à la date prévue et que cette date constitue une condition essentielle du contrat pour le consommateur.

Dans ce cas, la personne âgée pourrait donc résoudre le contrat immédiatement en raison de la pratique agressive du vendeur. Il est recommandé de notifier au professionnel par écrit la résolution du contrat et de demander le remboursement des sommes versées.","Oui, le contrat est nul car le consentement a été vicié par des sollicitations insistantes et une contrainte morale caractérisant une pratique agressive.",0.6,,0.6999999999766667,1.0
Quel est le délai raisonnable mentionné à l'article L. 217-10 pour la mise en conformité du bien ?,"[""Article L217-10\nLa mise en conformité du bien a lieu dans un délai raisonnable qui ne peut être supérieur à trente jours\nsuivant la demande du consommateur et sans inconvénient majeur pour lui, compte tenu de la nature du bien\net de l'usage recherché par le consommateur.\nLa réparation ou le remplacement du bien non conforme inclut, s'il y a lieu, l'enlèvement et la reprise de ce\nbien et l'installation du bien réparé ou du bien de remplacement par le vendeur.\nUn décret précise les modalités de la mise en conformité du bien."", ""Article L217-13\nTout bien réparé dans le cadre de la garantie légale de conformité bénéficie d'une extension de cette garantie\nde six mois.\nDès lors que le consommateur fait le choix de la réparation mais que celle-ci n'est pas mise en œuvre par\nle vendeur, la mise en conformité par le remplacement du bien fait courir, au bénéfice du consommateur,\nun nouveau délai de garantie légale de conformité attaché au bien remplacé. Cette disposition s'applique à\ncompter du jour où le bien de remplacement est délivré au consommateur."", ""Article L217-7\nLes défauts de conformité qui apparaissent dans un délai de vingt-quatre mois à compter de la délivrance du\nbien, y compris du bien comportant des éléments numériques, sont, sauf preuve contraire, présumés exister\n\nau moment de la délivrance, à moins que cette présomption ne soit incompatible avec la nature du bien ou du\ndéfaut invoqué.\nPour les biens d'occasion, ce délai est fixé à douze mois.\nLorsque le contrat de vente d'un bien comportant des éléments numériques prévoit la fourniture continue\nd'un contenu numérique ou d'un service numérique, sont présumés exister au moment de la délivrance du\nbien les défauts de conformité qui apparaissent :\n1° Durant un délai de deux ans à compter de la délivrance du bien, lorsque le contrat prévoit cette fourniture\npendant une durée inférieure ou égale à deux ans ou lorsque le contrat ne détermine pas la durée de\nfourniture ;\n2° Durant la période durant laquelle le contenu numérique ou le service numérique est fourni en vertu du\ncontrat, lorsque celui-ci prévoit cette fourniture pendant une durée supérieure à deux ans.\nSous-section 2 : Mise en œuvre de la garantie légale de conformité"", ""Article L217-11\n\nLa mise en conformité du bien a lieu sans aucun frais pour le consommateur.\nLe consommateur n'est pas tenu de payer pour l'utilisation normale qu'il a faite du bien remplacé pendant la\npériode antérieure à son remplacement."", ""Article L217-3\nLe vendeur délivre un bien conforme au contrat ainsi qu'aux critères énoncés à l'article L. 217-5.\nIl répond des défauts de conformité existant au moment de la délivrance du bien au sens de l'article L. 216-1,\nqui apparaissent dans un délai de deux ans à compter de celle-ci.\nDans le cas d'un contrat de vente d'un bien comportant des éléments numériques :\n1° Lorsque le contrat prévoit la fourniture continue d'un contenu numérique ou d'un service numérique\npendant une durée inférieure ou égale à deux ans, ou lorsque le contrat ne détermine pas la durée de\nfourniture, le vendeur répond des défauts de conformité de ce contenu numérique ou de ce service numérique\nqui apparaissent dans un délai de deux ans à compter de la délivrance du bien ;\n2° Lorsque le contrat prévoit la fourniture continue d'un contenu numérique ou d'un service numérique\npendant une durée supérieure à deux ans, le vendeur répond des défauts de conformité de ce contenu\nnumérique ou de ce service numérique qui apparaissent au cours de la période durant laquelle celui-ci est\nfourni en vertu du contrat.\nPour de tels biens, le délai applicable ne prive pas le consommateur de son droit aux mises à jour\nconformément aux dispositions de l'article L. 217-19.\nLe vendeur répond également, durant les mêmes délais, des défauts de conformité résultant de l'emballage,\ndes instructions de montage, ou de l'installation lorsque celle-ci a été mise à sa charge par le contrat ou a\nété réalisée sous sa responsabilité, ou encore lorsque l'installation incorrecte, effectuée par le consommateur\ncomme prévu au contrat, est due à des lacunes ou erreurs dans les instructions d'installation fournies par le\nvendeur.\nCe délai de garantie s'applique sans préjudice des articles 2224 et suivants du code civil. Le point de départ\nde la prescription de l'action du consommateur est le jour de la connaissance par ce dernier du défaut de\nconformité.""]","Selon l'article L217-10 du Code de la consommation, le délai raisonnable pour la mise en conformité du bien ne peut être supérieur à trente jours suivant la demande du consommateur. Ce délai doit être respecté sans inconvénient majeur pour le consommateur, en tenant compte de la nature du bien et de l'usage recherché par celui-ci.",La mise en conformité doit avoir lieu dans un délai raisonnable qui ne peut être supérieur à trente jours suivant la demande du consommateur.,1.0,,0.699999999965,1.0
Le vendeur peut-il garder mon appareil en réparation pendant 2 mois sans me proposer de solution ?,"[""Article L217-13\nTout bien réparé dans le cadre de la garantie légale de conformité bénéficie d'une extension de cette garantie\nde six mois.\nDès lors que le consommateur fait le choix de la réparation mais que celle-ci n'est pas mise en œuvre par\nle vendeur, la mise en conformité par le remplacement du bien fait courir, au bénéfice du consommateur,\nun nouveau délai de garantie légale de conformité attaché au bien remplacé. Cette disposition s'applique à\ncompter du jour où le bien de remplacement est délivré au consommateur."", ""Article L222-15\nLe fournisseur rembourse au consommateur dans les meilleurs délais et au plus tard dans les trente jours\ntoutes les sommes qu'il a perçues de celui-ci en application du contrat, à l'exception du montant mentionné\nau premier alinéa de l'article L. 222-13. Ce délai commence à courir le jour où le fournisseur reçoit\nnotification par le consommateur de sa volonté de se rétracter.\nLe consommateur restitue au fournisseur dans les meilleurs délais et au plus tard dans les trente jours\ntoute somme et tout bien qu'il a reçus de ce dernier. Ce délai commence à courir à compter du jour où le\nconsommateur communique au fournisseur sa volonté de se rétracter.\nSection 5 : Dispositions particulières"", ""Article L217-10\nLa mise en conformité du bien a lieu dans un délai raisonnable qui ne peut être supérieur à trente jours\nsuivant la demande du consommateur et sans inconvénient majeur pour lui, compte tenu de la nature du bien\net de l'usage recherché par le consommateur.\nLa réparation ou le remplacement du bien non conforme inclut, s'il y a lieu, l'enlèvement et la reprise de ce\nbien et l'installation du bien réparé ou du bien de remplacement par le vendeur.\nUn décret précise les modalités de la mise en conformité du bien."", ""Article L217-8\nEn cas de défaut de conformité, le consommateur a droit à la mise en conformité du bien par réparation ou\nremplacement ou, à défaut, à la réduction du prix ou à la résolution du contrat, dans les conditions énoncées\nà la présente sous-section.\nLe consommateur a, par ailleurs, le droit de suspendre le paiement de tout ou partie du prix ou la remise de\nl'avantage prévu au contrat jusqu'à ce que le vendeur ait satisfait aux obligations qui lui incombent au titre du\nprésent chapitre, dans les conditions des articles 1219 et 1220 du code civil.\nLes dispositions du présent chapitre sont sans préjudice de l'allocation de dommages et intérêts."", ""Article L217-23\nLe producteur peut consentir au consommateur une garantie commerciale l'engageant pendant une période\ndonnée, supérieure à deux ans, dénommée “ garantie commerciale de durabilité ”. S'il propose une telle\ngarantie commerciale de durabilité, le producteur est directement tenu, à l'égard du consommateur, de réparer\nou de remplacer le bien, pendant la période indiquée dans l'offre de garantie commerciale de durabilité ; il est\négalement tenu de mettre celle-ci en œuvre dans des conditions identiques à la garantie légale.\nLe producteur peut offrir au consommateur des conditions plus favorables que celles décrites au premier\nalinéa.\nLes exigences prévues à l'article L. 217-22 sont applicables à la garantie commerciale de durabilité.""]","Selon l'article L217-10 du Code de la consommation, la mise en conformité du bien doit avoir lieu dans un délai raisonnable qui ne peut être supérieur à trente jours suivant la demande du consommateur. Par conséquent, si le vendeur garde votre appareil en réparation pendant 2 mois sans vous proposer de solution, il ne respecte pas le délai légal de mise en conformité. Vous avez le droit de demander une solution, telle que le remplacement du bien ou la résolution du contrat, conformément à l'article L217-8.","Non, la réparation doit être effectuée dans un délai maximum de 30 jours.",0.8333333333333334,,0.5833333333041666,1.0
J'ai rapporté mon téléphone en panne au SAV il y a 40 jours. Ils n'ont toujours pas fini la réparation. Puis-je exiger l'annulation de la vente et le remboursement ?,"['Article L217-17\nLe remboursement au consommateur des sommes dues par le vendeur au titre de la présente sous-section\nest effectué dès réception du bien ou de la preuve de son renvoi par le consommateur et au plus tard dans les\nquatorze jours suivants.\nLe vendeur rembourse ces sommes en recourant au même moyen de paiement que celui utilisé par le\nconsommateur lors de la conclusion du contrat, sauf accord exprès de ce dernier et en tout état de cause sans\nfrais supplémentaire.\nSous-section 3 : Mises à jour', ""Article L217-9\nLe consommateur est en droit d'exiger la mise en conformité du bien aux critères énoncés dans la sous-\nsection 1 de la présente section.\nLe consommateur sollicite auprès du vendeur la mise en conformité du bien, en choisissant entre la\nréparation et le remplacement. A cette fin, le consommateur met le bien à la disposition du vendeur."", ""Article L222-15\nLe fournisseur rembourse au consommateur dans les meilleurs délais et au plus tard dans les trente jours\ntoutes les sommes qu'il a perçues de celui-ci en application du contrat, à l'exception du montant mentionné\nau premier alinéa de l'article L. 222-13. Ce délai commence à courir le jour où le fournisseur reçoit\nnotification par le consommateur de sa volonté de se rétracter.\nLe consommateur restitue au fournisseur dans les meilleurs délais et au plus tard dans les trente jours\ntoute somme et tout bien qu'il a reçus de ce dernier. Ce délai commence à courir à compter du jour où le\nconsommateur communique au fournisseur sa volonté de se rétracter.\nSection 5 : Dispositions particulières"", ""Article L217-13\nTout bien réparé dans le cadre de la garantie légale de conformité bénéficie d'une extension de cette garantie\nde six mois.\nDès lors que le consommateur fait le choix de la réparation mais que celle-ci n'est pas mise en œuvre par\nle vendeur, la mise en conformité par le remplacement du bien fait courir, au bénéfice du consommateur,\nun nouveau délai de garantie légale de conformité attaché au bien remplacé. Cette disposition s'applique à\ncompter du jour où le bien de remplacement est délivré au consommateur."", ""Article L217-26\nLorsqu'il propose des réparations forfaitaires, le vendeur informe le consommateur par écrit ou sur un\nsupport durable, au plus tard lors de la conclusion du contrat, le cas échéant, de l'origine de la panne, de la\nnature de l'intervention envisagée et des pièces à remplacer.\nIl informe dans les mêmes conditions le consommateur que ce dernier ne bénéficie pas de la garantie\nlégale de conformité pour les pièces ou fournitures fournies à titre accessoire dans le cadre de la prestation\neffectuée, à moins que celles-ci constituent l'objet principal du contrat conclu ou qu'elles n'aient été acquises\npar le consommateur dans le cadre d'un contrat de vente distinct.""]","Selon l'article L217-17, le remboursement au consommateur des sommes dues par le vendeur au titre de la garantie légale de conformité doit être effectué dans un délai de quatorze jours suivant la réception du bien ou de la preuve de son renvoi par le consommateur. Dans votre cas, le SAV n'ayant pas encore fini la réparation de votre téléphone après 40 jours, vous avez le droit d'exiger l'annulation de la vente et le remboursement conformément à cet article.

Vous pouvez donc demander au vendeur d'annuler la vente et de vous rembourser dans les quatorze jours suivant votre demande. Si le vendeur refuse ou ne respecte pas ce délai, vous pouvez envisager d'autres recours tels que faire appel à une association de consommateurs ou saisir les autorités compétentes.","Oui, car le délai maximal de 30 jours pour la mise en conformité est dépassé, ce qui ouvre droit à la résolution du contrat (article L. 217-14).",0.25,,0.6791666666496875,0.0
